id,book,round,status,category,title,description,source_file,source_paragraph,source_path,keywords
LAT033-001,红色11,提取轮,待校对,法权,办案以党国损失压倒无罪,史处长：什么优待？那些问案的，一开口就说：“史子文啊！我们知道你是老共，你今天落网了，赶快承认了帐，免得受苦。”我一否认，他们就拍案怒骂，连十八代祖宗都被他们侮辱了。有一个二十来岁的小鬼，他当我的孙子还差不多哩！居然对我说：“史老先生，我老实告诉你：我们局长做事是很果决的，他交给我们办的案子，都是只许成功、不许失败的。你看，被我们请进来的人，哪一个可以不认罪就放出去呢？局长给我们绝对的权力，犯人不认，准许我们采取各种办法，直到他认罪为止。要是硬挺到底，耐打耐揍，坚不承认，那就不要怪我们狠！我告诉你，那时你只好被抬着走出这个大门。你在我们局里做过事，并且做到一级主管处长地位，是行家，你知道，释放一个犯人无罪出去，对党国的损失有多大？你现在不认，迟早也要认的。皮肉之苦，实在不好受，我们也不是没有辣椒水和老虎凳。我是好意劝你，为的是要救你，不是要害你，你好好想一想！”你想想看，以我的年纪，真的再坐老虎凳、灌辣椒水，或者是痛打一顿，岂不是真的要被抬着走出调查监狱的大门了吗？没办法呀，我不情愿死在里头，只好明讲：我史子文不会“想”，请他们告诉我，该认什么，我就认什么，自白书也请他们写给我抄。——这么一来，我当然不至于挨揍了，哪里是什么优待？,002.第一幕——夏至.txt,27,《大李敖全集6.0》分章节/004.小说剧本类/003.红色11/002.第一幕——夏至.txt,"侦讯,无罪,党国,法权"
LAT033-002,红色11,提取轮,待校对,法权,办案可以不靠证据,史处长：怎么不提？当时承办我案子的，是我苏北同乡科长刘昭祥，他的两条腿不一样长，走起路来一颠一颠的，凸出的黑眼球在玳瑁镜框中旋转，像一只蛤蟆，外号就叫“跛脚蛤蟆”。他的是非标准也人如其腿。我问他：“说我是共产党，你们要拿出证据来。”他说：“我们办案还靠证据吗？你想一想，过去你是怎么办案的？”我说：“我们是自己人啊！”他冷笑说：“自己人？你已经是我们的敌人了。话又说回来，如果你是自己人，你更应该对组织坦白，组织会饶恕你。不过，如果你还不招，我们就知道不给你吃一点苦头，你不会承认，我们要帮忙你思考。”我知道所谓帮忙思考，就是大刑伺候，我内行，我招了。,002.第一幕——夏至.txt,29,《大李敖全集6.0》分章节/004.小说剧本类/003.红色11/002.第一幕——夏至.txt,"证据,刑求,共产党,法权"
LAT033-003,红色11,提取轮,待校对,政治,党国忠诚也会被机器吞噬,史处长：唉！除了报应、报应、报应，我还能说什么？我为国民党和它的政府，卖命卖了四十年，却被它们交在一群无知的小喽啰手里，对我逞凶恣暴，摧残我的身心，毁辱我的名誉，这才是我最痛恨的！试问：那些调查员、军法官、监狱官兵，算什么东西？讲抗日，他们还没出生；谈反共，他们只在课本上读到；对党国，他们屁贡献都没有的。国民党却把我们这些抗日反共有功的人，交给那批小子来凌虐逼迫，诬良为匪！像这样没是非、没人性的勾当，居然也干得出来，真的，国民党不亡哪有天理！,002.第一幕——夏至.txt,37,《大李敖全集6.0》分章节/004.小说剧本类/003.红色11/002.第一幕——夏至.txt,"国民党,政府,忠诚,政治"
LAT033-004,红色11,提取轮,待校对,法权,疲劳审问先毁人格,华老师：我受过三天三夜、四天四夜、五天五夜的疲劳审问，疲劳审问时只骂不打，但是骂的部分包括对你人格的羞辱，例如问我：“姓华的，你有几个爸爸？”我回答说：“当然只有一个。”但特务说：“混帐，你不是有十个爸爸吗？从实招来！说，说你有十个爸爸！”然后，他们在旁边拍手，高声喊叫作乐。有时候说让你睡一下，但不到五分钟十分钟，又大喝一声：“谈话！”一切继续，由头开始。把给你的所谓休息，像剁一条蛇一样，剁成好几节，这叫休息吗？你的口供他们不满意，不客气的就来了，花样多得很。那时我留着大胡子，他们罚我自己拔胡子三十根，眉毛三十根，要一根一根地拔。每次多一根也不行，拔不出来也不行。拔完了，他们说：“好了，好了，这游戏不玩了，换别的。”别的是什么？换成自打嘴巴——逼令你自己打自己的嘴巴，非用力打、非打出红肿不行。此刑他们美其名为“自我惩罚”，其实意在侮辱你。还有一种叫“吃豆腐乳”——逼令吃下咸豆腐乳，叫你口渴难忍，让你胃疼。还有一种叫“跪象棋”——象棋子置放地上，叫你跪在棋子上，棋子又小又硬，承受身体的重量后，让你膝盖疼。这些花样，还都是客气的，因为他们还君子动口不动手，还没到他们动手阶段。到了他们动手的阶段，就是另一种花样了，左右开弓打耳光、用香烟烧你指头、用原子笔或棍子戳你胸口和肚子，等等等等，花样层出不穷。还有一种叫“踩地杠”，脱下袜子，咬在嘴里，不许掉落。然后，踩地杠，两腿半跪，脚踝后面加一根直径约六公分的横棍，棍子的两端，由两个人用力压住，一条彪形大汉站在棍子中间，用力摇晃。啪的一声，棍子断了，我也昏过去了。还有一种叫“背宝剑”——把你一手从肩部朝后向下，一手从背部朝上，再以手铐从你背部铐住双手，使你涕泗滂沱，痛楚万般。他们知道我最怕此刑，所以经常使用。曾有一段时间，我天天挨受此刑，苦不堪言。受此刑时，特务恐吓说：“一天只须交代一件事，这件事必须是我们认为有价值的，否则不打开。”曾有一次，挨受“背宝剑”时，同时还刑上加刑，踩地杠了。还有一种叫“灌辣椒”——用辣椒羼在白醋里，插入皮管，灌我的肛门。肛门外边，直肠里头，热如火灼，痛如刀割，那种痛苦，完全没法形容了。,002.第一幕——夏至.txt,43,《大李敖全集6.0》分章节/004.小说剧本类/003.红色11/002.第一幕——夏至.txt,"疲劳审问,刑求,人格羞辱,法权"
LAT033-005,红色11,提取轮,待校对,法权,女性政治犯遭遇性化刑求,龙 头：还有更残忍的呢！就是对付女学生，对付他们眼中的女共产党。也是用牙刷刷阴部阴蒂，送到火烧岛的女政治犯中，至少有九个案例。也有的女学生阴部因受伤、发炎而腐烂，在看守所中上吊自杀的。根据特务解释，书生论政，好谈人格，伪装圣人，对付书生之道，就是脱光他们的衣服，赤裸裸的恢复他们原来的面目，让他们体会自己也是一个求生存的动物。共产党中男学生女学生都是书生，所以直接刑求脱光后的要害。,002.第一幕——夏至.txt,50,《大李敖全集6.0》分章节/004.小说剧本类/003.红色11/002.第一幕——夏至.txt,"女政治犯,刑求,特务,法权"
LAT033-006,红色11,提取轮,待校对,方法,革命不能只靠左倾幼稚,史处长：（动气）我闻闻看，开玩笑说吧，我闻到一股乳臭，乳臭未干的乳臭。如果列宁活着，列宁会骂你们这种大学生犯了他所谓的“左倾幼稚病”，凭你们十几个大学生，想在台湾推翻国民党，你们是盲动主义者，怎么样？串连吧！串连到第十九个人，就踩了地雷吧？给抓起来了。,002.第一幕——夏至.txt,67,《大李敖全集6.0》分章节/004.小说剧本类/003.红色11/002.第一幕——夏至.txt,"左倾幼稚病,革命,台湾,方法"
LAT033-007,红色11,提取轮,待校对,方法,革命判断要看时间空间,史处长：别忘了那是什么时候！什么地方！那是在1921年，那是在大陆，那时间那空间，政府的力量罩不住，搞革命，成功了可以进北京南京，失败了可以上山下海，今天呢？在台湾小岛上，北京南京都早给人搞走了。上山嘛？警察挡着，要有入山证，没证件上不了山。下海嘛？东边太平洋，西边台湾海峡，你去跳吧！别小看了在台湾的国民党，国民党在大陆被共产党打得落花流水，在台湾可神气活现呢，抓你们这些自己封的共产党，就像瓮中捉鳖，手到擒来，沦落到这景美军法看守所十一房，不是吗？你不承认与我们同是匪类，你总得承认与我们“同是天涯沦落人”吧！,002.第一幕——夏至.txt,69,《大李敖全集6.0》分章节/004.小说剧本类/003.红色11/002.第一幕——夏至.txt,"时间,空间,革命,方法"
LAT033-008,红色11,提取轮,待校对,法权,坐牢是制度化互相折磨,史处长：这就是坐牢啊，不是让你舒服、让你不别扭。坐牢不是只坐在那儿，坐牢是包括牛鬼蛇神聚在一起，龙蛇杂处、鸡兔同笼，互相折磨，除非像我们十一房龙头那样，一坐五年，弄个“书桌”，老神在在、高高在上、笑傲江湖、阅人无数，而我们这些新科小生像你、新科老生像我、像华老师，都是龙头的配角，我们坐牢，都没他沉得住气、没他快乐，我们个个整天怨天尤人，不是吗？你这位大学生啊，请多向龙头学习，龙头不是共产党，可是他比共产党还共产党，一闻就是个狠角色，政府抓他，一点都没抓错，他是真正挖了国民党的根的人，政治斗争只是改朝换代，龙头搞的是思想斗争，他换了人们的脑袋，他才是真的先知型的共产党（指头对着龙头，上下点着）。,002.第一幕——夏至.txt,71,《大李敖全集6.0》分章节/004.小说剧本类/003.红色11/002.第一幕——夏至.txt,"监狱,政治犯,折磨,法权"
LAT033-009,红色11,提取轮,待校对,政治,共产主义的正义性最高,龙 头：（笑）多谢处长大人抬爱，并且高兴你把我当作共产党，你可真识货呢！你说对了，其实我心深处，真是共产主义者，因为我主张正义，而共产主义的正义性是所有主义中成分最高的。,002.第一幕——夏至.txt,72,《大李敖全集6.0》分章节/004.小说剧本类/003.红色11/002.第一幕——夏至.txt,"共产主义,正义,主义,政治"
LAT033-010,红色11,提取轮,待校对,政治,共产党尺度暴露正义缺席,史处长：从谁是共产党的尺度来看，就看出人间没有你主张的正义，在这军法看守所十一房里，一共四个人，四个人中我和华老师，两个假共产党；余三共，一个自封的共产党；你，龙头，一个深藏不露的思想上的共产党，四个人却有着不同的遭遇。以我和华老师的遭遇为例，就各有千秋，怪不怪？,002.第一幕——夏至.txt,73,《大李敖全集6.0》分章节/004.小说剧本类/003.红色11/002.第一幕——夏至.txt,"共产党,正义,军法,政治"
LAT033-011,红色11,提取轮,待校对,法权,七岁儿童团也能成为罪证,华老师：调查局逼迫我供认七岁在家乡参加共产党的儿童团，即所谓小鬼队。我在军法庭上，请他法官去函情报局查询：“共产党的儿童团，要几岁才能参加？”那个王八蛋的名叫聶开国的军法官先是不准，后来经过我的律师提出抗辩，律师说：被告请求调查有利证据，法庭没有不准之理。据他律师所知，共产党规定九岁的小孩要参加儿童团。七岁，根本不能参加。就算九岁参加了，也是被迫，也没有罪。这是问题的关键，法庭应该去函调查的。聶开国才没得话说。后来，情报局复函，果然说：共产党儿童团收容的是九岁以上的儿童。那个聶开国更混蛋了，他居然再去函情报局，问它：九岁的小孩才参加儿童团，有没有“例外”？有没有七岁参加的？情报局也是大混蛋，竟然回信说：也有例外。就算有例外，也不能证明我是例外中的一个呀！这不是硬把一块破烂的红布缝补在一件洁白的衣服上面吗？这就是我说的，你的案子是编织的，我的案子却是缝补的。,002.第一幕——夏至.txt,76,《大李敖全集6.0》分章节/004.小说剧本类/003.红色11/002.第一幕——夏至.txt,"儿童团,军法庭,罪证,法权"
LAT033-012,红色11,提取轮,待校对,法权,口供可以补造人生履历,华老师：正因为从七岁补起，案子就要一路补下来。我既七岁入了共产党儿童团，自然大了，就不能不入共产党了，于是做口供，在调查局入党。我被逼着写：“民国十六年，1927年，我在湘潭念书时，加入共产党。”后来他们一算：你民国三年生，民国十六年，只有十三岁！马上拉下脸来，拍案大骂：“你混帐！十六年？你只有十三岁，哪有资格加入共产党！你胡说！时间没那么早？你不肯吐实！打！再给我打！”我只好把入党时间延后，我被逼着写：“民国二十七年，1938年，我在湘潭一家旅社，两个朋友拉我加入共产党。事后三人还拥抱着高呼：‘毛主席万岁！’”后来他们一算，又说时间没那么晚，最后改为民国二十一年，1932年，他们才算满意。事实上，民国二十一年那年，哪来什么“毛主席”的称呼？又哪来什么“毛主席万岁”的口号？他们用心作了半天假笔录，以为天衣无缝，结果，由于他们的常识不够，还是露出马脚。总而言之，由于他们程度不够又胡搅蛮缠，问案时候，你会哭笑不得。例如一个特务，他一看到我就说：“不必问，你生出来时就是共产党。”我说：“为什么？”他说：“你是十月一日生的，就是共匪的国庆日，这就是证明。”我说：“那是农历。”他说：“农历是土共，照样是共产党。”我说：“我出生时，俄国还没革命，哪来共产党？”他说：“那是外国的事，外国不能干涉我们的内政。”你说好笑不好笑！,002.第一幕——夏至.txt,78,《大李敖全集6.0》分章节/004.小说剧本类/003.红色11/002.第一幕——夏至.txt,"口供,调查局,伪造,法权"
LAT033-013,红色11,提取轮,待校对,方法,黑牢也可转为人生历练,龙 头：举一个。中国有一些寓言，比伊索还伊索的寓言。“塞翁失马”便是其中之一，这则寓言说塞上的青年骑师的一匹好马跑掉了，跑到胡人的地区去了，朋友们来慰问他，他爸爸被称为“塞翁”的说：“此何遽不为福乎？”怎么知道这不是好运气呢？几个月后，那匹跑掉的马回来了，还拐回来胡人的好多匹好马，朋友们又来道贺，他爸爸塞翁说：“此何遽不能为祸乎？”怎么知道这不是走霉运呢？这时候一家都是好马，他儿子骑个痛快，一天从马上摔下来，摔断了腿，朋友们又来慰问，他爸爸塞翁说：“此何遽不为福乎？”怎么知道这不是好运气呢？过了一年，胡人大举入塞，打过来了。塞上的壮丁，人人保家卫国，多少人都战死了，这摔断腿的青年无法作战，逃过一劫，活了下来，这就是有名的“塞翁失马，焉知非福”的寓言。这则寓言很普通，很多人知道，但却不知道解释它的真髓。《淮南子》书里写这则寓言，只解释到“福之为祸，祸之为福，化不可极，深不可测”，事实上，塞翁老先生固然有“塞翁哲学”，却少了“管仲哲学”。什么是“管仲哲学”？高人面对人生，有他信仰的一些人生哲学，这种哲学可点出的有很多，其中最吸引我的是“因祸为福说”。大历史家司马迁评论管仲，说“其为政也，善因祸而为福，转败而为功”。人间的事，几乎都不脱“祸福倚伏论”，就是老子所说的“祸兮福之所倚，福兮祸之所伏”，这种理论衍发出人对祸福的控制到底有无能力问题，有多少能力问题。对高人来说，《孟子》的答案是说“祸福无不自己求之者”。《淮南子》的答案是“祸之来也，人自生之；福之来也，人自成之。祸与福同门，利与害为邻”。这些哲学都显示了祸中有福、福中有祸，祸福是一家的、是相贯的。照“塞翁失马”的老看法，塞翁对祸福之来，一律违规处理，表示无能为力，但对管仲说来这不只是看法问题，而是作法问题，祸来了，他可以“因祸而为福”，使不利转变成对他有利，换句话说，管仲相信人对祸福有控制能力，他可以并且善于因祸而为福，把失败转化为成功。《史记》书里记载的这个“管仲哲学”，范围是“其为政也”的，就是特指在政治方面他有因祸为福、转败为功的本领，其实，“管仲之器小哉！”他这种哲学，实在应该推而广之，适合人生的各方面。人生有多少不如意的事？照晋代贤者的估计，“天下不如意，恒十居七八”；现代的革命狂又重新估计，说不是十居七八，是十之八九。这么大比例的不如意事，全靠无所事事听其自然的塞翁哲学，固然可以善自宽解、随遇而安，但总觉得太消极了、太无为了、太听天由命了、太不管仲了。所以，我不能完全欣赏“塞翁哲学”，我比较喜欢“管仲哲学”。“管仲哲学”的精义是承认人生有祸事、有失败、有大量不如意，但是他面对祸事、失败、不如意，抱有一种信仰，那就是我要乘机转变它，因祸为福、转败为功，把不如意事化为对我有利，把人生百分之七八十、八九十的不如意事有以扭转，或者乘机歪打正着，捞到一笔。我的一位朋友的爸爸告诉他说：“如果在马路上跌倒了，不要立刻爬起来，先东张西望找找看，说不定会捡到什么宝贝，这一跤也不算白跌。”这位老爸，可真算得上是全世界最乐观的哲学家，他比管仲还管仲呢！所以，坐牢算什么？我要牢不白坐，天下没有白坐的黑牢，我要值回票价，关我的人也要付出代价。,002.第一幕——夏至.txt,158,《大李敖全集6.0》分章节/004.小说剧本类/003.红色11/002.第一幕——夏至.txt,"塞翁哲学,管仲哲学,坐牢,方法"
LAT033-014,红色11,提取轮,待校对,人格,不自由处也可守住自由,龙 头：记得《湖滨散记》的作者的话吗？梭罗坐牢的时候，他说他“从不曾想到我是给关起来了，高墙实在等于浪费材料……他们根本不知道如何对付我……他们总以为我唯一的目的是想站到墙外面。每在我沉思的时候，看守那种紧张样子，真教人好笑。他们哪里知道才一转身，我就毫无阻挡的跟着出去了……”。梭罗当然不会小说中穿墙透壁的功夫，他这种来去自如，是指观念上的解脱，观念上“从不曾想到我是给关起来了”。他虽然身在两坪之内，但却心在六合之外，神游四海，志驰八方，就像拉夫瑞斯在牢里写诗给情人一样。印度圣雄甘地师承了梭罗的不合作主义，也师承了梭罗的坐牢哲学。甘地说志士仁人在狱中，“肉体虽给关起来，灵魂并没关起来”，他的灵魂是自由的。这种看法的关键是强烈的唯心论，它告诉人们，所谓自由与不自由，“问题的关键，还在一个人自己和他所持的心理状态”，你心里觉得自由，自由就在；你心里觉得不自由，桎梏就在。甘地说他自己在狱中，和梭罗一样，身在网罗，却神游四海；人在监狱，却心在远方。他把自己分开了。甘地说：“他们抓了我，却给了我自由。”我把梭罗、甘地这种自由，叫作“不自由的自由”，因为不自由中有自由。,002.第一幕——夏至.txt,195,《大李敖全集6.0》分章节/004.小说剧本类/003.红色11/002.第一幕——夏至.txt,"梭罗,监狱,自由,人格"
LAT033-015,红色11,提取轮,待校对,人格,自由会被不自由纠缠,龙 头：不是，而是另一种心境纠缠住你。哲学家斯宾塞说：“没有人能完全自由，除非所有人完全自由；没有人能完全道德，除非所有人完全道德；没有人能完全快乐，除非所有人完全快乐。”这种伟大的透视力，伟大的胸襟，我给它下了一个描绘，这叫“自由的不自由”。“自由的不自由”的特色是民胞物与，是把受苦受难的人当兄弟，又使自己有责任感。夏禹感觉天下有淹在水里的人，就好像自己把他们淹在水里一样；后稷感觉天下有没饭吃的人，就好像自己使他们挨饿一样，有这种抱负的人，后天下之乐而乐，众生不成佛的时候，他自己不要成佛。《新约》《哥林多后书》第十一章里，为这种心境做了动人的总结：“有谁软弱，我不软弱呢？有谁跌倒，我不焦急呢？”有这种心境的人，他自己坚强，却感受兄弟的软弱；他自己站起，却焦急兄弟的跌倒；他自己自由，却念念不忘兄弟的不自由。当年，开火车出身的美国劳工领袖戴布兹，因参与政治反抗，被判十年，关在牢里。由于他极富人望，虽在牢里，却得到美国大选中，一百万选民对他戏剧性投票。1921年，哈定总统特赦了他。出狱后，人们庆幸他重获自由，他却从斯宾塞的句子里，说出了这样的千古名言——,002.第一幕——夏至.txt,199,《大李敖全集6.0》分章节/004.小说剧本类/003.红色11/002.第一幕——夏至.txt,"斯宾塞,自由,政治,人格"
