id,book,round,status,category,title,description,source_file,source_paragraph,source_path,keywords
LAT033-063,红色11,提取轮,待校对,人格,观念胜利先于实际胜利,龙 头：我们知道人间没有正义，但是我们至少要做到两点：第一，在观念上，要绝对弄清我们是在正义这边，我们在观念上、在知识程度上要百分之百胜利；第二，在实际上，我们努力使正义与力量结合，能结合一分就算一分，这方面的成绩没有百分之百，有时连百分之一都没有，但是，能做百分之一，也要做。简单说重点是，在观念上，我们不让伪君子占了便宜还卖乖，我们要拆穿他们；在实际上，拆穿以外要打倒、要革命、要改变、要补救，必要时候，要生死以赴，要一死了之，为理念而死。,004.第三幕——冬至.txt,189,《大李敖全集6.0》分章节/004.小说剧本类/003.红色11/004.第三幕——冬至.txt,"正义,观念,实际,人格"
LAT033-064,红色11,提取轮,待校对,人格,最坏准备逼近真正自由,龙 头：其实心理准备是从最基本面开始的，我来谈谈基本面。一个笑话说：有一个人，一辈子总是计较利害、滑头滑脑占便宜，死后阎王爷罚他来生变狗。他请求说：“要变狗可以，但请阎王爷把我变成母狗。”阎王爷问他：“为什么只要做母狗？”他说：“我念过一段古书，书上说：‘临财母狗得，临难母狗免。’所以想做母狗。”这个笑话的关键是“一段古书”，古书《礼记》中说：“临财毋苟得，临难毋苟免。”白话翻译是：“碰到金钱，不要随便拿；遇到危难，不要随便躲。”这个笑话中，这个人读书粗心大意，把“毋”字错成“母”字、“苟”字错成“狗”字，结果就把古书中要求人的行为给母狗化了。这个笑话，有它的示范意味，它告诉我们：人在利害当前想当母狗，是很通常的反应。人如何避免这种反应，还有赖于新的觉悟。人的价值开始在人能人化而不母狗化，在于人能有更高目标的追求。这种目标，是真理目标、是自由目标、是民主目标、是理想目标。这些伟大的目标，想做一个人的，无法不去献身；在反动势力的压制里，无法不去反抗。但是，从事这种献身与反抗，必须先得有点心理准备。追求真理的人、追求自由的人、追求民主的人、追求理想的人，在追求过程中，第一心理准备，不该是成功，而该是牺牲。因为，真理、自由、民主、理想，这些伟大的目标，都不是一蹴可几的、都不是容易到来的，在许多情况下，得到它们，需要多人的播种和多年的耕耘。并且，在它们生根、发叶、开花、结果的时候，往往你已经看不到了，你可能早已墓草久宿、化作春泥。这时候，你死而有知，自知“成功不必在我”；你死而无知，一切也就全盘由人。你生而为英、死而为灵，宇宙这么大，你一个志士仁人的作为，也就到此为止。反过来说，追求真理的人、追求自由的人、追求民主的人、追求理想的人，在追求过程中，如果第一心理准备不是牺牲，而是急于看到成果和收获，因而求近功、贪短利，因而对目标的完成没有耐心、因而把达成目标的过程看得太容易，这种心理准备，可就准备错了。在古往今来的伟人中，我觉得最能把握住正确的心理准备的，是印度圣雄甘地。甘地在献身与反抗的开始，他就首先认清牺牲是不可避免的，牺牲是必要的。甘地在南非从事与黑暗政府周旋的年代里，他领导南非的印度人，用大批入狱来表示他们的消极抵抗。在这种大牺牲里，有七十五岁的老太太哈巴津Harbatsingh，受不住煎熬，死在狱里；有十六岁的小女生维丽玛Villiamma R. Mudaliar，受不住苦炼，丧生鬼门。维丽玛临死前，甘地跑去问她感觉，十六岁的小女生说：“我不怕死，谁不愿意为祖国而死呢？”她死后，印度人为她建立了维丽玛堂，甘地激动的说：“她是用她自己的手，为她自己立庙，她的光荣典型，将永远活在我们心中。维丽玛之名，将与南非的消极抵抗及印度并垂不朽。”像十六岁小女生维丽玛这种牺牲，对甘地说起来，是什么感觉呢？甘地的感觉是，为崇高目标自苦的人，并不在乎牺牲。他说：“不经过苦火磨练的净化，没有一个国家能够兴起。母亲受苦，婴孩乃能有生命。种籽消失，乃能长出麦芽。生命来自死亡……进步应以受苦者所受苦难的多少来衡量……耶稣的受苦牺牲，使整个的悲惨世界得以自由。在此向前的迈进中，他不计算邻人因受苦所付的代价，自愿的或非自愿的。”甘地这种自我牺牲，又带领群众一起牺牲的决绝，就是他的“无情”。“他不计算邻人因受苦所付的代价”，因为在大目标的号召下，他无法妇人之仁。甘地说：“一点点生活的不舒适，不要看作是苦刑。我们都是自愿选择受苦的斗士，几个月的监狱生活，算不了什么。”正因为甘地以苦行僧的精神来看监狱中的同志，所以，他不但对别人入狱“无动于衷”，在他自己入狱的时候，也要别人“无动于衷”。他在狱中写信给同志，快乐的说：“……朋友们不需要惦挂着我，我觉得自己像一只快乐的小鸟，在这儿所能做的并不比外间少。我留居在此，对我有如进学校。”这种从容的、赴义的伟大精神，就是甘地不怕入狱、不怕牺牲的精神。乍看起来，他牺牲别人在所不惜，显得无情；但牺牲自己也在所不惜，又显得无所谓，这真是了不起的、大气磅礴的大人物气象。我个人深受甘地的影响，所以也变得有点对别人“无情”，对自己无所谓。我念一段我在牢里的日记给你（从“书桌”上书堆里抽出一张纸）：,004.第三幕——冬至.txt,221,《大李敖全集6.0》分章节/004.小说剧本类/003.红色11/004.第三幕——冬至.txt,"心理准备,自由,坐牢,人格"
LAT033-065,红色11,提取轮,待校对,人格,志士仁人不以坐牢为苦,由日记可见，志士仁人不以坐牢为苦，只把坐牢看成一点不方便而已。对监狱恐惧的人，显然对人生的荣枯浮沉与遭际，不敢实验与面对，这样的人生，是错误的、逃避的、缺少磨练的。有实验与面对精神的人，他不以小的不方便为苦，他有内发的至大至刚的充沛力量，去生活、去歌唱。小鸟在林间，它歌唱；在笼中，它也歌唱。快乐的小鸟在哪里都是快乐的小鸟。,004.第三幕——冬至.txt,227,《大李敖全集6.0》分章节/004.小说剧本类/003.红色11/004.第三幕——冬至.txt,"志士仁人,监狱,磨练,人格"
LAT033-066,红色11,提取轮,待校对,政治,岛上共产党有多种形态,龙 头：总结起来，今天这个岛上的所谓共产党，可有好多种，第一种是真共产党，这种真共产党，现在已经缺货了，找不到了、抓不着了；或者，采取一种给足国民党面子的说法，已经枪毙光了。第二种就是你们“成大共产党”，是真共产党，可是是自己封的，像是孙悟空自封“齐天大圣”一样。第三种是被诬陷的假共产党，像处长大人、像华老师、像老黄，多极了。第四种是“财迷共产党”，要领检举奖金反被套住，做了假共产党。第五种是“饭票共产党”，也是假共产党。,004.第三幕——冬至.txt,268,《大李敖全集6.0》分章节/004.小说剧本类/003.红色11/004.第三幕——冬至.txt,"共产党,国民党,政治分类,政治"
LAT033-067,红色11,提取轮,待校对,政治,牢饭也会制造饭票共产党,龙 头：“饭票共产党”是一种人，没饭吃，发现做了共产党，可以人人有饭吃，不过吃的是牢饭，吃牢饭也是一种饭，饭来张口，一日三餐，对挨饿的穷人说来，也不错呀！就有那么一个人，叫阮有成，本来是1949年被国民党抓来的老兵，有一次上山砍竹子，摔了一跤，恰巧一根尖竹子穿过他的膀胱，出院后小便失禁，就退伍了。退伍后三餐不饱，流浪街头，沦为乞丐，有一次有大官出巡，警察怕有碍观瞻，赶紧扫街，清除乞丐。他心想自己虽没为国捐躯，但至少捐出膀胱了，如今沦为乞丐都不准当，心头有气，就当街跟警察吵起来，警察就把他一顿拳打脚踢，他火了，忽然立正站好，举起右手高呼：“毛泽东万岁！”“中国共产党万岁！”他本就有一副好嗓子，因此声音非常嘹亮，无远弗届，连附近警察局里的都听到了，一下子跑出三四个警察，把他连推带拉的带进警察局。最后移送警备总部保安处，再移送军法处，判决有期徒刑七年，是典型的为匪宣传。奇怪的是，到了军法看守所后，阮有成发觉看守所比他在外面做乞丐的生活舒服多了——不愁衣食、不去求人怜悯、不必餐风宿露有一顿没一顿的、更不必提心吊胆的怕警察，他后来没想到有这么好的地方，他唯一担心的是七年后出狱怎么办？难友告诉他说，这还不容易，要出狱时，你在监狱门口再来一次“毛泽东万岁！”“中国共产党万岁！”不就得了？这样你每七年喊两声，一辈子就吃穿不尽了，多好啊！听说他就真的这么照办了。法律规定，监狱有最低处遇，就是政府对囚犯处境待遇不得低于一定的最低标准，当你自己的标准是乞丐的标准，政府一定输，连乞丐都做了，什么牢不能坐呢？一旦发现做了共产党、做了不判死罪的共产党，就真的人人有饭吃了，真的有了长期饭票了，又何苦而不为啊！说到这里，我还要给“饭票共产党”补充一点资料，我有一次趁班长不在，跟送开水的外役张小弟聊天，张小弟说外面伙房有个叫“詹怪物”的囚犯，食量极大，快出狱了，整天发愁，为什么呢？张小弟说：“那个怪物根本没有家，又没有钱，一出去，就又得饿饭了。他平日食量很大，在押房的时候，天天喊吃不饱；同房有人不吃馒头，送给他，他还不够。自从调到厨房当外役，他才每顿都可以把肚子装得满满的。这回要刑满出去了，怎不发愁？据他自己说，因为失业了好多年，口袋里一个钱都没了，想找工作，又到处碰壁。他不知道怎么搞的，居然想到监牢里来过活，又听说军法监狱的伙食比司法好，他就想办法要到这里来……”我问：“是有计划进来的？是怎样进来的呢？”张小弟说：“怪物自己说的，他写了一封信给调查局沈局长，声称要自首，因为他是共产党派来的，有一个组织；还有，在台东一个什么山上，设了一个秘密电台。调查局的侦防人员大为紧张，认为这是个大案子，就找到他。起初，对他很客气、很优待，请他住在旅馆里面，不把他送到监牢里，而且，三餐都由馆子叫了酒菜送到旅社来招待贵宾。问了两三天，听说写了好长的自白书，又做了很多笔录。这个怪物一直说，他有一个包括十八人的组织，名单也开出来了；又说，在台东某个山上，的确有座秘密电台，跟大陆经常通报。调查局的人很重视这案子，对他十分优待，希望他交代清楚，第四天，就押着他坐飞机到台东。到了台东，他们开了一部吉普车，带他到那个什么山上，找了一整天，什么电台也找不到。就问他：‘你究竟在搞什么呀？’怪物说：‘家里有一张地图，忘了带来，所以找不到电台了。’调查员只好又把他带回台北抄家，果然有一张手画的地图。怪物说：‘就是这一张。’调查员就又带他坐飞机到台东去，按照地图上指示的位置，寻找电台，寻了大半天，还是找不到。调查员很冒火地问他：‘究竟怎么回事呀？’他说：‘我……我忘记了。’他们把他再带回台北，这下子不住在旅馆接受优待了，他们把他关到调查局一间房里，一连追问了几天几夜，这怪物只好说实话了。他说，他因为没饭吃，又不敢偷、不敢抢，所以想出这个法子来混口饭吃呀！他这一说，可就惨了，调查员给了他一顿猛打，打得眼青鼻子肿的。后来，叫他要‘认一点罪’，不认，就要打死他。他就招认，说是‘民国二十五年在国军部队参加了共产党’。就这样，送到这里来，结果判了五年。”我问：“那他究竟是不是真的参加共产党了呢？”张小弟说：“谁知道？据他自己说，实在是没有参加。不过，调查局的人叫他要认一点，才不打他。他也觉得要认一点，才可以又不枪毙，又有一张长期饭票。所以，他虽然是冤枉的，却不但不埋怨，而且很满意，很心甘情愿的来坐冤狱。”这个故事证实了，不怕顶着共产党的帽子坐牢的，只有乞丐和大胃王了，乞丐阮有成和大胃王詹怪物真是有吃就好、无欲则刚啊！有道是说圣人才做得到共产党，现在知道圣人以外，乞丐和大胃王也可以鼎足而三了，只是后两者属于“饭票共产党”，要关在牢里才成。,004.第三幕——冬至.txt,270,《大李敖全集6.0》分章节/004.小说剧本类/003.红色11/004.第三幕——冬至.txt,"饭票共产党,牢饭,政治"
LAT033-068,红色11,提取轮,待校对,人格,人生阶段论化解坐牢处遇,龙 头：（笑）所以我从不喊冤，反倒喊爽。坐牢有时也很爽。我培养出一种人生观，就是清楚承认我眼前处遇的，是我人生中哪一种阶段。人生可分为生、老、病、死等阶段，也可分为幼年、少年、青年、中年、老年等阶段，但这种分法，太粗糙了，是不好解读的。要解读，必须分得更细，或因人而细分，或因事而细分，或因什么什么而细分。比如说，我的初恋，与情人的悲欢离合，就是一个阶段；比如说，我的坐牢，与敌人的长期周旋，就是一个阶段。人生会同时有好多阶段平行存在着、交错着，相互之间也许相关，也许不相关，这不重要。重要的是，我自己必须察觉阶段发生或结束时，得清楚承认现实，明明该结束的，让它告一段落，休恋逝水；明明该面对的，让它就此开始，勇于面对。对告一段落的往事，要能以不伤逝的潇洒去回首，告诉自己，那曾是我人生中的一段，有许多是幸福的彩云。但彩云易散也是人生的过程与常理，有开始必有结束，一如不幸也会有始有终，也是人生的过程与常理一样。就是这些一件件或幸福或不幸的阶段，才累积成我的今生，直到我最后一个阶段的到来，或寿终正寝，或死于非命。从这最后阶段往回数，我一生中，或因人而分，或因事而分，可能总结出几十个几百个阶段出来。在每一阶段来或去的当口，有的反应会很不习惯、很强烈，这时候，要用整个一生做一把尺，去量这一段，告诉自己：它只是一个阶段而已，它的来和去一定要潇洒的清楚承认，不要退缩，对智者达者仁者勇者而言，也没有什么好退缩的。上面这些“人生阶段论”的强调，目的在提醒自己：用分阶段的眼光去划分自己的一生，使自己清楚承认什么是山雨欲来、什么是彩云易散，因而明确的划分出自己，这是一种必须学会的本领。,004.第三幕——冬至.txt,288,《大李敖全集6.0》分章节/004.小说剧本类/003.红色11/004.第三幕——冬至.txt,"人生阶段论,坐牢,人格"
LAT033-069,红色11,提取轮,待校对,方法,人生阶段论要成为习惯,龙 头：要的。就像打字、游泳、骑车一样，它们不算是一种知识，它们是一种习惯，你要把“人生阶段论”当作一种习惯来运作，才算成功，才会立刻进入情况。比如说，以我这种反派人物，在中国，一定会坐牢的。坐牢是我必须的阶段，我不信宿命，但我清楚知道我难逃牢狱之灾。所以，一旦我坐了牢，我立刻把我的“人生阶段论”端出来，告诉自己“我的自由阶段过去了”，“跟小情人的幸福生活阶段也过去了”，我眼前处遇的，是一种新阶段，“是我的坐牢阶段”，我就转化心情，建立起新习惯来，说句笑话，我立刻“在三层楼上展开”我的新“阶”。,004.第三幕——冬至.txt,290,《大李敖全集6.0》分章节/004.小说剧本类/003.红色11/004.第三幕——冬至.txt,"人生阶段论,习惯,知识,方法"
LAT033-070,红色11,提取轮,待校对,方法,有为主义重在做过,龙 头：也不尽然，也有人为的部分，这是另一种必须学会的本领了。人间许多事情，你去做和不去做，往往有不同的效果。做了它和不做它，结果纵然看似失败，也是不一样的，这是“无为主义”和“有为主义”人生观的最大不同。“无为主义”相信“尝试成功自古无”，“有为主义”相信“自古成功在尝试”。我是相信“有为主义”的，因此我相信人生阶段的有和无、起和落、开始和结束，有的是可以人为操作的，因为可以有操作的空间，所以，可以把许多阶段处理得更为美好。我举汉武帝的李夫人为例。中国人描写女人的美，用“倾国倾城”，最早就是对李夫人说的。李夫人被形容为“北方有佳人，绝世而独立，一顾倾人城，再顾倾人国”，成为绝代佳人、美的偶像。可惜红颜薄命，得了要命的病，最后缠绵病床，眼看就要死了。汉武帝跑去看她，想见最后一面，可是李夫人却拒绝了。——为了给情人留下一个艳光照人的好回忆，而不是一个风姿憔悴的坏印象，她拒绝了人情之常的诀别。从人情之常观点看生离死别，大家见最后一面乃情所必至，理所当然，怎能不见？可是从唯美主义观点看，却不见更好，不见更美，李夫人知道自己就要死了，是人生阶段的结束，但结束得这么漂亮，这种“有为主义”，李夫人学会了。李夫人以外，再以唐太宗为例。唐太宗打下天下后，把侯君集等二十四位功臣，叫阎立本为他们一一画像，挂在凌烟阁，表示崇德报功，不忘革命情感。不料后来侯君集造了反，被抓住，依法非杀头不可，唐太宗对这位“朋友变成敌人”的老同志，非常痛苦。他哭了，他哭着向侯君集说：你造了反，非杀你不可，但你是我老同志，我不能不想起你、怀念你，我再上凌烟阁，看到你的画像，教我情何以堪？你死了，“吾为卿，不复上凌烟阁矣！”我为了你，再也不上凌烟阁了！侯君集被杀，对杀他的人说来，这也是一段人生阶段的结束，但结束得这么漂亮，这种“有为主义”，唐太宗学会了。,004.第三幕——冬至.txt,296,《大李敖全集6.0》分章节/004.小说剧本类/003.红色11/004.第三幕——冬至.txt,"有为主义,无为主义,行动,方法"
LAT033-071,红色11,提取轮,待校对,人格,军队和监狱训练男子汉,龙 头：我认为训练一个男子汉有两个最好的地方，一个是在军队，尤其在战场上，另一个就是监狱。如果在这两个地方你能够应付得好的话，你会更坚强、更壮大；应付不好的话，就会受尽折磨，痛苦万分。监狱的生活其实可以说有一百种，有的人可以过得很舒服，有的人则过得很苦，要看你个人用怎样的态度去过。当然监狱的环境也很重要，例如你单独住在一个牢房里是一种过法，两个人住在一起则是另一种过法，如果一间牢房有几个人十几个人则又是另一种过法，你要求安静都不可得。好了，现在胡牧师走了，目前只剩下你我两个人了，这十一房安静多了，从来没这样安静过，“死猪不怕开水烫”，你和我是最不怕（指着天花板上窃听器）这些零件的人，我们这下子可以畅所欲谈了。,004.第三幕——冬至.txt,324,《大李敖全集6.0》分章节/004.小说剧本类/003.红色11/004.第三幕——冬至.txt,"军队,监狱,坚强,人格"
LAT033-072,红色11,提取轮,待校对,政治,古典共产党以前仆后继为特色,龙 头：你弄拧了我的意思，我指的末代共产党是“古典共产党”。古典共产党的特色是赤手空拳起来革命，跟反革命的恶势力对干，前仆后继、之死靡它、坐穿牢底、横尸法场，千万人头落地以后，共产党当家作主了，再经过多少年的磨合期，搞不好又千万人头落地了，最后终于休生养息了，不乱斗了、不盲动了，那时候的共产党，是在大千世界中与资本主义世界既联合又斗争、与第三世界又联合又友好的共产党，可叫它做“圣之时者的共产党”。崇拜孔子的人说，孔子圣之时者，就是他是圣人，但却不是教条主义的圣人，而是与时俱进、与时代俱进、抓住时代又带动时代的圣人。既然圣人才做得好共产党，所以今之圣人就不再是当年革命狂的圣人了，还要革谁的命，革蒋介石吗？革国民党吗？蒋介石已经灰飞烟灭了，国民党已经五点钟下班了，这些反革命的人和党，他们已经像是沉船前的漩渦，“圣之时者的共产党”，绝不把大好青春浪费在他们身上。,004.第三幕——冬至.txt,334,《大李敖全集6.0》分章节/004.小说剧本类/003.红色11/004.第三幕——冬至.txt,"古典共产党,革命,政治"
LAT033-073,红色11,提取轮,待校对,方法,摩登共产党不必照古典方法,龙 头：是的，“圣之时者的共产党”就是“摩登共产党”，他们献身，但是不做烈士；他们拼命，但是不与子偕亡；他们也会马克斯一下，但那只是一下，马克斯的精神和心愿是好的，方法吗？世界革命也好，世界解放也罢，可得“八仙过海，各显神通”才行，靠十九世纪的一个仙人是不够了。因为资本家也不是十九世纪的了，他们比马克斯眼中的资本家坏多了、复杂多了。过去帝国主义者和资本家总是杀人越货，今后的呢？他们杀人不见血、越货不露白，吃你吐出骨头，可是你只是皮包骨了。最后你像是非洲人，今天资本家无须从非洲运黑奴去剥削了，不是吗？那种老式的剥削方法，早都落伍了，黑人都不要了，谁还要黑奴呢？,004.第三幕——冬至.txt,336,《大李敖全集6.0》分章节/004.小说剧本类/003.红色11/004.第三幕——冬至.txt,"摩登共产党,方法,革命,方法"
LAT033-074,红色11,提取轮,待校对,文化,道德也会生老病死,龙 头：是的，道德是一种有机体，道德也会生老病死。你有没有注意到很多道德项目，尽管活在书中——像“世界爷”活在加州，其实已跟我们同时而不同代了。我从道德项目中找一个“对敌人的道德”做例子。中国古代的名射手子濯孺子，侵略到卫国，卫国派人追他。他跟副官说：“今天我病了，没法射箭，看样子要死了，你知道追我们的人是谁吗？”副官说：“追我们的是庾公之斯。”子濯孺子说：“是他呀，那我死不了了。他是我学生尹公之他的学生，尹公之他是正人君子，他不会乱收学生的，他的学生也一定是正人君子。”过了一会，庾公之斯果然追上来了，奇怪的问子濯孺子：“老先生，你怎么手里不拿弓呢？”子濯孺子说他病了。庾公之斯说：“你是我太老师，我不能用你教我的技术来对付你，但今天也不能不公事公办。”于是他拔了四支箭，把箭头都敲掉，射了四下就走了。——这个故事，说明了一种不趁人于危的道德的延伸，即使对敌人也不例外。这种道德，现代已经死了。现代若有庾公之斯这种人，在战场上，看到敌人病了，恐怕还要乘机多射几箭呢。即使不射，回来也要被军法审判。古代的庾公之斯敢阵前放水，也明知他的后台老板跟他有同样的道德标准，就像小说中华容道放了曹操的关老爷一样，心里多少知道军法审不到他。,004.第三幕——冬至.txt,374,《大李敖全集6.0》分章节/004.小说剧本类/003.红色11/004.第三幕——冬至.txt,"道德,时代,文化"
