id,source_id,book,round,status,category,title,description,source_file,source_paragraph,source_path,keywords
LAT069-038,LAT069-046,李敖写的信,校对轮,已校对,知识,历史疑义要查原书,读者对我文中提到莫德惠劝进袁世凯做皇帝一事表示疑义，可请他查长沙黄毅编《袁氏盗国记》（第215页），此书民国五年5月由上海国民书社总发行，1962年6月有台北文星书店重印本。兹据原书复印一页，请代转致。此书中劝进名单内，尚有刘哲、贾士毅、贾景德、梁济、梁上栋、马建功、叶德辉、王揖唐、徐新六、梁鸿志、叶恭绰、陈垣、马小进、马建功等人。,037.莫德惠劝进袁世凯做皇帝及其他.txt,16,《大李敖全集6.0》分章节/008.书信函件类/012.李敖写的信/037.莫德惠劝进袁世凯做皇帝及其他.txt,"知识,历史疑义要查原书,莫德惠劝进袁世凯做皇帝及其他"
LAT069-039,LAT069-047,李敖写的信,校对轮,已校对,写作,写作计划须成套,此意亦极佳。我曾写过几章，题名《中国历史哈哈哈》，可是因为事忙，没有再继续写。现在我已跟《文星》正式办理bye-bye手续，不久后，当有时间续写下去。我有全套的写作计划，《中国历史哈哈哈》为其中之一。此生恐将以写作终古，故写作之计划，不可不“全套”也！,039.搜罗侦探小说等寄陈绍鹏.txt,14,《大李敖全集6.0》分章节/008.书信函件类/012.李敖写的信/039.搜罗侦探小说等寄陈绍鹏.txt,"写作,写作计划须成套,搜罗侦探小说等寄陈绍鹏"
LAT069-040,LAT069-049,李敖写的信,校对轮,已校对,政治,海外知识分子不能只顾学术,你还记得你的老师夏济安吧？我觉得他的作风很可作为“留学派”的代表：他主张“做犹太人运动”，主张中国知识分子在国外发挥个人的独特的光芒，表现一个中国人的知识的力量，所以他不择一切手段去外国，然后不择一切手段留在外国。这种作风，可算是达到“旅居异域”的最高代价。可是，事实的表现是，这些拼命留在外国的中国知识分子们，究竟在学术研究以外，为我们这个国家，还做了点什么普遍的、宽度的、积极的事呢？,040.论留学生立场复金戴熹.txt,11,《大李敖全集6.0》分章节/008.书信函件类/012.李敖写的信/040.论留学生立场复金戴熹.txt,"政治,海外知识分子不能只顾学术,论留学生立场复金戴熹"
LAT069-041,LAT069-050,李敖写的信,校对轮,已校对,文化,海外学人施助带隔膜,最近暑假到了，一些留美的“海外学人”，利用政府等机构的免费旅费，回来了不少，也跟我有过接触，他们有的也颇热情，很想为这个地区的青少年“施”点帮助。我这里用这个“施”字，你该知道我用得多么沉重！所谓“施”，是凭自己高兴，愿做多少就做多少。由于长年身居海外，对这个地区的隔膜，总是难免，但是他们的态度却很“自信”，俨然“老子们完全了解你们，了解你们这些土包子！”的姿态，——一副洋鬼子“支那通”的姿态。（所谓洋鬼子“支那通”，就是花一两年“研究”中国语文，——靠廉价中国学人协助“研究”，然后砉然出现，俨然全盘了解中国，并随时妄议，“指导”中国前途的发展！）,040.论留学生立场复金戴熹.txt,12,《大李敖全集6.0》分章节/008.书信函件类/012.李敖写的信/040.论留学生立场复金戴熹.txt,"文化,海外学人施助带隔膜,论留学生立场复金戴熹"
LAT069-042,LAT069-051,李敖写的信,校对轮,已校对,文化,海外杂志要有泥土气,十个月中，又一件大事是我在去年7月17号收到你们的《欧洲杂志》第一期，最近又在一家杂志社中看到第二期，后面有“侨务委员会海外侨民杂志登记台教新字第377号”等字样，知道你们已“奉公办理如仪”，获准进口，可贺可贺。不过杂志内容方面，可商量者颇多颇多，海外学人办杂志，能有“泥土气”，而与国内知识人声应气求，为第一难事。《欧洲杂志》至少目前在这方面并未成功，客气的说是“曲高和寡”；不客气的说是“跟国内脱节”“洋学究味太重”。我把我的看法，粗略奉陈如上，想你必不见老同学的怪吧？,040.论留学生立场复金戴熹.txt,15,《大李敖全集6.0》分章节/008.书信函件类/012.李敖写的信/040.论留学生立场复金戴熹.txt,"文化,海外杂志要有泥土气,论留学生立场复金戴熹"
LAT069-043,LAT069-052,李敖写的信,校对轮,已校对,政治,文星改组是党化接棒,此次《文星》事件，内中波澜之大，迥非外人所知。最后结局是奉命改组，老年人接了青年人棒子，清一色“KMT”代替了“非KMT”（萧孟能、李敖）。李敖与《文星》彻底bye-bye已成定局，萧孟能或将“留校察看”，唯已有实无名，正如同《文星》将有名无实。萧李合作时代，将成先秦之史，最近诸老尚在运动“萧李绝交”之事，此所谓“既生瑜，何生亮，李不死，萧不安”也！,051.致黎东方.txt,6,《大李敖全集6.0》分章节/008.书信函件类/012.李敖写的信/051.致黎东方.txt,"政治,文星改组是党化接棒,致黎东方"
LAT069-044,LAT069-054,李敖写的信,校对轮,已校对,写作,知识人遣词要能交通,你说：“……同样一个观念可有许多不同的表达方式，为了达成目的，方法是须要考究的，这方面我比较赞同殷海光先生和李声庭先生的遣词技巧。”对你的意见，我的看法稍有不同。我觉得中国知识人的最大通病，就在于他们的文章只能给某一阶层的人读，结果常常是学究对学究，酸夫子对酸夫子，教授对教授。在相类的阶层以外，常常是“不能交通”，或影响力极弱。这种恶果，主要的原因是中国知识人的“遣词技巧”太差劲，他们不脱书袋气，所以总是匠味十足！,047.知识人怎样影响群众？.txt,5,《大李敖全集6.0》分章节/008.书信函件类/012.李敖写的信/047.知识人怎样影响群众？.txt,"写作,知识人遣词要能交通,知识人怎样影响群众"
LAT069-045,LAT069-055,李敖写的信,校对轮,已校对,写作,影响群众先写好文章,我的基本看法是：中国知识人如果真想影响群众——广大的群众，必需先从“写一手好文章”开始，否则的话，他们只能在一个小天地里互相吹捧陶醉，只能博妻孥弟子之一粲，对广大群众的真正推动，恐怕还很遥远！——妻孥弟子的声节，并不就是广大群众的赞赏啊！,047.知识人怎样影响群众？.txt,6,《大李敖全集6.0》分章节/008.书信函件类/012.李敖写的信/047.知识人怎样影响群众？.txt,"写作,影响群众先写好文章,知识人怎样影响群众"
LAT069-046,LAT069-056,李敖写的信,校对轮,已校对,方法,表达方式须抓住群众,你说：“同样一个观念可有许多不同的表达方式”，这似乎是对的，但是——讚源兄，让我不谦虚地说——我实在不知道还有比我李敖更能“抓住群众”的方式，我甚至要套法国写实派的格言，只相信有“并且只有”一种方式。对群众心理的了解（尤其是他们的变化与冷暖），我自信比学院派的朋友们老练得多——尤其是曾和国民党合作过，同搞文化宣传的朋友们。这也就是你们所说的：“李敖这人最聪明，他早就看准了！”我这种自命不凡的劲儿，你该不会笑我罢？,047.知识人怎样影响群众？.txt,7,《大李敖全集6.0》分章节/008.书信函件类/012.李敖写的信/047.知识人怎样影响群众？.txt,"方法,表达方式须抓住群众,知识人怎样影响群众"
LAT069-047,LAT069-057,李敖写的信,校对轮,已校对,政治,以暴易暴破坏改革平衡,今晚我所说的中国问题的真解决，主要的意思是“以暴易暴”绝难成功，并且代价太大，功不补患。所谓“以暴易暴”，不论是在何种名义下做出（如“革命”，如“暴动”，如“政变”等等），都是容易导致一种和平改革的破灭，一种balance的失衡，并且总是要连年政战一大阵子。名义上虽然是“吊民伐罪”，可是老百姓在没被“吊”以前，却先得尝尝被“吊”的滋味，这种谑画，真是对“救国志士”的最大讽刺！,048.致王崇五论反以暴易暴.txt,4,《大李敖全集6.0》分章节/008.书信函件类/012.李敖写的信/048.致王崇五论反以暴易暴.txt,"政治,以暴易暴破坏改革平衡,致王崇五论反以暴易暴"
LAT069-048,LAT069-058,李敖写的信,校对轮,已校对,政治,解救者也会害死浑沌,我们看到袁世凯“既除”后的“群盗起”的场面，我们不得不惊讶这真好像是一首“预言诗”！如今，我们对“功臣”领教了一个够，对古人“圣人不死，大盗不止”的哲学，也憧憬了不少。今晚我这些谈话，乃是一个半夜三更不睡觉的自诩“五十年后历史家”的长久深思的痛苦结论，这个结论带我想起中国寓言中的那个“浑沌之死”——解救“浑沌”的人，竟是最后害了他的人！,048.致王崇五论反以暴易暴.txt,16,《大李敖全集6.0》分章节/008.书信函件类/012.李敖写的信/048.致王崇五论反以暴易暴.txt,"政治,解救者也会害死浑沌,致王崇五论反以暴易暴"
LAT069-049,LAT069-059,李敖写的信,校对轮,已校对,政治,斩尽杀绝没有太平,唉！“杀尽不平方太平”，“杀尽不平方太平”，什么时候才是斩尽杀绝的太平日子呢？最后的胜利者，又保证是谁呢？我想到George Orwell的《一九八四年》，也许全世界还有十八年的好日子！,048.致王崇五论反以暴易暴.txt,19,《大李敖全集6.0》分章节/008.书信函件类/012.李敖写的信/048.致王崇五论反以暴易暴.txt,"政治,斩尽杀绝没有太平,致王崇五论反以暴易暴"
LAT069-050,LAT069-060,李敖写的信,校对轮,已校对,知识,意识形态译名更足义,2.official ideology你译“公定的‘理论’或‘主义’”，ideology —词，中文的“理论”“主义”似乎不足以尽之。周德伟译为“意理”（这是从《三国志》中来的），有人译为“意的牢结”（音译）或“意识形态”……但都不能使人满意。我认为还是以“意识形态”稍好。,049.给M（彭明敏）之一.txt,5,《大李敖全集6.0》分章节/008.书信函件类/012.李敖写的信/049.给M（彭明敏）之一.txt,"知识,意识形态译名更足义,给M（彭明敏）之一"
LAT069-051,LAT069-061,李敖写的信,校对轮,已校对,政治,独裁常制造盲目爱戴,5.“党的宣传机关必把党首绘成‘超人’（super-human)，尽量把他‘神圣化’（deification)，在他周围制造出神秘不可侵的气氛，不是要使人民爱戴他 而是要使人民畏惧他。”——这段最后“不是要使人民爱戴他”一句，最好不用肯定语气。因为独裁者和他的文警武警们，有的也曾真的妄想或深信人民有“爱戴”的可能或成分，所以也常常有“笑脸”“吊丧”“施恩”“德意”等等出现。一些“奴性过多”的人民，也多少会发生“盲目爱戴”的情形。,049.给M（彭明敏）之一.txt,8,《大李敖全集6.0》分章节/008.书信函件类/012.李敖写的信/049.给M（彭明敏）之一.txt,"政治,独裁常制造盲目爱戴,给M（彭明敏）之一"
LAT069-052,LAT069-062,李敖写的信,校对轮,已校对,政治,自由人须阻止全体主义,9.Totalitarianism之完全成功，在“统制技术”的高度进步下，并非绝不可能。George Orwell的Nineteen Eighty-Four，至少描绘出“个人”无法击溃“集体”的状态。自由人必须刻意努力，方能阻止“1984”的来临。一般说法太偏重在“独裁必败”等预言，而不知“独裁之败”，“必”自由人努力以赴，才能得到，否则真可能“万劫不复”矣！尊文最后，似宜就此点多加论列一下（若做比喻或举例用，Gore Vidal的小说Messiah，在某些方面，更可补助George Orwell的书）。,049.给M（彭明敏）之一.txt,12,《大李敖全集6.0》分章节/008.书信函件类/012.李敖写的信/049.给M（彭明敏）之一.txt,"政治,自由人须阻止全体主义,给M（彭明敏）之一"
LAT069-053,LAT069-063,李敖写的信,校对轮,已校对,政治,文人应多做理论建树,以上十条，是我对你这篇一万字长文的读后“条陈”，草草上言，不成意思，只是聊报尊命，表示对这篇功力甚深的文字的敬意而已。中国人政治意识太低太低，实在需要这类的文字，来指示涂辙、来普渡迷津。我辈文人，只是集体主义者的俎上肉，生逢乱世，盼能于苟活之外，多做些理论建树，少做（或不做）man of action。凡是涉身中国实际政治，我的成见是：“善恶皆不可为！”因为在普遍的观点上，不论你的“敌人”或你的“友人”，他们的政治意识都在水准以下，他们都不脱盲动蛮来的味道，结果总是为他们所害所浼，使吾人之素志更不得伸，这又何苦来？,049.给M（彭明敏）之一.txt,14,《大李敖全集6.0》分章节/008.书信函件类/012.李敖写的信/049.给M（彭明敏）之一.txt,"政治,文人应多做理论建树,给M（彭明敏）之一"
LAT069-054,LAT069-064,李敖写的信,校对轮,已校对,政治,国家观念有进步演变,以上这些修正，都可明显的看到人类对国家看法的演变痕迹，Machiavelli 时代的“双重道德”（double morality）说，大都限于“人与国家”的关系。如今的“双重道德”，逐渐演化为“国家与国家”的关系了，这种情况，甚至可说是“三重道德”了！,050.给M（彭明敏）之二.txt,15,《大李敖全集6.0》分章节/008.书信函件类/012.李敖写的信/050.给M（彭明敏）之二.txt,"政治,国家观念有进步演变,给M（彭明敏）之二"
LAT069-055,LAT069-065,李敖写的信,校对轮,已校对,政治,文人不再为帝王鹰犬,从近代西洋政治思想史看来，对国家看法的演变痕迹，大体是进步的，这种进步，我们文人也分了一份。至少今日世界中，再也找不到一个法西斯式大文学家邓南遮（Gabriele D’Anmmzio）了！为拿巨棒者张目，论“文学侍从之臣”则有之，论“思想警察”亦有之，然皆为以文字为业者中的三流货或不入流货，真正第一流的知识人与文人，再也不肯“为帝王鹰犬”地走那条老路了！,050.给M（彭明敏）之二.txt,16,《大李敖全集6.0》分章节/008.书信函件类/012.李敖写的信/050.给M（彭明敏）之二.txt,"政治,文人不再为帝王鹰犬,给M（彭明敏）之二"
LAT069-056,LAT069-066,李敖写的信,校对轮,已校对,文化,学术代理商会包办美意,所以我说，“设置学术奖金”也好、“设置特别讲座”也罢，任何良法美意，在这个地区，都有被变成逾淮之枳的危险，都有被“学术代理商”包办或围标的可能。你过去代徐先生洽办的“科学促进会”，请的学界名流，结果如何，不是清清楚楚吗？又如“长期发展科学委员会”，原来的构想一何好！可是后来的演变一何糟！“研究补助”变成了“生活津贴”，这岂是胡适之所能预料的吗？,054.论文化基金寄汤元吉.txt,14,《大李敖全集6.0》分章节/008.书信函件类/012.李敖写的信/054.论文化基金寄汤元吉.txt,"文化,学术代理商会包办美意,论文化基金寄汤元吉"
LAT069-057,LAT069-067,李敖写的信,校对轮,已校对,文化,私人基金应拔尖,据你交给我的这三项徐氏基金的文件，它们的通例是避免“雪中送炭式”的。在这种学界黑暗的现状下，避免雪中送炭，就无异避免了“生活津贴式”的流弊。依我看来，以私人的力量资助国家发展科学，单走精选式的方法是正确的，私人的力量毕竟有限，私人的财力不该用来对学术界“普渡众生”，普渡众生是国家的事，私人的好意与表现，只该是“拔尖”、只该是“抢帽子”、只该对从“众生”中脱颖而出的出类拔萃人物，予以有效果而非乱送钱的奖助。从这种基点来看徐氏文化基金计划，我觉得有两个重点应该特别注意：,054.论文化基金寄汤元吉.txt,15,《大李敖全集6.0》分章节/008.书信函件类/012.李敖写的信/054.论文化基金寄汤元吉.txt,"文化,私人基金应拔尖,论文化基金寄汤元吉"
LAT069-058,LAT069-068,李敖写的信,校对轮,已校对,文化,学术奖金应精缩,一、在“设置学术奖金”方面，须知此种善举，只不过是聊备一格的奖金通例，究竟难脱不太有必要的“锦上添花”之嫌。所以我提议：此项支出应尽量缩减。办法中“每年举办一次”已嫌太多；又分甲乙丙三种，更易使财力分散。在这项名目下的奖金开支，实在应采“精”“缩”方式，名额减少，奖金不妨提高，甚至一名即可（如嘉新给吴健雄），如此把最多的钱，给最有成就的人，对群众的鼓励性与激发性，必然更大；对促进中国人民注目科学，也必然深具影响。（此类奖金的终极目标该是朝“中国诺贝尔奖金”方向走。“诺贝尔奖金”在性质上是属于我所说的“锦上添花式”，但是它对人的鼓舞作用，号召作用，该多么大！）,054.论文化基金寄汤元吉.txt,16,《大李敖全集6.0》分章节/008.书信函件类/012.李敖写的信/054.论文化基金寄汤元吉.txt,"文化,学术奖金应精缩,论文化基金寄汤元吉"
LAT069-059,LAT069-069,李敖写的信,校对轮,已校对,文化,唯精避免审议垄断,上面两个重点，都是“唯精是尚”的重点。因为“唯精”，所以才能找到第一流的国际水准的学人。由于这种学人是符合国际水准的，自然也就不会发生资格够不够的疑虑，自然也就少了这层麻烦，同时也减少了“学术掮客”的错误“审议”和垄断，而可避免——一、没资格决定把钱给谁的人，做了决定的流弊；和二、没资格拿钱的人，拿到了钱的流弊。,054.论文化基金寄汤元吉.txt,18,《大李敖全集6.0》分章节/008.书信函件类/012.李敖写的信/054.论文化基金寄汤元吉.txt,"文化,唯精避免审议垄断,论文化基金寄汤元吉"
LAT069-060,LAT069-070,李敖写的信,校对轮,已校对,人格,现实压力压垮轻诺,你廿七号午后一点多钟到我家好吗？或来同吃午饭。你的“出处”，我虽然自顾不暇，但仍愿尽力而为。我只请你知道我的力量（尤其在人事上的力量和金钱上的力量）实在有限。我的弱点之一是总不愿当面拒绝人和不愿算小钱，可是“现实”的压力却使我常常没有能力去兑现我的“轻诺”，没有能力去“千金散尽还复来”，结果往往使亲朋对我发生“错觉”。思念起来，都是时代迫人之过也！,055.给彦增老友.txt,4,《大李敖全集6.0》分章节/008.书信函件类/012.李敖写的信/055.给彦增老友.txt,"人格,现实压力压垮轻诺,给彦增老友"
LAT069-061,LAT069-071,李敖写的信,校对轮,已校对,法权,医疗救助应制度化,你当然知道，这一切现象，不是个人的问题（也不该是个人的问题），它应该进入制度，用制度来解决，用制度来协助一位爱国的中国士官治疗他的病。——既不需要他自己奔走求援，也不需要大官“施恩”。只可叹我们的制度还不完善，国家又太穷，以及其他杂七杂八的原因，总结起来，竟使你遭到这么大的难关，真叫人遗憾。,056.治病问题答唯英.txt,5,《大李敖全集6.0》分章节/008.书信函件类/012.李敖写的信/056.治病问题答唯英.txt,"法权,医疗救助应制度化,治病问题答唯英"
LAT069-062,LAT069-072,李敖写的信,校对轮,已校对,写作,胡适评传受资料限制,谢谢你给我的信，并谢谢你对我的关切。《胡适评传》二至十册的最大困难是资料问题和环境尺度问题。资料方面，已被有关方面把持，私人力量所能购买或运用的，不但有限，也很困难。（资料费用往往超过稿费，完全是赔本“生意”！）我当然还要努力克服这些困难，不过需要时间和“运气”。,056.治病问题答唯英.txt,7,《大李敖全集6.0》分章节/008.书信函件类/012.李敖写的信/056.治病问题答唯英.txt,"写作,胡适评传受资料限制,治病问题答唯英"
LAT069-063,LAT069-073,李敖写的信,校对轮,已校对,政治,公开信重名不可疏忽,对这封公开信，内容如何是另一问题；在外国报上发表妥否，也是另一问题，我都不想跟你讨论。我只是站在一个中华民国公民的立场，请你注意一下这封公开信于五月十六号在台湾各报发表时的严重的“签名重复”问题，其中朱建民、董事祁、何静安、郑小杰、卢英权、林碧沧诸“教授”的大名都出现两次，这种现象，简直不可以用“疏忽”来原谅，简直是“不负责任”！,057.致沈剑虹.txt,5,《大李敖全集6.0》分章节/008.书信函件类/012.李敖写的信/057.致沈剑虹.txt,"政治,公开信重名不可疏忽,致沈剑虹"
LAT069-064,LAT069-075,李敖写的信,校对轮,已校对,政治,群老当道也要听青年声,我已三十一岁，已似非“青年”，但在今天群老当道之日，犹可冒充青年一阵。今拟以青年一份子，想与先生做两小时谈话（两人对说，似非两小时不能尽情），先生可愿听听被贵党《醒狮》杂志一再攻击的一个佩服先生的青年人的说话吗？,059.致左舜生的信.txt,4,《大李敖全集6.0》分章节/008.书信函件类/012.李敖写的信/059.致左舜生的信.txt,"政治,群老当道也要听青年声,致左舜生的信"
