id,source_id,book,round,status,category,title,description,source_file,source_paragraph,source_path,keywords
LAT150-049,LAT150-064,恰似我的温柔,校对轮,已校对,人格,批判政治垄断的学者也应检视自己的学术垄断,我的批评如下：第一、一百六十二位教授所说国民党垄断政治资源的事，全没说错，但你们是什么？你们岂不是垄断政治资源下垄断学术资源的帮凶？垄断政治资源，还有走马换将之时；但你们身为学阀，却一干一辈子，是万年教授呢！你们垄断的，更精彩呀！垄断政治资源的，是男盗女娼属实；但男盗女娼垄断下庇荫、进而垄断学术资源的你们，又是什么？又该怎么称呼？第二、国民党的台北县长候选人，固是“徒以博士、学人头衔自居”的“心多旁骛”之徒，但尤清又何尝不和他半斤八两？尤清博士不是政大教授吗？他的学人论文何在？他的问政成绩（注意，是具体成绩，不是做秀），几年来不落空话者又几希？第三、一百六十二位教授，你们有几个不是国民党员或国民党同路人？有几个不是蒋氏父子“一党独大”、“唯胜是图”下，“荐才是瞻”中瞻出来的“青年才俊”？你们在蒋氏父子暴政下，可曾“基于学者的道德良知”，“联署”一下，放个抗议的屁？直到今天，你们还不敢公然退出国民党以示光明磊落呢！你们身为国民党员或国民党“一党独大”下受益人，却兴师动众，“不便反对国民党”，只以“支持并推荐民进党尤清”为小动作了，这哪里是光明磊落知识分子干的事？哪里是大丈夫干的事？你们太可耻了！太伪善了！你们不能为学术界留块干净土，总该为子孙留张少点肮脏的假脸吧？,023.斥一百六十二位教授.txt,5,《大李敖全集6.0》分章节\016.李敖祸台五十年庆祝十书\004.恰似我的温柔\023.斥一百六十二位教授.txt,政治垄断;学者;学术垄断
LAT150-050,LAT150-066,恰似我的温柔,校对轮,已校对,方法,没有证据的风评不是可靠的评人方式,以第一项标准而论，风评云云，根本是最不可靠的知人方式，古人匡章是一代大贤，但是风评却是不孝；陈平和直不疑都是一代名臣，但是风评却是盗嫂。不凭证据，风评又算什么？风评云云，根本是警察局的把戏。台湾警察局每以“风评不佳”把属员调差，原来澄社的水准，竟是警察局式的，并且其公正性，根本可疑，还不如警察局。,024.这叫什么“评鉴”！.txt,5,《大李敖全集6.0》分章节\016.李敖祸台五十年庆祝十书\004.恰似我的温柔\024.这叫什么“评鉴”！.txt,证据;风评;评人
LAT150-051,LAT150-067,恰似我的温柔,校对轮,已校对,方法,候选人评鉴应以实际问政表现为依据,以第二项第三项标准而论，试看得最高分的林俊义，全无问政或施政经历，只因为是澄社社员，就自行派为第一？这叫什么“评鉴”？苏秋镇在立法院，质询占全部立委三分之一、发言占百分之十，是世界记录；首删国防预算，是中国纪录，“十九名教授”给他评分三至六分，在九分的黄煌雄之下。但黄煌雄的质询，只有二十九次，苏秋镇却有四百二十六次，只相当苏秋镇的零头，这叫什么“评鉴”？至于连一次都没有的民进党候选人，一排一二十个在六至九分之间，均在苏秋镇之前，这叫什么“评鉴”？,024.这叫什么“评鉴”！.txt,6,《大李敖全集6.0》分章节\016.李敖祸台五十年庆祝十书\004.恰似我的温柔\024.这叫什么“评鉴”！.txt,候选人;评鉴;问政
LAT150-052,LAT150-068,恰似我的温柔,校对轮,已校对,人格,反对一方不正不能成为自己偏私的理由,我这里毫不替国民党讲话，只是替被“十九名教授”公然不公正对待的其他非民进党候选人讲话，谴责澄社人物的可耻。不可因国民党歪，你们就不正；不能因国民党私，你们就不公。这次所谓“评鉴”，你们竟如此幼稚而悍然的公开表示你们的偏见，还假托自由、学术之名，太可恶了；台湾的知识分子作践到这种地步，太恶心人了。,024.这叫什么“评鉴”！.txt,7,《大李敖全集6.0》分章节\016.李敖祸台五十年庆祝十书\004.恰似我的温柔\024.这叫什么“评鉴”！.txt,反对;不正;偏私
LAT150-053,LAT150-069,恰似我的温柔,校对轮,已校对,人格,困境中也能用非财物方式帮助更困难者,这是一个动人的故事，四十多年前，我读了它，深受感动。这故事告诉了人们，当你自己纵在困境中，也可以“不以财货为礼”的帮助更在困境中受难的人。,025.屠格涅夫的《乞丐》.txt,3,《大李敖全集6.0》分章节\016.李敖祸台五十年庆祝十书\004.恰似我的温柔\025.屠格涅夫的《乞丐》.txt,困境;帮助;财物
LAT150-054,LAT150-070,恰似我的温柔,校对轮,已校对,人格,安全时集体声援不能弥补危险时的沉默,这些人中，有的是我初中同窗、有的是我军中同队、有的是我学兄、有的是我学弟、有的是熟人、有的是不认识的。他们在今天，能为许信良案联名说几句话，其志可嘉。不过，令我不解的是，他们为何不在十年前的美丽岛案时联联名？或是更远一点的谢聪敏等案时联联名？也许十年前或更远一点的时候，他们心怀畏惧，不敢抛头露面，但是，一点屠格涅夫笔下的人物风格，他们似乎也不妨做做。许信良是以“二条三”（《惩治叛乱条例》第二条第三款）被判乱的，这种“二条三”的乱判，自判李敖十年以还，多年来所在多有，但是，我们一直未闻这些“学者”们有以异议或遗憾。直到今天——又安全又宜集体做秀的今天，方才看到他们一拥而上呼啸而出，使我不禁联想起屠格涅夫笔下的人物，对比之下，发觉总是有点怪怪的。,025.屠格涅夫的《乞丐》.txt,5,《大李敖全集6.0》分章节\016.李敖祸台五十年庆祝十书\004.恰似我的温柔\025.屠格涅夫的《乞丐》.txt,声援;危险;沉默
LAT150-055,LAT150-071,恰似我的温柔,校对轮,已校对,写作,集体署名作品意味着共同承担错误责任,国民党资本家蔡辰南，大家都知道他但在经济金钱上拆烂污，却不晓得他在文化学术上也拆烂污。——他曾以所谓“中华学术院”“中国文化大学”双料“企管研究所所长”的身份，及“国泰信托关系企业”“百科文化事业公司”双料“董事长”的身份，“总监修”了一部《21世纪世界彩色百科全书》，里面轻重失调、错误百出。而负责“撰稿及审订者”，乃由王文兴、王洪钧、网曾才、王德毅、江兆申、李永炽、李守孔、李符桐、何怀硕、那志良、林咏荣、林惺岳、林嘉诚、林钟雄、洪成完、孙同勋、许郎轩、许常惠、曹永和、张健、简又新、黄公伟、黄美序、杨崇森、杨云萍、杨维哲、邬昆如等一百三十六名教授学者出面，既然由众力众智联名完成，责任自然共同分担，谁也跑不掉。,026.记一位不会说英文的英国国王.txt,2,《大李敖全集6.0》分章节\016.李敖祸台五十年庆祝十书\004.恰似我的温柔\026.记一位不会说英文的英国国王.txt,集体署名;作品;责任
LAT150-056,LAT150-072,恰似我的温柔,校对轮,已校对,方法,百科条目必须核对人物亲属关系和译名,这里所说乔治一世是“英王詹姆士一世之孙”，是大错的，事实上，乔治第一是詹姆士第一的外曾孙，“嫁给汉诺威选侯（不该译为什么‘选举侯’）的苏菲亚”，是詹姆士第一的孙女。这部百科全书的解说，既不通又乱写。,026.记一位不会说英文的英国国王.txt,6,《大李敖全集6.0》分章节\016.李敖祸台五十年庆祝十书\004.恰似我的温柔\026.记一位不会说英文的英国国王.txt,百科;亲属关系;译名
LAT150-057,LAT150-073,恰似我的温柔,校对轮,已校对,文化,政客不读古书却爱乱引会制造集体无知,国民党、青年党、民进党三党立委都是无知的政客。可笑的是，无知倒也罢了，却还老是爱引古书、乱加张冠李戴。随手抽三个样，让我们见识见识。,027.国民党、青年党、民进党三党立委的集体无知.txt,2,《大李敖全集6.0》分章节\016.李敖祸台五十年庆祝十书\004.恰似我的温柔\027.国民党、青年党、民进党三党立委的集体无知.txt,政客;古书;引证
LAT150-058,LAT150-074,恰似我的温柔,校对轮,已校对,方法,核对古籍可以识破名言被政治领袖冒领,《立法院公报》第七十九卷第三十八期有国民党立委庄金生之言，说：“先总统蒋公说：‘德之不修，学之不讲，闻义不能徙，不善不能改，是吾忧也。’”这段话，《论语》（述而）明明写着：“子曰：‘德之不修，学之不讲，闻义不能徙，不善不能改，是吾忧也。’”明明是孔子的话，如今在无知的国民党立委嘴里，一代名言，竟被“先总统蒋公”抢去了。——此国民党立委之无知也！,027.国民党、青年党、民进党三党立委的集体无知.txt,3,《大李敖全集6.0》分章节\016.李敖祸台五十年庆祝十书\004.恰似我的温柔\027.国民党、青年党、民进党三党立委的集体无知.txt,古籍;名言;冒领
LAT150-059,LAT150-077,恰似我的温柔,校对轮,已校对,人格,不说救国空话的妓女可能比政客诚实,以妓女跟政客扯在一起，好像羞辱人，其实不然，该向我抗议的，其实是妓女才是。妓女卖身，只是卖身而已，她不谈救国救民等肉麻话，也不谈民进民退等恶心话，比政客高明得多。并且，照俄国文学家库普林（Alexander Kuprin）《亚玛》（Yama）一书的描述，那位妓女玛格达琳（Magdalene），简直是菩萨级的伟大人物，求诸国民党、民进党政客，连影都没有呢！,028.寄盼唐盼盼.txt,4,《大李敖全集6.0》分章节\016.李敖祸台五十年庆祝十书\004.恰似我的温柔\028.寄盼唐盼盼.txt,妓女;政客;诚实
LAT150-060,LAT150-078,恰似我的温柔,校对轮,已校对,方法,地理常识可以识破历史故事的捏造,看了这三段专栏的文字，我立刻想起：老包这种《自由时报》副刊主编兼专栏作家，历史程度未免太差劲了吧？亚历山大什么时候攀上过阿尔卑斯山顶了？他一生三十三年中，连阿尔卑斯山脚都没到过呀！阿尔卑斯绵亘于法国、奥地利、意大利、及瑞士之间，长达一千二百公里，它是中欧地区的山脉，距离亚历山大发迹的东南欧班都斯山脉，可谓八竿子打不着。亚历山大又何幸跑到它山顶之上？又何辜跑到它山顶之上？,029.亚历山大上了阿尔卑斯山顶么？.txt,3,《大李敖全集6.0》分章节\016.李敖祸台五十年庆祝十书\004.恰似我的温柔\029.亚历山大上了阿尔卑斯山顶么？.txt,地理;历史故事;捏造
LAT150-061,LAT150-080,恰似我的温柔,校对轮,已校对,方法,查原始传记可以纠正历史故事的虚构场景,至于说亚历山大“高处不胜寒……号啕大哭”之事，也全是胡说八道。照布鲁达克所记，亚历山大在得知世界之大无从全得而征之以后，曾为之堕泪。既未号啕于高处之寒，也没在阿尔卑斯放眼。老包对历史无知，信笔乱盖耳！,029.亚历山大上了阿尔卑斯山顶么？.txt,5,《大李敖全集6.0》分章节\016.李敖祸台五十年庆祝十书\004.恰似我的温柔\029.亚历山大上了阿尔卑斯山顶么？.txt,原始传记;历史故事;虚构
LAT150-062,LAT150-081,恰似我的温柔,校对轮,已校对,方法,隐性政治主张可以从用词倾向识别,我们的看法是，不论这一百九十二名人士如何巧妙修饰他们的词汇，他们宣示出来的整个精神，都有着鲜明的台湾本位的立场。同时在用字遣词之间，那么强调对中国统一的对立，对统一的行动视为被“侵略”、视为台湾被“出卖”、并把“统一是全中国人民的共同愿望”，视为不能成立的命题等等，其真正心事，都是呼之欲出的。一言以蔽之，这一百九十二位人士的宣示，其实是一种变相的台独、一种缓和的台独、乃至一种隐性的台独而已！正因为他们是变相的、缓和的、隐性的，所以，民进党中新潮流系狂热份子就看不惯了，新潮流系人马全部不肯加入，就是证明。当然，私利与派系之争，也是他们未能合流的原因，保台会的基础是美丽岛系，目的在保台会为幌子，开拓台湾百分之三十到百分之五十一的选票，但新潮流系认为这对他们自己的开拓不利，因而就抵制起来了。从私利和派系之争角度上看双方，就都等而下之了。,031.保台会与保国会.txt,9,《大李敖全集6.0》分章节\016.李敖祸台五十年庆祝十书\004.恰似我的温柔\031.保台会与保国会.txt,政治主张;用词;识别
LAT150-063,LAT150-082,恰似我的温柔,校对轮,已校对,政治,地区不能脱离更大历史地缘关系成为孤岛,我们的论列是一刀见血的。就是，保台会宣示的所有重点，其实都是站不住的。他们中，虽然不乏学者、律师、医生、从政者，……但是，最致命的共同错误，是他们有着“岛国的褊狭之见”（insular prejudice）的那种小格局。这种小格局，使他们完全忽视了在现代世界中，台湾对大陆那种无法自外、无法自脱、也无法自欺的关系。妄想摆脱海峡那边的穷地方与穷亲戚，不论列举的理由多么动人，但在事实上，全无可行性。穷地方与穷亲戚，其实是建立现代强国的一种必然的邪恶（a necessary evil）。英国诗人约翰敦（John Donne）说没有人是孤岛，其实在现代世界，也没有国是孤岛。台湾抛弃了大陆，它的格局，不是别的，只是孤岛。有世界性眼光的人、真正爱台湾的人，必然会有这种观察力，而不把台湾带入孤岛。但是，保台会一百九十二名人士的集体动作，却使我们看不出除了一厢情愿的孤岛情结外，还有什么。,031.保台会与保国会.txt,11,《大李敖全集6.0》分章节\016.李敖祸台五十年庆祝十书\004.恰似我的温柔\031.保台会与保国会.txt,地区;历史地缘;孤岛
LAT150-064,LAT150-083,恰似我的温柔,校对轮,已校对,方法,局部知识会遮蔽整体道理,为什么一百九十二名有头有脸的人，会集体做出幼稚的动作呢？原因无他，荀子所谓“蔽于一曲，而闇于大理”而已；“道……一隅不足以举之”而已；“曲知之人，关于道之一隅而未之能识”而已。——孤处小岛一隅，所见只是一隅、所论只是一隅，尽管在小事上优秀聪明，但一碰上大道大理，所有见识，只是台湾台湾台湾台湾而已，这是保台会集体的悲哀。,031.保台会与保国会.txt,13,《大李敖全集6.0》分章节\016.李敖祸台五十年庆祝十书\004.恰似我的温柔\031.保台会与保国会.txt,局部知识;整体;道理
LAT150-065,LAT150-084,恰似我的温柔,校对轮,已校对,文化,受教育者视野从国家退缩到地区是一种倒退,虽然如此，但保台会的悲哀其实也是中国的悲哀。九十三年前的“今日中国之士大夫”，犹能成立保国会以开拓视野；可是九十三年后，受过良好教育的“今日台湾之士大夫”，却目光如豆，仅知拥台自保了。这种退步，哪里是台湾的，那正是中国的悲哀。,031.保台会与保国会.txt,14,《大李敖全集6.0》分章节\016.李敖祸台五十年庆祝十书\004.恰似我的温柔\031.保台会与保国会.txt,教育;国家;地区
LAT150-066,LAT150-085,恰似我的温柔,校对轮,已校对,政治,反对党模仿执政党破格行为会走上民主歧途,为什么？因为违反民主的议会规格，根本就是民进党优为之的一条路。他们一开始就走上了歧途，结果相激相荡、有样学样，破格行事，非此不快，最后的陈水扁，又何能例外?,032.陈水扁就会这样！.txt,5,《大李敖全集6.0》分章节\016.李敖祸台五十年庆祝十书\004.恰似我的温柔\032.陈水扁就会这样！.txt,反对党;执政党;民主
LAT150-067,LAT150-087,恰似我的温柔,校对轮,已校对,方法,正当目的不能使不正当手段正当,二、正当的目的并不能使不正当的手段变成正当；,033.学者不可曲学阿世阿“阿扁”.txt,8,《大李敖全集6.0》分章节\016.李敖祸台五十年庆祝十书\004.恰似我的温柔\033.学者不可曲学阿世阿“阿扁”.txt,目的;手段;正当
LAT150-068,LAT150-089,恰似我的温柔,校对轮,已校对,人格,反对者犯下目的手段错误时更应受批评,正因为目的与手段的关系是已如此明确、如此重要，所以，一旦反对者自己，居然尽弃所学，犯了比鸡毛蒜皮的事更重要的错误的时候，我就不得不表示严重关切了。,033.学者不可曲学阿世阿“阿扁”.txt,16,《大李敖全集6.0》分章节\016.李敖祸台五十年庆祝十书\004.恰似我的温柔\033.学者不可曲学阿世阿“阿扁”.txt,反对者;手段;批评
LAT150-069,LAT150-090,恰似我的温柔,校对轮,已校对,人格,反对一党独大仍须守住立场和身份,八年前，黄石城以党外市长身份做彰化市长，与我通信，我提醒他，国民党彰化县委员会全县党员代表大会，邀请他登台致词，绝不是好现象。我告诉他：“国民党这一举动，是千方百计拉老兄做‘苏南成第二’的阴谋，聪明如老兄，当然一看即知。老兄在大党压境之下，为彰化县民谋福利，自有不得不出之以委蛇的地方，这是人们应该为老兄设想的。但是这种委蛇，分寸与程度还是很重要的。1966年，青年党元老左舜生同我说，当年他们应付国民党的方法是十二个字——‘团体不失立场，个人不失身份。’可是，我真的怀疑他们如何能做到这点，他们显然是失败了。为什么？分寸与程度，无法把握得紧耳！……老兄记得西德复兴的大政治家阿登纳（Kon-rad Adenauer）吗？阿登纳律师出身，1917年到1933年，一直做科隆（Cologne）市长（他也是科隆人）。1933年已是纳粹大党压境的时代，他以地方首长之尊，在其他地方首长一片媚骨之中，正气凛然，不与一党独大合作。最后他被拉下马，送到集中营。集中营主管对他说：‘好啦，请你不要自杀，只有你老是给我惹麻烦。您老六十八岁了，总之，也活不了太久了。’可笑这集中营主管狗眼看人低，他没想到这老囚犯活了下来，并且在一党独大垮台后，以清白之身，出任西德总理，一做十四年，从七十三岁做到八十七岁，成了有史以来，最难能可贵的也最坚苦卓绝的一个伟大身教。一般人只看到他七十三岁到八十七岁的十四年‘老走运’，却忽略了他五十七岁到七十二岁的十五年困顿生涯。这十四年的困顿中，他大部分的时间，都坐看自己的敌人张牙舞爪、坐看自己的生命垂垂老去，但是他甘愿一切牺牲，他就是不要同他看不起的政权合作。这种清白记录，使他在灰头土脸时候，干不成地方首长，却使他在扬眉吐气时候，干上了国家总理！……我写这个故事给老兄，目的无非鼓舞有头有脸的党外人士朝前看、朝远看，志在春秋与千秋，而别陷在近功与一时。老兄年纪同我相当，四十来岁，来日虽不可知，可是照常识看，似乎总比八十来岁的国民党有前途，为老兄计，老兄又何苦太委屈自己呢？”,034.黄石城懂什么“价值自觉”！.txt,4,《大李敖全集6.0》分章节\016.李敖祸台五十年庆祝十书\004.恰似我的温柔\034.黄石城懂什么“价值自觉”！.txt,一党独大;立场;身份
LAT150-070,LAT150-092,恰似我的温柔,校对轮,已校对,文化,没有道德自觉的人无资格主持价值教育,黄石城懂什么“价值自觉”！以他这样的人，大谈“加强国民明辨是非、分别善恶的能力”、“重整伦理道德，唤醒人性价值观”、“道德教育”等等，这个人，还有“自觉”的“价值”吗？,034.黄石城懂什么“价值自觉”！.txt,6,《大李敖全集6.0》分章节\016.李敖祸台五十年庆祝十书\004.恰似我的温柔\034.黄石城懂什么“价值自觉”！.txt,自觉;价值;教育
LAT150-071,LAT150-093,恰似我的温柔,校对轮,已校对,方法,政治评论不能因阵营立场忽略本方暴力,我们忍不住要问这些学者，你们义正词严的这些谴责，为什么谴责来谴责去，却独独漏了谴责“在国会”中打议长耳光的行为，这是什么意思？这叫什么公正？这难道是学者应有的实事求是态度吗？事件的祸首是张俊雄；事件的事实是张俊雄出手打人，全世界民主国家也好，极权国家也罢，任何制度、法律、惯例、标准、条件，都不允许有这种粗暴的、没教养的行为，你们为什么却独独漏了这关键与重点不提？反倒舍本逐末的扯什么警察、什么老委员、老代表？警察、老委员、老代表固然可议，但他们不是“在国会”出手打人之“本”，而是被动之“末”，“反对党的人数，在国会中微不足道，执政党无法应付，而必须动员军警情治人员，这是执政党的无能，是执政党的没落，是执政党的悲哀！”如此说成立，试问是否在民进党动手时，国民党只能由党籍立法围殴，才算得体？否则试问又如何“应付”？难道只有静静挨“微不足道”的少数人之打，才不“无能”、不“没落”、不“悲哀”吗？至于说“其实民主不死，今天国会的乱象，正是民意经过长期的压抑之后，要和党意、官意全面对抗，台湾的人民，绝对比老委员、老代表更要民主，更懂得民主的重要。”看了“台湾的人民”“要民主”、“懂得民主的重要”如彼，而表现出来的非民主手法如此，竟还得到学者的赞美，我们真不能不惊讶，这些学者的民主教养是怎么学来的！,035.一巴掌带来的省思.txt,8,《大李敖全集6.0》分章节\016.李敖祸台五十年庆祝十书\004.恰似我的温柔\035.一巴掌带来的省思.txt,政治评论;阵营;暴力
LAT150-072,LAT150-094,恰似我的温柔,校对轮,已校对,政治,政治暴力会羞辱民主制度并被后人仿效,张俊雄口口声声说他打一巴掌是在“羞辱”梁肃戎，其实梁肃戎者，一无耻老贼耳，早羞之不足为辱了。真正被羞辱的，乃是民主政治、民主政治、在萌芽中就被打了耳光的台湾民主政治。民主政治的最大特色，在于它是一种生活方式、一种教养、一种格调，这种种优良品质，形成了“其争也君子”。但是，台湾没有水准，竟以粗暴可以取宠于大众、以不入流可以人我同钦，这岂不给世界民主国家笑死？试问这种作风可以成立，有朝一日，你民进党当了政，别人是不是也照样对你粗暴呢？——当你摧毁了一种政治道德，你再要别人不再学样那是不太可能了。张俊雄说：“如果这巴掌打出任何后果，我承担。”但“后果”发生了，他又何从“承担”呢？朱高正会“承担”他坏榜样下的今日“后果”吗？“承担”了也太迟了。,035.一巴掌带来的省思.txt,9,《大李敖全集6.0》分章节\016.李敖祸台五十年庆祝十书\004.恰似我的温柔\035.一巴掌带来的省思.txt,政治暴力;民主;仿效
LAT150-073,LAT150-095,恰似我的温柔,校对轮,已校对,政治,不懂真民主是民主前途的真正障碍,我们认为，一巴掌事件，真正令我们痛心的，不在什么警察与老委员、老代表，警察是无知的工具；老委员、老代表是行将就木之人，他们不是民主前途的真正障碍。民主前途的真正障碍是大家（包括所谓学者）并不知道什么是真民主政治、不知道什么是真议会政治。,035.一巴掌带来的省思.txt,11,《大李敖全集6.0》分章节\016.李敖祸台五十年庆祝十书\004.恰似我的温柔\035.一巴掌带来的省思.txt,真民主;前途;障碍
