id,source_id,book,round,status,category,title,description,source_file,source_paragraph,source_path,keywords
LAT150-001,LAT150-001,恰似我的温柔,校对轮,已校对,方法,重读旧文可以辨认自己思想立场的变化,1966年7月7日，我写信给国民党新闻局局长沈剑虹，指出所谓国内学人教授一千五百余人驳斥美国姑息分子费正清的《致美国人民一封公开信》中的笑话，三十三年后我重看此信，发现当时我还是以“站在一个中华民国公民的立场”的口气写出的，比起后来完全否定中华民国的我来，未免太忠厚了。,001.一千五百余位学人及教授花名榜.txt,2,《大李敖全集6.0》分章节\016.李敖祸台五十年庆祝十书\004.恰似我的温柔\001.一千五百余位学人及教授花名榜.txt,旧文;思想立场;变化
LAT150-002,LAT150-002,恰似我的温柔,校对轮,已校对,方法,追究责任人比空泛批评事件更有效,我年纪愈大愈觉得：所谓“对事不对人”，其实是一种错误的方向，空泛揪出一件事的荒谬，倒不如揪出到底是什么人干出这件事，反倒是“春秋笔法”、更有效。直接开出名单、放出榜来，使这些人无所遁形，岂不更干脆，因此我决定“对人不对事”，做一附录，以见识见识三十三年前所谓学人及教授的嘴脸和软骨，比较起当时拒绝签名的殷海光、石锦等少数知识分子来，真不能不对拒签者另眼看待了。,001.一千五百余位学人及教授花名榜.txt,13,《大李敖全集6.0》分章节\016.李敖祸台五十年庆祝十书\004.恰似我的温柔\001.一千五百余位学人及教授花名榜.txt,责任人;批评;春秋笔法
LAT150-003,LAT150-003,恰似我的温柔,校对轮,已校对,写作,对外发布签名名单前必须修正重复署名,先生既然主持这封公开信的英译与传播，并且势在必行，我忍不住要写这封信来做一点提醒的工作，深盼能在英译本上改正，免得在洋鬼子面前闹笑话！,001.一千五百余位学人及教授花名榜.txt,21,《大李敖全集6.0》分章节\016.李敖祸台五十年庆祝十书\004.恰似我的温柔\001.一千五百余位学人及教授花名榜.txt,对外发布;署名;纠错
LAT150-004,LAT150-007,恰似我的温柔,校对轮,已校对,人格,反复改变阵营与立场是更高段的无耻,总之，说来说去，所有肉麻的话都从他的厚脸皮下和厚嘴唇里出笼了！我必须承认，我对古往今来，阅人无数，但是像苏南成这样不要脸的，我还是第一次见到。古往今来不要脸的，一般说来，脸不要得还有个分寸，换句话说，他们至多只“转变型的不要脸”，而不是“迴转型的不要脸”；是“去做浪子型”的不要脸，而不是“浪子回头型”的不要脸。只有苏南成能如此突出、如此迴转与回头，他的段数，真可说“前不见古人，后不见来者”，而要令那些低段的无耻之徒，要无颜见他、要掩面而退了！,002.台湾第一不要脸.txt,12,《大李敖全集6.0》分章节\016.李敖祸台五十年庆祝十书\004.恰似我的温柔\002.台湾第一不要脸.txt,政治立场;反复;无耻
LAT150-005,LAT150-008,恰似我的温柔,校对轮,已校对,政治,政党违反纪律接纳品行恶劣者会遗留恶果,苏南成十多年来所作所为，无一不证明他是一个反复无常的小人，不论对国民党、对党外、对黑社会、对任何罗盘方向的道德尺度，他都是一个“犯情重大”“品性过于恶劣”的不要脸的东西。国民党违背党纪，“率准恢复”这个不要脸的东西重新归队，这是非常可怕的一种短视与失落，国民党要自食恶果，并遗传流毒，也就自不待言了！,002.台湾第一不要脸.txt,15,《大李敖全集6.0》分章节\016.李敖祸台五十年庆祝十书\004.恰似我的温柔\002.台湾第一不要脸.txt,政党纪律;品行;恶果
LAT150-006,LAT150-009,恰似我的温柔,校对轮,已校对,文化,学术活动也可能沦为政治谄媚动员,很显然的，研讨会的真正目的无关学术，乃是动员两百个中外曲学阿世的马屁精，向蒋介石拍马屁耳！这种马屁，可谓之学术致敬。,003.三角马屁学.txt,4,《大李敖全集6.0》分章节\016.李敖祸台五十年庆祝十书\004.恰似我的温柔\003.三角马屁学.txt,学术研讨会;政治;谄媚
LAT150-007,LAT150-011,恰似我的温柔,校对轮,已校对,文化,集体学术谄媚会变成对统治家族的多面逢迎,一般人拍马屁，只会拍一面，而这些马屁精，却会拍三面。吾无以名之，鉴此学术，正所谓“三角马屁学”也！,003.三角马屁学.txt,18,《大李敖全集6.0》分章节\016.李敖祸台五十年庆祝十书\004.恰似我的温柔\003.三角马屁学.txt,学术;谄媚;逢迎
LAT150-008,LAT150-012,恰似我的温柔,校对轮,已校对,法权,反击捏造事实的诽谤不等于否定言论自由,我在台湾文海称雄，有一点对乔·路易斯自愧不如的是，我有时要在对方太不入流的时候，为了开道过路，也会挥拳施教，警告对方。所谓警告，并不是否定对方的言论自由，而是否定对方有捏造事实的诽谤自由、否定对方有假冒公正的中伤自由。遇到这种诽谤与中伤，我就会拆穿它，甚至打场官司，弄个明白。例如自立晚报在1986年10月22日登出大幅“李敖死了”广告，并附以李敖是水蛭等文字，显已触犯《刑法》第三百一十条诽谤罪（该书作者目前已下狱），并违反《中国新闻记者信条》第七条、违反《中华民国报业道德规范》第七项。我乃先在该报订下广告位置，届时以“吴三连死了”广告稿，要求刊登。该报以吴三连是他们发行人，悍然拒绝，可见该报自知登某某某死了的广告，是不道德的行为。既然自知如此，为什么要在李敖头上适用呢？,004.假冒公正的人，拆穿他！.txt,4,《大李敖全集6.0》分章节\016.李敖祸台五十年庆祝十书\004.恰似我的温柔\004.假冒公正的人，拆穿他！.txt,诽谤;言论自由;反驳
LAT150-009,LAT150-013,恰似我的温柔,校对轮,已校对,写作,批评不能用骂人标签取代证据回应,10月22日，我在世界论坛报上看到文中舞先生的大作——《报纸是社会公器，不是骂人的工具》，文中指摘我“以骂人为快事”的事，我不屑置答，因为他说李敖“骂国民党、骂民进党、骂台湾人、骂外省人、骂遍他所看不惯的中外古今人”，都是真的，但他以为一个骂字就可否定我文中的证据，他的大脑就未免太简单了。文中舞先生做学生时代，曾以真名林倖一写信向我求教，我认为他头脑不清，没有答他。如今他大谈《报纸是社会公器 不是骂人工具》、“应宜心存厚道”，不过，我奇怪文中舞先生的“厚道”，为什么不在自立晚报滥用公器与工具时显示显示，向他的老板吴三连抗争抗争，而要迟至今天，才显示他的所见所闻所思？由此可见，他的大脑不但简单，他的心地也非常“厚道”——对老板厚道。他的同党吴丰山为他的大作写序，说他“风骨嶙峋”，一个人肯为老板这样对外“嶙峋”，他的“风骨”，当然没问题啦！,004.假冒公正的人，拆穿他！.txt,5,《大李敖全集6.0》分章节\016.李敖祸台五十年庆祝十书\004.恰似我的温柔\004.假冒公正的人，拆穿他！.txt,批评;骂人;证据
LAT150-010,LAT150-015,恰似我的温柔,校对轮,已校对,政治,政党早已长期质变会使迟来退党理由失据,为什么说他们头脑都是浆糊？因为他们过去“继续追随”国民党的理由，和今天“已无继续追随之义理”，其中并无国民党的“质变”可言。他们以“敬仰先总理”的理由加入国民党，但他们却不知道，早在联俄容共时代，国民党就“时或不无偏阙之处”了。这一偏阙，“先总裁”“故主席”“功”“德”继之，偏安台湾。这一偏安，胡秋原何尝没有一份责任？今天中国统一联盟奉胡秋原为名誉主席，但最富讽刺意味的是：胡秋原当年，岂非破坏中国统一的健将？他参加“闽变”叛国，国号也改了、国旗也改了，割据地方，冒充“文化部长”，这种人，今日侈谈统一，岂不滑稽？谈也可以，但你胡秋原必须先退出国民党，以示无党身份；先辞去立法委员，以示无政身份，然后以“一介老儒”，要怎么就怎么，岂不光明磊落？若不此之图，既宣誓为党员，即应守党纪；既宣誓为立委，即应守行规，这才是“党内之伦理”、“追随之义理”，岂能个人单独行动？单独行动还不说，还比之于“继先总理北上而后之又一盛事”，真是比拟不伦！孙中山北上，是以国民党总理身份去的，如今国民党主席还在台湾，“一党员耳”身份的人，岂可如此越位？这又是哪国的伦理与义理？至于说国民党已“质变”云云，其实该党之“质变”，何代无之？联俄容共，此“先总理”时代之“质变”也；元勋易位，此“先总裁”时代之“质变”也；内举不避，此“故主席”时代之“质变”也。中国统一联盟诸君子若真识人间大义，则根本就不该加入早已“质变”的国民党，国民党自诸君子出娘胎之日，早已是“已质变之朋党”矣！又何至于四五十年后，受诸君子“入主出奴”哉？总之，国民党纵不肖，但待反复无常之胡秋原不薄、待诸君子亦过得去，今诸君子“依然含悲”而去，反要“焚香稟闻”于“先总理”，“先总理”有灵，真要“呜呼！悲哉！”矣！,005.怪哉！所谓集体退党.txt,4,《大李敖全集6.0》分章节\016.李敖祸台五十年庆祝十书\004.恰似我的温柔\005.怪哉！所谓集体退党.txt,政党;质变;退党
LAT150-011,LAT150-016,恰似我的温柔,校对轮,已校对,法权,解禁不能回避原查禁理由是否成立,不过，有一个原始的问题，还没解决，就是当年查禁《心锁》的理由，是否消失了。据1963年5月1日《自由青年》第二十九卷第九期谢冰莹《给郭良惠女士的一封公开信》，谢老太明明指出：“唉！良惠，为什么你要写这些乱伦的故事？女主角夏丹琪和丈夫的弟弟、丈夫的妹夫常常去北投通奸；她的父亲和表侄女通奸；她的母亲出去买菜去了，男朋友走近来强奸她；丈夫的弟媳妇，想要调戏哥哥……天！我真不忍写下去了，你骂天下的男女，都是衣冠禽兽，你赞成父子可以共妻，兄弟也可以共妻，这是个什么世界？”再据当年省政府驳回《心锁》诉愿书，明明指出：“《心锁》第354页等多处描述男女性关系前后或过程，足以刺激青年趋向乱伦及邪恶的途径，对社会贻害甚大。”可见所谓《心锁》刺激“乱伦”之说，依旧刊诸报章、载于公文。如今二十五年下来，《心锁》之伦，依然照乱，但朝野名流，却联名伏地挺身，为《心锁》请命矣，真不知“乱伦”之说，如何解决。如谢冰莹与省政府所言属实，则朝野名流，胡乱联名，何以自处？如所言不实，岂可让书一禁二十五年，方挺身抗争？你们的正义，竟迟来如此乎？,006.心锁·心锁·开.txt,4,《大李敖全集6.0》分章节\016.李敖祸台五十年庆祝十书\004.恰似我的温柔\006.心锁·心锁·开.txt,解禁;查禁理由;成立
LAT150-012,LAT150-017,恰似我的温柔,校对轮,已校对,法权,不追究查禁责任的迟来解禁不值得庆祝,回想当年《心锁》被禁之日，郭良惠在1963年2月12日征信新闻报上写《<心锁>的命运》，谄媚的说：“生活在民主的台湾，……以今天出版界的自由，《心锁》更可以由遭禁而解禁。”事实上，郭良惠一直等到了自己变成老太婆，她的“心锁”，才糊涂而开。她不敢追究官方、声讨官方，朝野名流也不敢，只会开香槟酒和稀泥而已，这种方式的解禁，是很可耻的，尚何庆祝之有哉！,006.心锁·心锁·开.txt,5,《大李敖全集6.0》分章节\016.李敖祸台五十年庆祝十书\004.恰似我的温柔\006.心锁·心锁·开.txt,查禁;责任;解禁
LAT150-013,LAT150-018,恰似我的温柔,校对轮,已校对,方法,批评他国人权必须用同一标准检视本地政权,上面这个宣言，在国民党自中央日报以下的大幅宣传下、在国民党自中央文工会主任以下的大力赞美下，它的公正性，也就愈发可疑。宣言的画龙点睛之处在以“台湾的执政党”做榜样，敦促中共，但是，试问台湾的开放党禁、报禁，才一年多，台湾四十年的戒严与不开放时候，你们的宣言又在哪里？为什么单单以台湾的标准，衡量一切？敦促“民选区县首长”吗？按照台湾的宪法第一百十三条，明明省长也是民选，为什么不敦促？为什么不谴责“台湾的执政党”违宪？是不是因为台湾不开放区县以上首长的民选，你们就降格以求了？说“释放政治囚犯”吗？为什么不敦促“台湾的执政党”也放放政治犯？说“删除刑法中关于‘反革命罪’的条文”吗？台湾的《惩治叛乱条例》又是什么？说“实行党政分开”吗？国民党比共产党在党政上的结合，岂不更炉火纯青？为什么不敦促？国民党总裁可在国库中私存个人名下黄金四千二百两，共产党主席却一两皆无，共产党再贪污腐化，也是小儿科呢，难道你们看不见？,007.如此敦促宣言.txt,3,《大李敖全集6.0》分章节\016.李敖祸台五十年庆祝十书\004.恰似我的温柔\007.如此敦促宣言.txt,人权;双重标准;政权
LAT150-014,LAT150-020,恰似我的温柔,校对轮,已校对,人格,只批外地特权却回避本地特权是双重标准,试看这一支援声明，随处都可发现它的“只看共产党，不看国民党”的离奇。声明中口口声声反对“特权的统治阶层”，但是台湾的“特权的统治阶层”，怎么视而不见？台湾的“特权的统治阶层”，其实比大陆婉约而细腻，并且密闭得更紧、互保得更严。试看大陆的“特权”中，父为显贵，而子在坐牢；夫为主席，而妻竟下狱，其权纵特，仍有其限度，但是台湾呢？又如声明中口口声声说“我们坚决反对因为政治意见与执政当局不同，而受到歧视与迫害”，其实台湾被“歧视与迫害”者，四十年来，又何日无之？又如声明中口口声声说“在自由民主的社会，人人皆可成为堂堂皇皇的异议分子”，其实说这话的每一个人，都未见其敢“堂堂皇皇”勇于为之，足见他们反倒成了台湾“自由民主”不过乃尔的人证；又如声明中口口声声说“我们认为大陆的大众传播媒体不应由政治当局所垄断”，其实不垄断的，只是他们这些花蝴蝶而已；又如声明中口口声声说“我们反对大陆的政党政治永远以中共做为领导”，其实大陆的知识分子一定好奇地问：台湾的政党政治，早给国民党“领导”了四十年了，你们的反对又在哪里？你们的勇敢又在哪里？你们的公道又在哪里？,008.如此支援声明.txt,4,《大李敖全集6.0》分章节\016.李敖祸台五十年庆祝十书\004.恰似我的温柔\008.如此支援声明.txt,特权;台湾;双重标准
LAT150-015,LAT150-021,恰似我的温柔,校对轮,已校对,人格,支援他人却借机溢美自己会暴露侍从心态,整个支援声明中，最画龙点睛的伏笔，端在自道所谓“台湾地区近年来自由化与民主化的某些进展”，其实这是一种可耻的描绘。支援别人，却溢美自己，文学侍从的心态，可谓呼之欲出。整体说来，这种支援是一幕笑剧。有个铁幕笑话说，美国人向苏联人夸口：我可以站在白宫前面，骂我们总统是王八蛋；苏联人说：这算什么自由，我也可以站在克里姆林宫前面，骂你们总统是王八蛋。如今所谓三十二位学者在台湾骂大陆，其可笑又何以异？他们不敢骂国民党，还五十步笑百步的隔岸丢人现眼、大出洋相，真笑剧哉！,008.如此支援声明.txt,5,《大李敖全集6.0》分章节\016.李敖祸台五十年庆祝十书\004.恰似我的温柔\008.如此支援声明.txt,支援;溢美;侍从
LAT150-016,LAT150-022,恰似我的温柔,校对轮,已校对,人格,集体签名会减损知识分子独立表达的纯度,一个人表达自己的意见，然后签名，这是正常的事；许多人表达共同的意见，然后签名，这是反常的事。为什么反常？因为人同此心、心同此理而有协同一签的情况，毕竟不多；它的一致性与必要性，也不无可疑。一窝蜂大家签了，总未免令“独与天地精神往来”的人看不顺眼，而认为简直是一群众口一声的动物在咩咩叫。尤其这种众口一声的签名发生在知识分子身上，更令人觉得不伦不类。因为知识分子的可贵品质之一就在贵有独来独往的精神，一旦跟人成群结队起来、一旦善与人同起来，对表达自己的意见，总难免减低了纯度。因此，集体签名的动作，在合群上，也许自成一说；但在纯度上，大都不足为训。习惯上，这种签名是搞群众运动的一种手段，知识分子一旦沦为给这种手段做工具，就太可悲了。,009.签名并发症.txt,2,《大李敖全集6.0》分章节\016.李敖祸台五十年庆祝十书\004.恰似我的温柔\009.签名并发症.txt,集体签名;知识分子;独立
LAT150-017,LAT150-023,恰似我的温柔,校对轮,已校对,政治,权力强迫的集体签名会使知识分子失格,在国民党统治下的知识分子，显然是太可悲的一群。他们为了求生、求名，是不敢违抗当局的意旨的。一九六六年，国民党文学侍从之臣胡秋原等人，写了《驳斥美国姑息分子费正清》的公开信，透过总政治部的压力，叫“国内学人教授一千六百余人”集体签名，在报上发表。事后胡秋原吹牛说，这封公开信，“一时发生相当大的影响”。事实上，“一时发生相当大的”，不是影响而是丑闻。因为一千六百余人“国内学人教授”的众口一声，适足反证了这些知识分子的被强奸。正因为是被强奸，所以失格的学人教授们，也就乱签一气，一千六百人中，因为在各校兼课而见名就签，以致光“签名重复”的，就有六起之多！其中朱建民、董世祁、何静安、郑小杰、卢英权、林碧沧诸教授，大名都出现两次，如此丑闻，真是今古奇观也！,009.签名并发症.txt,3,《大李敖全集6.0》分章节\016.李敖祸台五十年庆祝十书\004.恰似我的温柔\009.签名并发症.txt,权力动员;签名;失格
LAT150-018,LAT150-024,恰似我的温柔,校对轮,已校对,政治,政治权力会把臃肿的集体签名改成小股联署,这种二十年前的集体签名方式，随着时代的转变，也有了一些转变。国民党开始觉悟到，像这样一动员就一千六百人集体签名的干法，看来总未免过于臃肿。于是开始化整为零，改以小股的签名，俾收精简之效。,009.签名并发症.txt,4,《大李敖全集6.0》分章节\016.李敖祸台五十年庆祝十书\004.恰似我的温柔\009.签名并发症.txt,政治动员;签名;联署
LAT150-019,LAT150-027,恰似我的温柔,校对轮,已校对,人格,势利者可以在倨恭之间任意转换,其实，能前倨后恭的人，也未尝不是前恭后倨的人，这种人的嘴脸变化，可以倨恭随意、快慢如心。同一个康宁祥，也别有前恭后倨的嘴脸，令我们欣赏呢，我试举一例。,010.前倨后恭与前恭后倨.txt,6,《大李敖全集6.0》分章节\016.李敖祸台五十年庆祝十书\004.恰似我的温柔\010.前倨后恭与前恭后倨.txt,势利;倨恭;转换
LAT150-020,LAT150-028,恰似我的温柔,校对轮,已校对,方法,公开记录可以拆穿政治人物前后不一,我是绝不健忘的人，不健忘的人只要一拿出证据，一切真相，便可大白。国民党搞“三民主义统一中国”的“大笑话”，起源自1981年11月21日成立的“三民主义统一中国大同盟”，当时成立推行委员会，主任委员是何应钦，委员有九十八人，其中康宁祥之名，赫然在焉！这一证据，不但见于当时各报，且见于该同盟正式出版的《三民主义统一中国大同盟简介》第七页，由此可证，“以三民主义统一中国”，固然是“国民党口口声声要”；而民进党的中常委康宁祥者，亦未尝不口口声声要。自己七年后摇身一变，把“大笑话”全部栽在国民党头上，这种政治道德，其不入流程度，连国民党也自叹弗如也！,010.前倨后恭与前恭后倨.txt,8,《大李敖全集6.0》分章节\016.李敖祸台五十年庆祝十书\004.恰似我的温柔\010.前倨后恭与前恭后倨.txt,公开档案;政治人物;立场
LAT150-021,LAT150-029,恰似我的温柔,校对轮,已校对,人格,事后要求除名不能抹去多年公开参与,上面这件事，去年3月16日被我揭发后，《新新闻》周刊即在该刊第五十六期中袭我之意，刊出“康宁祥也被列名大同盟委员”的事。康宁祥看了，一窘再窘，乃投书《新新闻》，说：“本人被列名‘三民主义统一中国大同盟’委员一事，该会从未经本人同意过，本人并已正式具函该同盟将本人之名剔除。”可笑吧？当了七年公开的盟员，一朝被指摘，就“正式具函”妄想一推了事，这种以天下人都是傻子易欺；这种对国民党七年前恭敬从命于先、七年后傲慢回绝于后，是一种典型的前恭后倨，康宁祥可真脸黑心黑也！,010.前倨后恭与前恭后倨.txt,9,《大李敖全集6.0》分章节\016.李敖祸台五十年庆祝十书\004.恰似我的温柔\010.前倨后恭与前恭后倨.txt,除名;公开参与;责任
LAT150-022,LAT150-030,恰似我的温柔,校对轮,已校对,政治,民主社会用问责阻止政客长期欺骗多数人,"一百三十三年以前，林肯在美国伊利诺州演讲，有一句名言是：“你可以欺骗多数人于暂时，你可以欺骗少数人于永久，但你不能欺骗多数人于永久。”（You can fool some of the people all of the time , and all of the people some of the time, but you cannot fool all of the people all the time.）这段话，说得真是言简意赅，它对美国民主政治的教化，启迪良多。美国民主政治中，政客们敢于纵横捭阖者为数不少、敢于翻云覆雨者大有人在，但是敢于公然欺骗多数人者，却简直是稀有动物。为什么？因为你欺骗多数人，一旦穿帮，不但为同党所责、异党所怪，并且为群众所弃。搞欺骗多数人把戏的政客，在美国那种民主环境里是行不通的，因为他们的上上下下，有它基本的规矩、水平与格调，荒腔走板、横冲直撞的乱来，是要被喝倒彩的。",011.欺骗多数人于永久？.txt,2,《大李敖全集6.0》分章节\016.李敖祸台五十年庆祝十书\004.恰似我的温柔\011.欺骗多数人于永久？.txt,民主;问责;欺骗
LAT150-023,LAT150-031,恰似我的温柔,校对轮,已校对,政治,朝野和群众都可能共同作践民主制度,邪门的是，这种民主政治的规矩、水平与格调，却在国民党的教化下。民进党的作秀下、台湾群众的起哄下，变得全不是那么一回事了。该被谴责的，却获得称赞；该被禁止的，却获得鼓励；该集体脸红的，却恬不知耻；该七上八下内心不安的，却出动七爷八爷民俗表演来番外线作战。结果呢？朝野上下，大家都走火入魔了，什么司法尊严、什么立法规则、什么行政体制、什么政党规格、什么敌我立场、什么政治道德、什么选举承诺、什么诚信原则、什么人民眼睛是雪亮的，统统都要靠边站！我们实际看到的，只是国民党、民进党、台湾群众三方面的联手摧毁一个开明、进步的社会；联手作践了民主政治。,011.欺骗多数人于永久？.txt,3,《大李敖全集6.0》分章节\016.李敖祸台五十年庆祝十书\004.恰似我的温柔\011.欺骗多数人于永久？.txt,朝野;群众;民主
LAT150-024,LAT150-032,恰似我的温柔,校对轮,已校对,政治,低水准政治环境可以让政客长期欺骗多数人,看了整个的朝野上下的闹剧、看了全部的狂妄政客与妖妄群众，我真忍不住感到：林肯所说的“你不能欺骗多数人于永久”，他错了。像朱高正这种货色，在这样低级的台湾，原来是可以欺骗得永久的！,011.欺骗多数人于永久？.txt,6,《大李敖全集6.0》分章节\016.李敖祸台五十年庆祝十书\004.恰似我的温柔\011.欺骗多数人于永久？.txt,政治环境;多数人;欺骗
