id,source_id,book,round,status,category,title,description,source_file,source_paragraph,source_path,keywords
LAT150-025,LAT150-033,恰似我的温柔,校对轮,已校对,方法,评判他人勇气必须先检查自己的记录,康宁祥说他二十几年来看过多少政治人物面临身系囹圄时的德行，言下不无卑视之意，但他为什么不看看他自己？1983年，他被高雄市警察局长季锡斌告了一下，就赶忙跑去向国民党警察总监赔罪道歉。只不过是一件屁官司，还没囹圄临头呢，他就屁滚尿流了，他有什么资格奚落别人？一个二十几年来以没坐牢自得的胆小乖巧分子，居然还为谁谁谁勇敢下品评，这种厚颜，岂不太滑稽了吗？,012.色厉内荏的，挺身而出？.txt,3,《大李敖全集6.0》分章节\016.李敖祸台五十年庆祝十书\004.恰似我的温柔\012.色厉内荏的，挺身而出？.txt,勇气;记录;评判
LAT150-026,LAT150-034,恰似我的温柔,校对轮,已校对,人格,对强者示弱却对自己人施暴不是真勇敢,不过，事实上，朱英雄虽然看来比面目黧黑、两眼失神、表情猥琐的康英雄威武得多，可惜这一威武，只能“家里光棍”，出了门就不行。在“家里”，朱英雄可以在郑南榕的一记耳光下，纠众打得郑南榕头破血流；但出了门，在五二零事件中被宪兵派驻城中分局的中校联络官王伟骏痛殴时，他却只能抱头大喊“我是立法委员”！但发现眼前的专家是“专打立法委员”的时候，他只有倒地不起了。事后他表示原谅打他的人，但我们奇怪：他纠众围殴一位争取言论自由的“自己人”的时候，为什么不原谅一下呢？,012.色厉内荏的，挺身而出？.txt,5,《大李敖全集6.0》分章节\016.李敖祸台五十年庆祝十书\004.恰似我的温柔\012.色厉内荏的，挺身而出？.txt,强者;施暴;勇敢
LAT150-027,LAT150-036,恰似我的温柔,校对轮,已校对,人格,缺乏活力的知识分子只会把持现状,二十六年前，美国《纽约时报》的名记者窦丁（Tillman Durdin）、美国新闻处的副处长司马笑（John Alvin Bottorff）约了我，三个人在一家咖啡馆里谈话。在窦丁提出的问题里面，有一个很有味儿的题目，他问我：“为什么在台湾的这些大学教授们都显得活力不够？为什么他们不像韩国那些教授们那样生气勃勃、勇气十足？”我的答复是这样的：中国大学教授们不是没有像韩国那些教授们那样生气勃勃、勇气十足的情况，可惜那是四十多年前的事了，那是五四时代教授们的气象。现在不行了，现在他们老的老了、死的死了、堕落的堕落了。沦陷在大陆上的许多第一流的教授都被迫在“思想改造”下苦斗；而到台湾来的一些教授，大多是“二流货”和不入流的，他们在台湾岛上，十足表现出“没办法”和“无能”的丑态，这是不难想象的，他们只是把持住现状而已，根本谈不上什么进步与朝气了。,013.越澄越不清.txt,2,《大李敖全集6.0》分章节\016.李敖祸台五十年庆祝十书\004.恰似我的温柔\013.越澄越不清.txt,知识分子;活力;现状
LAT150-028,LAT150-037,恰似我的温柔,校对轮,已校对,政治,一流知识分子也可能从国民党骗局转入共产党骗局,为什么我向窦丁表示到台湾来的一些教授，大都是“二流货”和不入流的呢？因为当年第一流的知识分子，根本不会跟国民党走，换句话说，根本轮不到给国民党来骗——他们早被共产党骗走了。当时有良知有血性的知识分子，他们是不会跟国民党的。相对的，跟国民党来的，其流品也下矣！,013.越澄越不清.txt,3,《大李敖全集6.0》分章节\016.李敖祸台五十年庆祝十书\004.恰似我的温柔\013.越澄越不清.txt,知识分子;国民党;共产党
LAT150-029,LAT150-038,恰似我的温柔,校对轮,已校对,文化,新学阀可能继承旧学阀缺点却丢掉优点,那些流品也下矣的知识分子，在台湾，形成了学阀；同时，国民党“学术与政治之间”的人物，也大量渗入知识界，流风所及，几十年来，一蟹不如一蟹，不但第一流的知识分子杳不可得，甚至老一代学阀的一些格调，新一代也视而不见。新学阀跟老学阀不同的是，老学阀的缺点新学阀都学到了，老学阀的优点却一点都没学到。老学阀没吃过猪肉，还看过猪走路，可是新学阀连猪走路都没看到。如今令人哭笑不得的是，他们自己不但不知第一流知识分子为何物，甚至沐猴而冠，自以为是第一流知识分子了。——人间规格与尺度的混乱，竟一至于此！,013.越澄越不清.txt,4,《大李敖全集6.0》分章节\016.李敖祸台五十年庆祝十书\004.恰似我的温柔\013.越澄越不清.txt,学阀;继承;文化
LAT150-030,LAT150-039,恰似我的温柔,校对轮,已校对,人格,第一流知识分子要为正义准备牺牲,4月19日，报上登出所谓“二十一名自由派学者”发起的“民间组织‘澄社’”，他们的名字是文崇一、李永炽、李鸿禧、何怀硕、林正弘、林俊义、胡佛、徐正光、张存武、张忠栋、张清溪、张晓春、陈师孟、韦政通、黄光国、黄荣村、叶启政、杨国枢、蔡墩铭、萧新煌、瞿海源，大多是市面上的花瓶学者、座谈会花蝴蝶，总而言之，他们是当年“二流货”和不入流的教授们教育出来的国民党或国民党同路人，其中实为国特者有之、冒充东洋博士者有之、见风转舵兼媚“民进”“台独”者亦有之。这些货色的知识分子，如今单独作秀，意犹未足；又成群结队，以“澄清天下”为招徕，组织“澄社”。事实上，这些货色又安足以语“澄清天下”？《后汉书》写第一流的知识分子范滂，“登车揽辔，慨然有澄清天下之志”；《世说新语》写第一流的知识分子陈蕃，“言为世则，行为世范，登车揽辔，有澄清天下之志”。这种知识分子，他们为人间正义，可以坐牢、可以受刑、可以赴死，可是“澄社”这些货色呢，却什么牺牲全避之唯恐不及，既不敢冒犯暴君于先、又不敢冒犯暴民于后，口口声声“知识分子不可做政治帮闲”（“澄社”社长杨国枢语），事实上，他们是最大的政治帮闲！他们口口声声超然于“党政职务”之外，但是他们自己，又几个不是国民党？而他们在发布成立宣言之日，居然立刻聘请党政双修的国民党大老、总统府国策顾问伪君子陶百川为“名誉社员”，这些货色的势利与格调，岂不立刻呈现得一清二楚么？,013.越澄越不清.txt,5,《大李敖全集6.0》分章节\016.李敖祸台五十年庆祝十书\004.恰似我的温柔\013.越澄越不清.txt,知识分子;正义;牺牲
LAT150-031,LAT150-040,恰似我的温柔,校对轮,已校对,人格,抹杀前人建校功劳属于忘恩负义,张建邦唯一的“功劳”是抹杀别人的功劳。居太太说今天张建邦把淡江校史改编，“没有居浩然这一回事”，“他在五年多期间辛苦成就的事情”，都被抹杀，“都写在别人的功劳上”。“创业维艰，建校五年比继承事业五十年还要艰苦。前人种树，后人夺树而纳凉；后人不但不惭愧，反而隐蔽事实，自鸣得意。”这些都是张建邦的颠倒真相、忘恩负义，都是令我们不得不口诛笔伐的可耻行径！,014.张建邦逼死母亲内幕.txt,6,《大李敖全集6.0》分章节\016.李敖祸台五十年庆祝十书\004.恰似我的温柔\014.张建邦逼死母亲内幕.txt,前人;建校;忘恩负义
LAT150-032,LAT150-043,恰似我的温柔,校对轮,已校对,方法,玄奥学术术语可能遮蔽政治人物的实际表现,政治学者每喜谈“政治文化”（political culture），其中包含“政治准则”（political norms）、“政治价值”（political values）、“政治认同”（political identity）等等玄之又玄的学术字眼，从而形成搞政治的人的“政治性格”（political personality）。我生平博极群书，可是最怕看蛋头们这样搬弄玄之又玄的学术字眼，我觉得看“政治文化”，实在无须这么麻烦。,015.脸谱中的“政治文化”.txt,2,《大李敖全集6.0》分章节\016.李敖祸台五十年庆祝十书\004.恰似我的温柔\015.脸谱中的“政治文化”.txt,学术术语;政治人物;表现
LAT150-033,LAT150-044,恰似我的温柔,校对轮,已校对,人格,迟到三十年的冤案发声不是及时正义,我从报上看了高玉树这些致词，很看不起他。因为雷震的冤狱，“大家都知道是很冤枉的事”，又何劳三十年后的高玉树这样“宣布”？这种“宣布”，岂不太迟了吗？何况，去年社会上翻案风起，“雷震两位女公子曾找过他”，他还加以劝阻呢！——长长的二十九年间，他不为雷震说一句话，甚至去年还劝阻雷震女儿为乃父伸冤，为何短短的一年之隔，就“机会”“适当”了呢？这岂不太奇怪了吗？,016.高玉树的可耻.txt,6,《大李敖全集6.0》分章节\016.李敖祸台五十年庆祝十书\004.恰似我的温柔\016.高玉树的可耻.txt,冤案;发声;正义
LAT150-034,LAT150-047,恰似我的温柔,校对轮,已校对,法权,公帑建在公地上的房屋不能成为私人财产,上面钱穆这些“委屈”，我看了，都认为不能成立。因为，根本上，钱穆住的，十足是用“公帑”盖在公地上的房子。据1975年5月10日，钱穆在《领袖精神，万古常新》书中的透露：“我在民国五十六年决心回国长住，先二月，回国选择地点，在士林外双溪东吴大学之东侧，向阳明山管理局借租公地。总统闻之，命阳明山管理局依我择定地点用公帑建宾馆，许我暂居。”可见钱穆不论盖房也好、租地也罢，二十二年来，他没花过一块钱，这是事实。在这一事实下，他辩称的台北市政府没出钱也、他担任总统府资政在事前也，都无补于他的处境，因为他住的，还是用“公帑”盖在公地上的房子，怎么胡扯也赖不掉。（高玉树也是做资政在后，占房子在先啊！）,017.义利之辨与义利之辩.txt,4,《大李敖全集6.0》分章节\016.李敖祸台五十年庆祝十书\004.恰似我的温柔\017.义利之辨与义利之辩.txt,公帑;公地;私产
LAT150-035,LAT150-048,恰似我的温柔,校对轮,已校对,人格,读书人公私不分就违背自己宣扬的义利之辨,钱穆住的房子，明明是蒋介石和他的私相授受，用“公帑”做人情，有何“合法”可强辩？更妙的是，他口口声声大谈“生平以能慎守传统读书人本分自慰”、“生平惟服膺儒家所论士大夫出处进退辞受之道”，殊不知义利之辨是中国思想中的重头戏，主题定位在重义轻利，是儒家所论士大夫与读书人的基本要件之一，钱穆生平写仁义道德之文，亦着力于此。但是一轮到自己，就公私不分、义利不辨。不辨已属不该，反倒自觉“委屈”、妄加强辩，以乱社会人士之视听，从义利之辨到义利之辩，我们看到钱穆的可耻，太恶心人了。,017.义利之辨与义利之辩.txt,5,《大李敖全集6.0》分章节\016.李敖祸台五十年庆祝十书\004.恰似我的温柔\017.义利之辨与义利之辩.txt,读书人;公私;义利
LAT150-036,LAT150-049,恰似我的温柔,校对轮,已校对,方法,核对最早版本可以识破古诗误引,例如8月28日的自立早报上，便是随处可见的瞎说。首先是社论——《怀念殷海光 推崇殷海光》。中说：“海光先生最喜欢吟唱的李白诗句：‘欲渡黄河冰塞川，将登太行雪满山；停杯投箸不能食，拔剑四顾心茫然。’”事实上，殷海光国文再坏，也不会这样颠三倒四的背错古诗，吴丰山把诗句颠倒，并以“雪满山”代替“雪暗天”，其“山”字挂帅，乱改古诗*，真难怪别人“行路难”矣！,018.扭曲殷海光，吴丰山盲从.txt,4,《大李敖全集6.0》分章节\016.李敖祸台五十年庆祝十书\004.恰似我的温柔\018.扭曲殷海光，吴丰山盲从.txt,版本;古诗;误引
LAT150-037,LAT150-050,恰似我的温柔,校对轮,已校对,写作,纪念思想家不能忽略核心著作的真实贡献者,吴丰山在致开幕词中又说：“殷海光先生辞世以后，他的友人和学生陈鼓应、王晓波、孟祥森在病侧记载下来的《春残吐丝》一书，令人十分感动，于他们师生情犊之深，也留下了殷海光先生晚年思想的悃恳挣扎、寂寞和呐喊。”这也是瞎说。事实上，真正殷海光“晚年思想”的归趋，是自立早报社论中提到的“最后一部著作《中国文化的展望》”，但吴丰山之流却不知或不愿说出这是李敖一手助成的功劳。而所谓《春蚕吐丝》也者，根本是一本可疑的书。,018.扭曲殷海光，吴丰山盲从.txt,5,《大李敖全集6.0》分章节\016.李敖祸台五十年庆祝十书\004.恰似我的温柔\018.扭曲殷海光，吴丰山盲从.txt,思想家;核心著作;贡献者
LAT150-038,LAT150-051,恰似我的温柔,校对轮,已校对,方法,判断人物思想应依据成熟清醒时期的长期表现,《春蚕吐丝》是国民党员陈鼓应他们干的事。他们断章取义，东拼西凑，制造了这本书，说殷海光临死前对中国文化的看法有根本性的改变，并且强调这一点，把殷海光在《自由中国》的伟大贡献轻轻带过，把殷海光为自由民主的努力、反独裁反极权的努力都轻轻带过，甚至把殷海光描绘成一个临终的悔罪者似的。这是对殷海光最卑鄙的诬蔑。参加这种诬蔑活动的，除陈鼓应这批人外，国民党文化特务徐复观，和头脑不清的韦政通等也都在内。这些人显然是别有用心的。因为我们知人论事，必须从他成熟时期、健康时期、神智清明时期的长时期均衡表现为准则，怎可以拿衰病侵寻的行将就木者的言论来做准？古代凡是皇帝死前的诏命，都不被轻信，认为是乱命，期理在此。何况，陈鼓应这批人从来没有任何殷海光的亲笔或录音以证明他的转变（连一片“你办事，我放心”式的小条都没有），我认为《春蚕吐丝》中许多话，根本是捏造的、加工的、或有意重描浓写的。这显然是为取悦某方面，而供自己做敲门砖的一本伪书。这本书能挂上殷海光的招牌出版敛财，正证明了我常说的殷海光有“被投其所好，被小人利用”的弱点，而陈鼓应这批人，就正是这种小人。,018.扭曲殷海光，吴丰山盲从.txt,6,《大李敖全集6.0》分章节\016.李敖祸台五十年庆祝十书\004.恰似我的温柔\018.扭曲殷海光，吴丰山盲从.txt,人物思想;成熟时期;长期表现
LAT150-039,LAT150-052,恰似我的温柔,校对轮,已校对,方法,比较不同版本可以发现秘密删改,《春蚕吐丝》这本书，不但是经过制造的，并且手脚动得之多，更可做为作伪的旁证。我现在已取得当时徐复观手写“请改用原标题《痛悼吾敌，痛悼吾友！》”的原迹，经与《春蚕吐丝》一对照，发现与殷海光原信不符之处，竟达二十七处之多！王晓波写的《殷海光先生临终日志》，原发表在《象牙塔外》（1970年蓝灯出版社），经与《春蚕吐丝》一对照，发现将原文秘密窜改之处，更是惊人，其中删除李敖对殷海光的关怀，删除殷李关系，已达连篇累牍的程度，小人们的居心，岂不一清二楚吗？,018.扭曲殷海光，吴丰山盲从.txt,7,《大李敖全集6.0》分章节\016.李敖祸台五十年庆祝十书\004.恰似我的温柔\018.扭曲殷海光，吴丰山盲从.txt,版本;删改;校勘
LAT150-040,LAT150-053,恰似我的温柔,校对轮,已校对,文化,死后重构思想可能延续生前的政治打击,所以我说，《春蚕吐丝》其实是配合国民党官方、徐高阮、胡秋原、徐复观等等打击殷海光的一贯作业，是这种打击的一种延续，它着力在把被打击的殷海光死后扭曲化，春蚕到死，给他另吐一种妖丝，把他弄得面目全非。结果，在殷海光死后追念文字里，绝大部分都是照着这一模子论定的，这真是徐复观之流的大成功，也是他们统战殷门弟子的大成功。,018.扭曲殷海光，吴丰山盲从.txt,8,《大李敖全集6.0》分章节\016.李敖祸台五十年庆祝十书\004.恰似我的温柔\018.扭曲殷海光，吴丰山盲从.txt,思想;死后;政治打击
LAT150-041,LAT150-054,恰似我的温柔,校对轮,已校对,写作,短篇声明更应删去无谓重复,第一、这是一篇很烂的中文，文字老套不说，前后两次重复说明司法机关“认定萧部长确无关说情事”、“认定确无其事”，这在几百字的文字中，显属“无谓之重复”。英国十七、八世纪名家斯蒂尔（Richard Steele）有言说律师之杰出者三，第一是无谓之重复、第二是无谓之重复、第三是无谓之重复。（What's the first excellence in a lawyer? Tautology. What the second?  Tautology. What the third? Tautology.）不期在二十世纪之今日，别人陈言务去、赘语必削了，而我们的十二律师的中文竟还这样迂腐！,019.评论十二律师的广告.txt,4,《大李敖全集6.0》分章节\016.李敖祸台五十年庆祝十书\004.恰似我的温柔\019.评论十二律师的广告.txt,声明;重复;文字
LAT150-042,LAT150-055,恰似我的温柔,校对轮,已校对,法权,行政调查结论不具有司法处分效力,第二、十二律师所谓“调查报告系权责司法机关所制作之司法文书，自应具有法律效力”，这话可大有问题。因为高检处已自承是“行政调查”，不是“司法侦查”，则自不具有刑事诉讼法中不起诉处分书的效力。而高检处陈耀能检察官的身份，也只是行政人员身份，而不是本案侦办的司法人员身份，他如何又能用司法书类用纸去向在押人员做笔录？“行政调查”而可有这种权限，岂非干涉司法？把调查结果，公而布之，以“认定萧部长确无关说情事”，岂不又违背了刑事诉讼法侦察不公开的原则？,019.评论十二律师的广告.txt,5,《大李敖全集6.0》分章节\016.李敖祸台五十年庆祝十书\004.恰似我的温柔\019.评论十二律师的广告.txt,行政调查;司法;效力
LAT150-043,LAT150-056,恰似我的温柔,校对轮,已校对,法权,律师公告不能越过委托范围自我宣传,第三、按照律师法，律师要受当事人委托方能动作。登广告内容，是代当事人说以当事人具名前来委任的话，不该是律师自己的长篇大论。但在所谓声明中，竟出现“国人理当响应李焕院长”如何如何的向大官看齐的话，这未免太邪门了吧？说是“经萧天赞先生之同意”吗？但所谓声明中又出现“平心而论”赞美萧天赞的话，难道你们的“平心而论”的心，也是萧天赞首肯的吗？可见萧天赞只是同意你们“愿担任其义务顾问律师”而已。既然如此，以刑事诉讼法所规定的律师数目（不超过三人），登报告知各界已受委为法律顾问可也，还说什么其他的“理当响应李焕院长”等怪话？按律师法，明定不得以自己或他人名义，刊登跡近招摇之启事。十二律师这种干法，算不算跡近招摇呢？中文很烂的小学生，都知道答案吧？,019.评论十二律师的广告.txt,6,《大李敖全集6.0》分章节\016.李敖祸台五十年庆祝十书\004.恰似我的温柔\019.评论十二律师的广告.txt,律师;委托;宣传
LAT150-044,LAT150-057,恰似我的温柔,校对轮,已校对,方法,名人题写古语不等于古语出自名人,9月29日晚上9点37分，顺便把电视一开，看到“无所不谈”节目中赵宁博士的画面，他说：“胡适先生说：‘为者常成，行者常至。’……”我看了一笑。胡适哪里说过这种话！这明明是《晏子春秋》中的话，胡适为人题字，这样写过，但以为是胡适的话，就是无知的错误。,020.不读书，乱引证.txt,2,《大李敖全集6.0》分章节\016.李敖祸台五十年庆祝十书\004.恰似我的温柔\020.不读书，乱引证.txt,名人;古语;出处
LAT150-045,LAT150-058,恰似我的温柔,校对轮,已校对,方法,查明文章原文可以纠正名言误归,这种栽在胡适头上的无知的错误，不止赵博士为然。7月31日，康宁祥的首都早报登出国会助理联谊理事长汪临临的《宁鸣而死，不默而生——中国国民党特种党部与中国国民党之未来》一文，其中说：“本次初选过程中，甘冒政治大不韪，力揭特种党部偏差作为者，唯有本人。虽遭致部分党内同志的指责，但终不为忤。胡适先生言：‘宁鸣而死，不默而生。’相信时间能证明，本人今日所为对国民党究是贡献，还是诋毁；世界的进步不是由歌功颂德者所推动！”其实，胡适哪里说过这种话！这明明是范仲淹《灵乌赋》中的话，胡适写《宁鸣而死，不默而生》一文（《自由中国》第十二卷第七期，1955年4月1日），明说他买到一部影印元本《困学纪闻》，在卷十七中查到一段话是：“范文正灵乌赋曰：‘宁鸣而死，不默而生。’其言可以立懦。”胡适并把《灵乌赋》原文予以大量摘引。由此可见，汪临临之流不读书，以为是胡适的话，其实是他自己无知的错误。,020.不读书，乱引证.txt,3,《大李敖全集6.0》分章节\016.李敖祸台五十年庆祝十书\004.恰似我的温柔\020.不读书，乱引证.txt,原文;名言;误归
LAT150-046,LAT150-060,恰似我的温柔,校对轮,已校对,方法,错引出处会把自己的错误栽给被引者,上面这种张冠李戴的胡适之言，虽然离谱，但因无知者说不出出处，所以还不算是胡适的错误。最可恶的是无知者说出出处，却又错引，看来就像是胡适弄错似的。例如画画的何怀硕在联合报发表《煮食集》，其中《自由与同情》一文说：“记得胡适之先生曾引王安石的诗句，说明‘同情’的精神。诗曰：‘……风吹屋瓦堕，正打破我头，瓦亦自破碎，岂但我血流。我终不嗔渠，此瓦不自由……’”其实照《王临川全集》中《拟寒山拾得二十首》，明明是何怀硕自己弄错了，结果害得胡适的国文跟他这画画的一样菜了，真是冤哉枉也！,020.不读书，乱引证.txt,5,《大李敖全集6.0》分章节\016.李敖祸台五十年庆祝十书\004.恰似我的温柔\020.不读书，乱引证.txt,出处;错误;被引者
LAT150-047,LAT150-061,恰似我的温柔,校对轮,已校对,人格,给犯错老人留余地也可以是一种温柔,我看了这封信，又好气又好笑又可怜他，乃决定在这八十老翁有生之年，替他留点余地。如今十二年下来，刘太希以九十二岁高年，安享大学教授、国学大师等盛名以去，而其令誉，有赖于我这种“一代英豪”放他一马有以致之。这件事，我真不知道我做得对还是做得错。因为这不太像好勇斗狠的李敖干的事，但我终于做了。现在写出来，给瞎眼之人，看看李敖式敦厚，正如蔡琴歌中的一句：“恰似你的温柔。”,021.“恰似你的温柔”.txt,6,《大李敖全集6.0》分章节\016.李敖祸台五十年庆祝十书\004.恰似我的温柔\021.“恰似你的温柔”.txt,犯错;老人;宽容
LAT150-048,LAT150-062,恰似我的温柔,校对轮,已校对,政治,民主政治活动不应借助宗教迷信,对上面这些男女的作风，我是全部要谴责的。我谴责他们，不是为了他们要反暴力、反贿选，而是为了这些男女把政治活动跟迷信活动牵扯在一起，这种愚夫愚妇的行径，太要不得了，是中国民主政治假象中的真羞耻，太可恶了。,022.谴责天谴男女.txt,7,《大李敖全集6.0》分章节\016.李敖祸台五十年庆祝十书\004.恰似我的温柔\022.谴责天谴男女.txt,民主;宗教;迷信
