id,book,round,status,category,title,description,source_file,source_paragraph,source_path,keywords
LAT008-030,李敖相关,提取轮,待校对,法权,事实陈述须合理查证,⒉复按「（一）按事实陈述与意见表达本未尽相同，前者具有可证明性，后者乃行为人表示自己之见解或立场，属主观价值判断之范畴，无所谓真实与否，在民主多元社会，对于可受公评之事，即使施以尖酸刻薄之评论，固仍受宪法之保障。惟事实陈述本身涉及真实与否之问题，倘行为人就事实陈述之相当真实性，未尽合理查证之义务，依其所提证据资料，在客观上不足认其有相当理由确信为真实者，该不实之言论，即足以贬损他人之社会评价而侵害他人之名誉。于此情形，纵令所述事实系出于其疑虑或推论，亦难谓有阻却违法之事由，并应就其因故意或过失，不法侵害他人之名誉，负侵权行为之损害赔偿责任。又民法上名誉权侵害之成立要件，被害人对行为人陈述事实为不实之消极事实，本不负举证责任，上开攸关侵害他人名誉『阻却违法性』之合理查证义务，自应由行为人依个别事实所涉之『行为人及被害人究系私人、媒体或公众人物』、『名誉侵害之程度』、『与公共利益之关系』、『资料来源之可信度』、『查证对象之人、事、物』、『陈述事项之时效性』及『查证时间、费用成本』等因素，分别定其合理查证义务之高低，以善尽其举证责任，始得解免其应负之侵权行为责任，俾调和言论自由之落实与个人名誉之保护。（二）按侵权行为制度，既以填补被害人经法律承认应受保护权利之损害为目的，并为维持人类社会共同生活而设，是以民法上构成侵权行为有责性之过失，当指未尽善良管理人之注意义务（抽象轻过失）而言，且包括行为人对侵权行为之事实，预见其能发生而确信其不发生，以过失论之「有认识过失」（疏虞过失）在内。」，最高法院98年度台上字第1129号判决意旨足资参照。本件被告是否应对原告负侵权行为损害赔偿责任，自应以系争书籍所为之言论，是否符合上开说明之要件，以为论断之依据。,009.两件许倬云判决书.txt,38,《大李敖全集6.0》分章节\001.自传回忆类\008.李敖相关\009.两件许倬云判决书.txt,"事实陈述,意见表达,合理查证"
LAT008-031,李敖相关,提取轮,待校对,法权,言论自由具有较高价值,⒊又按言论自由为人民之基本权利，有个人实现自我、促进民主政治、实现多元意见等多重功能，维护言论自由即所以促进民主多元社会之正常发展，与个人名誉之可能损失，两相权衡，显然有较高之价值，国家应给予最大限度之保障，使个人名誉为必要之退让。而权衡个人名誉对言论自由之退让程度时，于自愿进入公众领域之公众人物，或就涉及公众事务领域之事项，更应为较高程度之退让。是行为人对于公众人物或所涉公众事务，以善意发表言论，或对于可受公评之事为适当之评论，或行为人虽不能证明言论内容为真实，但就其所言为真实之举证责任，仍应有相当程度之减轻（证明强度不必至客观之真实），且不得完全加诸于行为人。倘依行为人所提证据资料，可认有相当理由确信其为真实，或对于行为人乃出于明知不实故意捏造或因重大过失、轻率、疏忽而不知其真伪等不利之情节未善尽举证责任者，均不得谓行为人为未尽注意义务而有过失。纵事后证明其言论内容与事实不符，亦不能令其负侵权行为之损害赔偿责任（最高法院95年度台上字第2365号判决意旨参照）。是行为人所为之言论非针对自愿进入公众领域之公众人物，或就涉及公众事务领域之事项者，即属非对于可受公评之事以善意发表言论或为适当之评论，亦即行为人之言论仅涉及受评论人之私德者，行为人应对受评论人负侵权行为之损害赔偿责任。,009.两件许倬云判决书.txt,39,《大李敖全集6.0》分章节\001.自传回忆类\008.李敖相关\009.两件许倬云判决书.txt,"言论自由,公众人物,名誉"
LAT008-032,李敖相关,提取轮,待校对,法权,不实指控须郑重致歉,本人许倬云于「许倬云谈话录」一书第77至78页中，指称李敖先生为姚从吾之打手、说谎、偷书、因偷书之不名誉而无法自台大毕业、侵占文星版权云云，均与事实不符！本人或明知不实、或未经查证仍为上开言论，致严重损及李敖先生之名誉，为端正社会大众视 听，特此郑重致歉。,009.两件许倬云判决书.txt,56,《大李敖全集6.0》分章节\001.自传回忆类\008.李敖相关\009.两件许倬云判决书.txt,"不实,名誉,致歉"
LAT008-033,李敖相关,提取轮,待校对,法权,自卫自辩与可受公评,上诉人则以：伊系出于自卫及自辩，所说均属真实，且针对可受公评之事为适当之评论，概不涉及私德。又被上诉人曾自称为文化太保、流氓云云，伊加以援引，自属免责行为等语，资为抗辩。,010.二十七件李敖直接相关判决书.txt,15,《大李敖全集6.0》分章节\001.自传回忆类\008.李敖相关\010.二十七件李敖直接相关判决书.txt,"自卫,自辩,可受公评"
LAT008-034,李敖相关,提取轮,待校对,法权,公然侮辱与诽谤有别,按不法侵害他人之名誉者，被害人固得依民法第一百九十五条第一项之规定，请求加害人赔偿相当金额之非财产上损害。惟所谓相当之金额，其核给之标准，应以实际加害情形与其名誉影响是否重大，及被害人因此所受痛苦之程度，以及被害人身分地位与加害人经济状况等关系定之（参阅本院四十七年台上字第一二二一号）。查被上诉人以上诉人涉嫌诽谤罪请求其赔偿非财产上之损害四百万元本息（原审附民卷第一、二页起诉状），但被上诉人主张上诉人侵害其名誉之上揭事实，仅系犯刑法第三百零九条第一项之公然侮辱罪，并非同法第三百十条第二项之加重诽谤罪，为刑事确定判决所认定，前者系公然概为詈骂或嘲弄，与后者须具体指摘或传述足以毁损他人名誉之事实，二者加害之程度不同，影响被害人名誉之情形亦异。究竟上诉人上开詈骂被上诉人之行为与被上诉人名誉之影响如何﹖被上诉人所受精神上之痛苦又如何﹖原审均未详为调查审认，遽以被上诉人为具知名度之作家，著作颇丰，并曾拍卖笔墨得款一千余万元捐助他人，上诉人亦为知名之作家并曾任立法委员，所出版中华杂志有一定之销售量及两造之经济状况，为上诉人全部败诉之判决，自嫌速断，且难昭折服。又上诉人于原审一再抗辩称被上诉人提出之纽约时报等多件刊物系以其「被捕」、「判刑」、「坐牢」为主，祇系以写讽刺文章之通俗作家，谈不上文以载道之知名作家云云（原审更㈠字卷第十一－十七页、第三二－三四页、第五八－六十页、更㈡字卷第十、十一页、第一二三页），上诉人此项攸关被上诉人身分地位之重要防御方法，原审未并为调查斟酌，遽行判决，亦有可议。上诉论旨指摘原判决不当，求予废弃，难谓无理由。,010.二十七件李敖直接相关判决书.txt,17,《大李敖全集6.0》分章节\001.自传回忆类\008.李敖相关\010.二十七件李敖直接相关判决书.txt,"公然侮辱,诽谤,名誉"
LAT008-035,李敖相关,提取轮,待校对,知识,思想表达二分法,（一）按依本法取得之著作权，其保护仅及于该著作之表达，而不及于其所表达之思想、程序、制程、系统、操作方法、概念、原理、发现，著作权法第10条之1定有明文。故着作权之保护标的仅及于表达，而不及于思想、概念，此即思想与表达二分法。盖思想、概念性质上属公共资产，若将著作权保护范畴扩张至思想、概念，将无形箝制他人之自由创作，有失著作权法第1条所揭橥「保障著作人著作权益，调和社会公共利益，促进国家文化发展」之立法目的。再查，思想或概念若仅有一种或有限之表达方式，则此时因其他著作人无他种方式或仅可以极有限方式表达该思想，如著作权法限制该等有限表达方式之使用，将使思想为原著作人所垄断，除影响人类文化、艺术之发展，亦侵害宪法就人民言论、讲学、著作及出版自由之基本人权保障。因此，学理上就著作权法发展出思想与表达合并原则（The merger doctrine of idea and expression），使在表达方式有限情况下，该有限之表达因与思想合并而非著作权保护之标的。因此，就同一思想仅具有限表达方式之情形，纵他人表达方式有所相同或近似，此为同一思想表达有限之必然结果，亦不构成著作权之侵害。是所谓「观念与表达合并原则」，系指若某一「观念」之「表达」极其有限，无法以不同「表达」呈现某一相同「观念」时，「观念」与「表达」即已合一。这些有限的「表达」本身，由任何人完成，均会有相同之呈现，已不具著作权法所要保护的「创作性」，且若保护这些有限的「表达」，实质上会保护到其所蕴涵之「观念」，故这些有限的「表达」不得受著作权法保护。再者所谓「必要场景原则」，则是对于「观念与表达合并原则」之补充，其系指在处理特定主题之创作时，实际上不可避免地必须使用某些事件、角色、布局或布景，虽该事件、角色、布局或布景之「表达」与他人雷同，但因系处理该特定主题所不可或缺，或至少是标准之处理方式，故其「表达」纵使与他人相同，亦不构成著作权之侵害。例如，关于历史事实之创作。又按所谓著作「抄袭」，其侵害著作权人之著作财产权主要以重制权、改作权为核心，著作权人必须证明侵害者有为有形的或无形的重制行为；对于后者如无直接证据，主张著作权者应举证证明侵害者有「接触」其著作，及侵害者著作之表达「实质类似」于其著作之表达。若两者着作「极度类似」到难以想象侵害者未接触著作权人著作时，则可推定侵害者曾接触著作权人之著作。又所谓「实质类似」，指侵害者著作引用著作权人著作中实质且重要之表达部分，且须综合「质」与「量」两方面之考量。被上诉人指述上诉人抄袭李敖前开文章，为上诉人所否认，于法律上认定著作是否有抄袭情事，自应以上开著作权法之规定为依归定之。,011.八件李敖间接相关判决书.txt,418,《大李敖全集6.0》分章节\001.自传回忆类\008.李敖相关\011.八件李敖间接相关判决书.txt,"著作权,思想,表达"
LAT008-036,李敖相关,提取轮,待校对,法权,事实陈述与意见表达分流,（一）按名誉为人格之社会评价，名誉有无受损害，应以社会上对个人评价是否贬损作为判断之依据，苟其行为足以使他人在社会上之评价贬损，不论故意或过失均可构成侵权行为，与刑法诽谤罪之构成要件不同，盖刑事责任系对人身自由之剥夺，对言论自由之寒蝉效应比民事责任为大，依比例原则，亦不必使二者以相同标准判断，而侵权行为之过失，指抽象轻过失即欠缺善良管理人之注意义务而言。再按言论可分为「事实陈述」及「意见表达」，前者有真实与否之问题，具可证明性，行为人应先为合理查证，且应以善良管理人之注意义务为具体标准，并依事件之特性分别加以考量，因行为人之职业、危害之严重性、被害法益之轻重、防范避免危害之代价、与公共利益之关系、资料来源之可信度、查证之难易等，而有所不同，亦即当言论自由与人格权或名誉权相冲突时，当就个案情况，视行为人有无为合理查证及客观上其得否确信所言属实，以定其已否尽注意义务；倘行为人所为事实之陈述有损他人之名誉，且不能证明其所述属实，复未于陈述前经合理查证，或依查证所得资料，难认有相当理由确信其为真实者，即难谓已善尽注意义务。而意见表达乃行为人表示自己之见解或立场，属主观价值判断之范畴，无真实与否可言；在民主多元社会，各种价值判断均应容许，而受言论自由之保障，仅能藉由言论之自由市场机制，使真理愈辩愈明而达到去芜存菁之效果，故对于可受公评之事，如未使用偏激不堪之言词而为意见表达，可认系善意发表适当评论者，应仍受宪法之保障，难认系不法侵害他人之名誉权。又事实陈述本身涉及真实与否，虽其与言论表达在概念上偶有流动，有时难期泾渭分明，若言论系以某项事实为基础，或发言过程中夹论夹叙，将事实叙述与评论混为一谈，在评价言论自由与保障个人名誉权之考量上，仍应考虑事实之真伪，倘行为人所述事实足以贬损他人之社会评价而侵害他人名誉，而行为人未能证明所陈述事实为真，仍应负侵权行为损害赔偿责任（最高法院96年度台上字第793号、104年度台上字第703号、103年度台上字第2137号、99年度台上字第792号判决参照）。,011.八件李敖间接相关判决书.txt,424,《大李敖全集6.0》分章节\001.自传回忆类\008.李敖相关\011.八件李敖间接相关判决书.txt,"事实陈述,意见表达,名誉权"
LAT008-037,李敖相关,提取轮,待校对,法权,言论自由不是内容自由,（三）被上诉人虽辩称：伊所为系争言论乃就史学界可受公评之事项为适当之评论，并未逾合理范围，应受宪法言论自由之保障云云，惟按言论自由为一种「表达的自由」，而非「所表达内容的自由」，表达本身固应予以最大之保障，但所表达之内容，仍应受现时法律之规范，表达人应自行负法律上之责任，因此「言论自由」概念下之「评论意见」是否「适当」，仍应加以规制。所谓「适当之评论」，系指其评论中肯、不偏激，未逾必要之范围而言，若系谩骂，则得认为其已丧失评论之适当性，而不得类推适用刑法第311条第3款之阻却违法要件。本件纵认被上诉人系因发现上诉人三篇著作恰与李敖之四篇著作研究主题、引用之史料相同，却未加以引注，而怀疑上诉人有抄袭情事，方就此可受公评之事为评论，然其表达意见应遵循就事论事之原则为善意适当之评论，其以「世纪大骗子」、「民国以来最大文抄公」、「一起下海集体犯案」、「朋比分赃」、「结伙偷盗」、「提倡抄袭文化」、「攘窃之徒」、「宵小之徒」、「精密分工狂抄李敖著作」、「不肖员工」等用语指述上诉人，与事实不符，亦已逾适当评论之必要范围，自难认得类推适用刑法第311条第3款之阻却违法要件而得主张不构成侵权行为，被上诉人此部分所辩，并无足采。,011.八件李敖间接相关判决书.txt,426,《大李敖全集6.0》分章节\001.自传回忆类\008.李敖相关\011.八件李敖间接相关判决书.txt,"言论自由,适当评论,谩骂"
LAT008-038,李敖相关,提取轮,待校对,法权,李敖名誉受两岸传播损害,㈡原告请求被告赔偿300万元之非财产上损害及登报道歉，是否有理由？按不法侵害他人之身体、健康、名誉、自由、信用、隐私、贞操，或不法侵害其他人格法益而情节重大者，被害人虽非财产上之损害，亦得请求赔偿相当之金额。其名誉被侵害者，并得请求回复名誉之适当处分，民法第195条第1项定有明文。又名誉被侵害者，关于非财产上之损害，加害人虽亦负赔偿责任，但以相当之金额为限，所谓相当，自应以实际加害情形与其名誉影响是否重大，及被害者之身分地位与加害人经济状况等关系定之（最高法院47年台上字第1221号判例意旨参照）。经查，本件由被告口述而由诉外人李怀宇撰写之系争书籍，其中第77至78页之内容涉及原告之私德，非属可受公评之事，被告复未证明其内容为真实，核属加害原告名誉之侵权行为，原告之名誉权受有侵害，原告受此打击，精神上必受有相当之痛苦，是原告依前揭规定请求非财产上之损害，洵属有据。本院审酌原告系具有学士学历，曾任立法委员，现职为作家、评论家，著有多部著作，系属公众皆知之人士（见卷一第11、158至171页），被告曾任台大历史系系主任、中央研究院院士等多项职务，名下并有不动产，（见系争书籍、本案卷一第185至188页），堪认被告具有相当资力，暨被告因发表言论致原告之名誉权受有损害，使原告精神上受有莫大痛苦等情状，认原告请求精神上损害赔偿，于200万元范围内尚属适当，应予准许，逾此请求数额，不应准许。另民法第195条第1项后段所称回复名誉之适当处分，系指在客观上足以回复名誉且属必要者而言；审酌被告系以口述之方式，由诉外人李怀宇撰写，并由广西师范大学出版社出版发行系争书籍，以侵害原告之名誉，而系争书籍均可于台湾及大陆购得，且经网络传播至海峡两岸华人社会，对原告名誉造成重大贬损，则原告请求被告负担费用将如附件一所示之道歉启事以附件二所示之方式刊登，应属回复原告名誉之适当处分，爰予准许。,009.两件许倬云判决书.txt,43,《大李敖全集6.0》分章节\001.自传回忆类\008.李敖相关\009.两件许倬云判决书.txt,"名誉权,赔偿,两岸传播"
