id,book,round,status,category,title,description,source_file,source_paragraph,source_path,keywords
LAT008-001,李敖相关,提取轮,待校对,知识,十二岁已有李敖实验室,1947（民国三十六年）十二岁。暑假后高小六年级，当选班上自治会主席、当选“模范儿童”，并做学校图书馆馆长。私人方面“李敖实验室”已具规模。并投稿《好国民》杂志，刊出有《妄心》、《人类的冷藏》等文。,001.李敖五十年表.txt,21,《大李敖全集6.0》分章节\001.自传回忆类\008.李敖相关\001.李敖五十年表.txt,"李敖实验室,图书馆馆长,早熟"
LAT008-002,李敖相关,提取轮,待校对,人格,饿早饭义助师母,1953（民国四十二年）十八岁。暑假后高中三年级。念了一个多星期，即自愿休学在家。因老师严侨被捕，乃饿早饭不吃，存钱义助严师母和三个小孩。,001.李敖五十年表.txt,28,《大李敖全集6.0》分章节\001.自传回忆类\008.李敖相关\001.李敖五十年表.txt,"严侨,义助,师母"
LAT008-003,李敖相关,提取轮,待校对,写作,文星批评国法党限,1965（民国五十四年）三十岁。4月25日，萧孟能在他家大设宴，为我三十岁庆祝。8月18日迁往信义路国泰信义公寓四楼。12月1日在《文星》第九十八期发表《我们对国法党限的严正表示》，批评国民党。12月26日，杂志被封杀。四年的《文星》风云告一段落。,001.李敖五十年表.txt,40,《大李敖全集6.0》分章节\001.自传回忆类\008.李敖相关\001.李敖五十年表.txt,"文星,国法党限,国民党"
LAT008-004,李敖相关,提取轮,待校对,法权,告别文坛书也被查禁,1966（民国五十五年）三十一岁。《孙逸仙和中国西化医学》、《传统下的独白》、《历史与人像》、《为中国思想趋向求答案》、《教育与脸谱》、《上下古今谈》、《文化论战丹火录》、《闽变研究与文星讼案》等书全被查禁。11月5日出版《李敖告别文坛十书》，在装订厂被治安人员抢走。《乌鸦又叫了》、《两性问题及其它》、《李敖写的信》、《也有情书》、《孙悟空和我》、《不要叫罢》等书全被查禁。警总开始一再“约谈”我，均于当日放回。“约谈”重点是调查我十八岁时想和老师严侨偷渡回大陆的事。,001.李敖五十年表.txt,41,《大李敖全集6.0》分章节\001.自传回忆类\008.李敖相关\001.李敖五十年表.txt,"查禁,告别文坛,警总"
LAT008-005,李敖相关,提取轮,待校对,法权,官方私方诉讼夹杀,1967（民国五十六年）三十二岁。国民党加紧算旧帐。台湾高等法院首席检察官发交侦办我，4月8日以“妨害公务”被提起公诉。自此官方正式配合私方，以诉讼手段，形成夹杀。4月14日起义助殷海光看病。夏天起，小蕾成为小情人。,001.李敖五十年表.txt,43,《大李敖全集6.0》分章节\001.自传回忆类\008.李敖相关\001.李敖五十年表.txt,"诉讼,夹杀,妨害公务"
LAT008-006,李敖相关,提取轮,待校对,人格,基于人权义助柏杨,1968（民国五十七年）三十三岁。以贩卖旧电器维生，暗中支持其它出版活动。义助柏杨（我看不起柏杨，但柏杨入狱，却基于同情与人权而义助柏杨）。,001.李敖五十年表.txt,44,《大李敖全集6.0》分章节\001.自传回忆类\008.李敖相关\001.李敖五十年表.txt,"柏杨,人权,义助"
LAT008-007,李敖相关,提取轮,待校对,法权,洗脑中一言不发,1976（民国六十五年）四十一岁。仁爱教育实验所每周请教授一名来“洗脑”，我旁若无人，一言不发。11月19日服刑期满，无保出狱（我说不愿连累朋友保我出狱，如因没有保人而不放人，我愿继续坐牢）。在我未出狱前，国民党派我的老师吴俊才与我洽商，我指陈在叛乱案外，另以杠上开花的背信冤狱整我、判我一年的不当，经吴俊才查明确是冤狱，乃透过协调，以“不执行”解决。吴俊才相对要求我任政大国际关系研究中心副研究员，我以叛乱案的褫夺公权六年也可就此不了了之，可证明所谓国民党法治，不过乃尔！乃同意。于是在出狱后第十一天（12月1日），有了生平第一个正式职业。,001.李敖五十年表.txt,52,《大李敖全集6.0》分章节\001.自传回忆类\008.李敖相关\001.李敖五十年表.txt,"洗脑,无保出狱,法治"
LAT008-008,李敖相关,提取轮,待校对,人格,拒绝抓兵式职务,1977（民国六十六年）四十二岁。与（Martha）同居。做土木包工。坚辞国际关系研究中心职务，主任蔡维屏不肯放人。我感觉是：“那次短暂的‘副研究员’，就好象一个人上街买菜，突然被抓去当兵，他一有机会，必然要开小差，还回去买菜一样。”最后，“在中心我待了十三个月，但是全部上班的时间，不到十三个小时。不但拒绝研究，也拒绝讨论、拒绝听演讲会、拒绝签到、拒绝请领书报，最后拒绝领薪水。”,001.李敖五十年表.txt,53,《大李敖全集6.0》分章节\001.自传回忆类\008.李敖相关\001.李敖五十年表.txt,"拒绝研究,拒绝签到,拒绝领薪水"
LAT008-009,李敖相关,提取轮,待校对,写作,写司法黑暗抱冤狱不平,1982（民国七十一年）四十七岁。入狱后即开始每月出版一册《李敖千秋评论丛书》，至今不断。2月10日出狱，发表有关司法黑暗、监狱黑暗文字，并陆续为许多冤狱抱不平，引起行政院院会、中外舆论、电视、立法院以及被迫害者的重视。在国民党立委温士源疾呼阻止李敖英雄形象流传后一周，新竹少年监狱即发生空前大暴动。出狱后大量为党外杂志写文章，公论所在，蔚为重镇。“匹夫而为百世师，一言而为天下法。”4月25日，党外人士为我在紫藤庐祝寿，虽然许荣淑等坚邀，我不肯露面。6月出版“三情之书”——《李敖的情诗》、《李敖的情书》、《李敖的情话》。8月28日起，实行“隐而不退”。,001.李敖五十年表.txt,59,《大李敖全集6.0》分章节\001.自传回忆类\008.李敖相关\001.李敖五十年表.txt,"司法黑暗,冤狱,写作"
LAT008-010,李敖相关,提取轮,待校对,人格,顽童战士文化基督山,1984（民国七十三年）四十九岁。继续出版《李敖千秋评论丛书》（其中第一期、第十一期、第十六期、第二十二期、第二十六期、第二十七期、第二十八期、第三十二期、第三十四期、第三十六期、第三十八期、第三十九期均遭查禁）。1月起，又加出《万岁评论丛书》（其中第三期、第四期、第五期、第八期、第九期、第十期、第十一期、第十二期均遭查禁）。每月一册，与千秋评论错开出版，等于两个月刊或一个半月刊。另为《政治家》主持专栏、任《自由时代》总监，鼓动风潮，造成时势。3月6日，美国（James T .M. Pan）写信说：“台湾一千八百万人口，但自海外看岛内，全岛只有李敖一人而已！现在如此，将来在历史上更加如此，这是中外正义之士的一致看法。”总之，我生平侠骨柔情、敢说敢做，多少年来，一直以“虽千万人，吾往矣！”的气魄，独行其是，而不在乎小人们争言其非。我是顽童、是战士、是英雄、是善霸、是文化基督山、是社会罗宾汉、是痛恨国民党和伪君子的第一真人，中国有史以来，没人能像我这样集正义、力量、勇气、真诚、血性、智慧、博学和活泼于一身的人了。有李敖在，是中国人之光，岂止一千八百万而已，有朝一日，历史将为我作证。,001.李敖五十年表.txt,61,《大李敖全集6.0》分章节\001.自传回忆类\008.李敖相关\001.李敖五十年表.txt,"顽童,战士,正义"
LAT008-011,李敖相关,提取轮,待校对,法权,查禁下苦撑待变,1985（民国七十四年）五十岁。最高法院平反四年前冤狱。继续出版《李敖千秋评论丛书》（其中第四十期被查禁）和《万岁评论丛书》（其中第十三期、第十四期、第十五期、第十六期、第十七期均遭查禁），在国民党疯狂查禁政策下，事实上，连残余的没禁的，也难以正常上市。警察、特工之流威胁售书小贩说：“反正凡是有李敖两个字的书就不要卖！”所以处境是苦撑待变，备极艰辛。,001.李敖五十年表.txt,62,《大李敖全集6.0》分章节\001.自传回忆类\008.李敖相关\001.李敖五十年表.txt,"查禁,售书,苦撑"
LAT008-012,李敖相关,提取轮,待校对,政治,国民党阻塞别人前进,1月15日，回信给潘毓刚，我说：“这么多年来，我的确十足证明给所有的人看，我是一个‘顽劣份子’，一个被国民党永远无法扑杀的‘獠’。对李敖，国民党除了杀李敖关李敖，无法解决问题，可是杀了关了，制造出来的问题会比解决的更多。”信中我谈到国民党在台湾、在中国，它的真正罪孽，是“‘阻塞’了别人前进，造成了冷空气在上空长时间驻留。国民党的最可恶之处，不在它自己的作恶，而在它‘阻塞’别人为善，它总是裹胁广大中国人民为它殉葬，自己去死还不够，还要拉别人一起死，这是最不可原谅的事，广大中国人民为它误尽青春又不能免于偕亡，这真是中国的悲剧。”3月16日，我写《菩萨就只好打倒他》，我又说：“国民党并不是我们的主要敌人，因为他们不配。国民党的罪过是他们怕‘菩萨将成正觉也’，因而‘诱乱不遂，忧惶无赖’；因而出面阻止我们、阻止中国的现代化。他们什么都不是，只是中国现代化过程中的拦路无赖而已。”“我们预见的国民党，是早晚‘魔军怖骸，奔驰退散’的乌合之众，他们的下场终将化为春泥，做为‘莲华’下的肥料。菩萨的遗憾也许只是不得不浪费许多时间去圣魔大战，但这种浪费是在所难免的，没有这种浪费，就没有‘救多数人于永久’的开路条件。国民党既不允许菩萨‘成正觉’，菩萨就只好打倒他，菩萨没有法子。”这些立论，是我身处此岛的基本态度。当然我已五十之年，来日有少无多，圣魔大战的浪费，应当尽量减少，多写世界性、永恒性的作品，自是我今后的主力。,001.李敖五十年表.txt,63,《大李敖全集6.0》分章节\001.自传回忆类\008.李敖相关\001.李敖五十年表.txt,"国民党,阻塞,现代化"
LAT008-013,李敖相关,提取轮,待校对,法权,反分裂决议破坏程序正义,2005年（民国九十四年）七十岁。因立委224人于3月4日突以“十分钟”之草率，在立法院通过所谓《反<反分裂国家法>决议文》。他们未征询同为立委身份之李敖同意，破坏程序正义，违背宪法规定，擅自行使宪法赋予职权外之权利，明显扩权越权；并且公然冒用李敖名义、侵犯李敖人权，显然有“滥权”、“渎职”、“冒用他人名义”等侵权违法行为。所以李敖把他们全部224位起诉了。举行神州文化之旅系列演讲会，9月22日北大演讲，9月23日清华演讲，9月26日复旦演讲。,001.李敖五十年表.txt,84,《大李敖全集6.0》分章节\001.自传回忆类\008.李敖相关\001.李敖五十年表.txt,"程序正义,宪法,滥权"
LAT008-014,李敖相关,提取轮,待校对,政治,智慧党拆穿假民主,2007年（民国九十六年）七十二岁。为了拆穿台湾的假民主、为了拆穿台湾的131个政党都是“列宁式政党”的面具、为了留下中国有史以来第一个英美式政党的光荣记录，李敖创办“中国智慧党”。结束《李敖有话说》节目。,001.李敖五十年表.txt,86,《大李敖全集6.0》分章节\001.自传回忆类\008.李敖相关\001.李敖五十年表.txt,"假民主,列宁式政党,智慧党"
LAT008-015,李敖相关,提取轮,待校对,方法,不要只摸一条腿,你以为你知道李敖是谁，你错了。你不知道李敖是谁，就如同瞎子不知道象是谁。瞎子摸象，只摸到一条腿，就以为那是象，其实象是完整的，不只一条腿。,002.不要只摸李敖一条腿.txt,2,《大李敖全集6.0》分章节\001.自传回忆类\008.李敖相关\002.不要只摸李敖一条腿.txt,"瞎子摸象,整体,李敖"
LAT008-016,李敖相关,提取轮,待校对,法权,封锁扭曲李敖真面目,你以为你不必知道李敖是谁，那正是国民党伪政府所希望的。几十年来，这个伪政府查禁了李敖九十六本书，超过金氏世界纪录，伪行政院出版《中华民国作家作品目录》，收有国民党文人柏杨等七百零三个作家，可是不见李敖之名。伪政府曾动用所有媒体不报导李敖，媒体不敢出现李敖二字，长达十四年之久。直到今天，跟国民党同路的媒体如民视、如自由时报、如天下杂志，还这样视而不见呢！虽然李敖的真面目被封锁、被扭曲，但在高人眼中、在海外报导中，对李敖的肯定之言，随着李敖的成长，仍屡见不鲜：,002.不要只摸李敖一条腿.txt,3,《大李敖全集6.0》分章节\001.自传回忆类\008.李敖相关\002.不要只摸李敖一条腿.txt,"封锁,查禁,视而不见"
LAT008-017,李敖相关,提取轮,待校对,知识,反国民党源于深厚哲学,■彭明敏说：五十四岁的李敖“是华人史上罕有的奇才。惟因如此，当权者视之如背刺，非把他连根拔掉不休”。“他（李敖）所以反对国民党，不是出于狭窄的政治利益，而是发自历史和文化的深厚哲学，也是出于对民主自由的信念和人权人道的大精神。他的思索是广泛、深刻、清晰、严密而良知的。”,002.不要只摸李敖一条腿.txt,14,《大李敖全集6.0》分章节\001.自传回忆类\008.李敖相关\002.不要只摸李敖一条腿.txt,"民主自由,人权,哲学"
LAT008-018,李敖相关,提取轮,待校对,人格,世界级地位封锁不了,"■美国《花花公子杂志》（PLAYBOY）《1990年企业年报》（PLAYBOY Enterprises, Inc. 1990 Annual Report）1990年12月刊出李敖照片，指出五十五岁的李敖曾接受该年6月份外语版访问，该外语版共十五国、每年十二位，李敖是全世界一百八十位名人中选出的三位之一。……此外，日本NHK及香港等电视台，也一再报导李敖的处境。这些世界级的地位，国民党伪政府和它同路人是封锁不到的、也是消灭不了的。",002.不要只摸李敖一条腿.txt,16,《大李敖全集6.0》分章节\001.自传回忆类\008.李敖相关\002.不要只摸李敖一条腿.txt,"世界级,封锁,海外"
LAT008-019,李敖相关,提取轮,待校对,法权,单独挑战威权尺度,在台湾思想言论的冰河时期，敢于单独向威权挑战言论开放的尺度的，李氏堪称第一人，也是最不为权势、厉害所屈服之人。其著作早已等身，却未列入官方出版的《中华民国作家作品目录》之中，正见其至今仍被故意忽视之一斑。,003.中华民国现代名人录——李敖.txt,5,《大李敖全集6.0》分章节\001.自传回忆类\008.李敖相关\003.中华民国现代名人录——李敖.txt,"威权,言论开放,忽视"
LAT008-020,李敖相关,提取轮,待校对,写作,直率犀利批判传统政治,民国五十年，李敖以一篇发表于《文星》杂志的《老年人和棒子》引起震撼和议论，此后即以直率而且犀利的笔锋，不断批评中国传统文化，主张“全盘西化”指名道姓批评党政以及学界名流。60年代末期，李敖曾以“妨害公务”罪名被提起公诉，70年代曾以“叛乱罪”被判刑十年，后改判八年。70年代后期复出文坛，写作不断，皆具强烈的批判性。他一方面整理旧作，出版《李敖全集》、《胡适研究》、《胡适评传》等，一方面出版新作，如《独白下的传统》等，并陆续出版《李敖千秋评论丛书》、《求是报》等。,004.中华民国作家作品目录——李敖.txt,6,《大李敖全集6.0》分章节\001.自传回忆类\008.李敖相关\004.中华民国作家作品目录——李敖.txt,"文星,全盘西化,批判"
LAT008-021,李敖相关,提取轮,待校对,法权,出狱前书籍查禁系统,在1976年11月19日出狱前的李敖著作，计有十九本，其中十四本分别被有关单位依据（一）出版法、（二）出版法施行细则、（三）社会教育法、（四）戒严法、（五）台湾地区戒严时期出版管制办法、（六）内政部台（47）内警字第二二四七九号函、（七）刑法二三五条等有关法令予以查禁，除了李敖著作品十五本被禁外，其所主编之《文星杂志》亦有三期被禁。另外，《文星杂志选集第三册》亦于1974年7月16日被警总依（淬淬四九六四）字号查禁。,006.李敖著作查禁清单及官方理由.txt,21,《大李敖全集6.0》分章节\001.自传回忆类\008.李敖相关\006.李敖著作查禁清单及官方理由.txt,"出版法,戒严法,查禁"
LAT008-022,李敖相关,提取轮,待校对,写作,复出后文化事业仍被追杀,《两性问题及其他》系李敖《告别文坛十书之二》，因在印刷厂被查扣而未上市；《闽变研究与文星讼案》系四十开本，344页，五十四年9月25日出版。《孙逸仙和中国西化医学》系四十开本，138页，五十四年12月12日出版。其余未被查禁的李敖“劫后余生”著作则有：《胡适研究》（五十三年3月25日出版）、《胡适评传第一册》（五十三年4月10日出版）、《妈离不了你》（五十五年11月5日出版，为李敖告别文坛十书之三）、《传统下的再白》（李敖告别文坛十书之六）、《大学后期日记甲集》（李敖告别文坛十书之八）、《大学后期日记乙集》（李敖告别文坛十书之九）等六本。复出后的李敖则在当年（1979年）分别出版了《独白下的传统》（六十八年6月出版）、《李敖文存》（六十八年9月15日出版）、隔年再出版《李敖全集》（二十五开，3500页，六十九年6月25日出版），随后在第二次系狱后，自1981年9月起开始出版《李敖千秋评论丛书》，从此展开波澜壮阔的文化事业，结果在复出后的这十余年间，政府有关部门还是锲而不舍继续“追杀”，其后又陆续查禁了下列清单，总计多达八十种，其中，有关《千秋评论》丛书四十种、《万岁评论》丛书三十六种，以及《蒋介石研究》一至三集和《孙中山研究》。,006.李敖著作查禁清单及官方理由.txt,23,《大李敖全集6.0》分章节\001.自传回忆类\008.李敖相关\006.李敖著作查禁清单及官方理由.txt,"劫后余生,千秋评论,追杀"
LAT008-023,李敖相关,提取轮,待校对,法权,攻訐现行法制即遭禁,《传统下的独白》：该书内容攻訐政府现行法制，恶加渲染，足以淆乱视听，挑拨政府与人民情感，违反《台湾省戒严期间新闻纸杂志图书管制办法》第二条第六、第七款之规定。依同办法第七条之规定应予查禁并扣押其出版品。,006.李敖著作查禁清单及官方理由.txt,108,《大李敖全集6.0》分章节\001.自传回忆类\008.李敖相关\006.李敖著作查禁清单及官方理由.txt,"传统下的独白,现行法制,查禁"
LAT008-024,李敖相关,提取轮,待校对,文化,儒家思想批判被查禁,《为中国思想趋向求答案》：该书内容谬称：“共产思想能够在中国蔓延为害，是孔家思想替其作了先驱工作”，诬蔑儒家思想，淆乱视听，影响民心士气，违反《台湾省戒严期间新闻纸杂志图书管制办法》第二条第六款之规定，依同办法第七条之规定应予查禁并扣押其出版品。,006.李敖著作查禁清单及官方理由.txt,110,《大李敖全集6.0》分章节\001.自传回忆类\008.李敖相关\006.李敖著作查禁清单及官方理由.txt,"孔家思想,中国思想,儒家"
LAT008-025,李敖相关,提取轮,待校对,方法,和平改革反枪杆,《乌鸦又叫了》：内载作者藉彭明敏事件之发生，倡言发起“学习李敖运动”，鼓励青年走李敖路线，自认代表“反盲动”“反以暴易暴”“反枪杆对付异己”，并妄言“主张和平改革，社会改革，思想改革”，显有淆乱视听、影响民心士气之害，并有危害社会治安之虞，依据《台湾省戒严期间新闻纸杂志图书管制办法》第二条第六款，及同法第七条之规定，应予查禁并扣押其出版品。,006.李敖著作查禁清单及官方理由.txt,114,《大李敖全集6.0》分章节\001.自传回忆类\008.李敖相关\006.李敖著作查禁清单及官方理由.txt,"和平改革,反盲动,反枪杆"
LAT008-026,李敖相关,提取轮,待校对,法权,出版法违宪与不合作,《李敖写的信》：该书诬指内政部依据出版法“侵害”人民自由系“违宪”，并主张知识分子提倡“不合作主义”，显有挑拨政府与人民情感及淆乱视听，影响民心士气之害，依据《台湾省戒严期间新闻纸杂志图书管制办法》第二条第六、七款及同法第七条之规定，应予查禁并扣押其出版品。,006.李敖著作查禁清单及官方理由.txt,117,《大李敖全集6.0》分章节\001.自传回忆类\008.李敖相关\006.李敖著作查禁清单及官方理由.txt,"出版法,违宪,不合作主义"
LAT008-027,李敖相关,提取轮,待校对,法权,出版法违宪与官逼民反,《不要叫罢》：该书诬指出版法完全“违宪”。煽动人民“多还他们几手”，并指“社会上‘暴戾之风’系法律不能为其辩冤白谤，自然最后要被逼到绝路上去，‘官逼民反’”等，显有淆乱视听、影响民心士气及挑拨政府与人民情感之害，依据《台湾省戒严期间新闻纸杂志图书管制办法》第二条第六、七款及同法第七条之规定，应予查禁并扣押其出版品。,006.李敖著作查禁清单及官方理由.txt,119,《大李敖全集6.0》分章节\001.自传回忆类\008.李敖相关\006.李敖著作查禁清单及官方理由.txt,"出版法,官逼民反,法律"
LAT008-028,李敖相关,提取轮,待校对,政治,一国两制文章遭处分,《外交·性交·交》（千秋评论71）：李敖等著作发行之《李敖千秋评论丛书71外交·性交·交》出版品一册（24开本，341页，1987年8月31日初版），其所载之《明辨是非，分清敌我，坚持“一国两制”》一文，违反出版法规定，经转准行政院新闻局76 10 5(76)铭版四字12309号函核定，应予行政处分。定期停止发行一年（自中华民国七十六年10月11日起至七十七年10月10日止）并同时扣押其出版品。违反出版法第32条第1款，依出版法第40条第13项第3款之规定予以处分。,006.李敖著作查禁清单及官方理由.txt,199,《大李敖全集6.0》分章节\001.自传回忆类\008.李敖相关\006.李敖著作查禁清单及官方理由.txt,"一国两制,出版法,扣押"
LAT008-029,李敖相关,提取轮,待校对,政治,孙中山卖国封面遭禁,《孙中山研究》：“李敖出版社”发行之《孙中山研究》一书（24开本，计312页，1987年9月10日初版），封面以醒目之标题“孙中山卖国”置于国父遗像之上，违反出版法规定应予行政处分，禁止出售及散布并扣押其出版品。违反出版法第32条第2款，依出版法第39条第1项第3款规定予以处分。,006.李敖著作查禁清单及官方理由.txt,200,《大李敖全集6.0》分章节\001.自传回忆类\008.李敖相关\006.李敖著作查禁清单及官方理由.txt,"孙中山研究,卖国,查禁"
