id,source_id,book,round,status,category,title,description,source_file,source_paragraph,source_path,keywords
LAT113-053,LAT113-077,大江大海骗了你,校对轮,已校对,写作,历史人物不能只供读者怜悯,□他们一生无奈，但老有所终，是个好故事。龙应台“大江大海”了半天，她能参透李桢林的悲惨故事吗？她的“大江大海”，太偏颇、太皮毛了吧？她的“大江大海”，收了许多屁故事，整本书都看不到“伤心人别有怀抱”的真正“怀抱”，整本书中没有一个英雄，在龙应台眼中和文化水平中，看不到一个英雄，这是什么视力呢？什么视野呢？此外另一些“一九四九”的劫遗，像阳明大学校长张心湜，他七八岁就跟在兵工厂服务的亲人流亡出来，饱受艰辛。功成名就以后，为两岸医学教育努力，至今不懈。他是“1949”浩劫下的前卫人物，龙应台不去访问，这是什么视力呢？什么视野呢？,071.张玉法那些人的心态.txt,9,《大李敖全集6.0》分章节\012.人物研究类\015.大江大海骗了你\071.张玉法那些人的心态.txt,历史人物;行动;怜悯
LAT113-054,LAT113-082,大江大海骗了你,校对轮,已校对,人格,对最高权力者的态度可以检验人格,□正是。这是检验历史的第一标准。由一个人对蒋介石的态度，可以检验出你有没有是非观念、正义观念、方法训练、史学程度、对真相了解的程度，还有，你是不是冷血、包括你的国家观念、对美国对日本的观念等等等等，都可从蒋介石这张试纸上检验出来，说来既奇妙又有趣。,074.蒋介石是一张试纸.txt,3,《大李敖全集6.0》分章节\012.人物研究类\015.大江大海骗了你\074.蒋介石是一张试纸.txt,最高权力;道德;检验
LAT113-055,LAT113-083,大江大海骗了你,校对轮,已校对,写作,历史写作不能绕开统治者,□远的先不说，蒋介石在台湾，二十六年，搞美、日、台“三角架构”，做尽了媚美媚日的事，那是真正的“大江大海一九四九”杰作，龙应台却给“漏”了，不拆穿蒋介石，谈什么“大江大海一九四九”？不敢碰蒋介石，这是典型的“龙应台式错误”。,074.蒋介石是一张试纸.txt,9,《大李敖全集6.0》分章节\012.人物研究类\015.大江大海骗了你\074.蒋介石是一张试纸.txt,历史写作;统治者;责任
LAT113-056,LAT113-084,大江大海骗了你,校对轮,已校对,人格,反抗暴君也是恢复公民人格,□首先是蒋介石变成“反共先觉”“民族救星”，他的声势，光在死后余威就可反衬。在他生前，在他淫威所及之处，没有人敢拆穿他、没有人能拆穿他；在他死后，在他的余威犹在之处，也没有人敢拆穿他、也没有人能拆穿他。中国人中，真正敢也真正能拆穿他的，是从李敖开始。我认为这种道德意义，比存信史的意义更难能可贵。为什么？我在《<蒋介石研究>自序》中就已指出：“当年蔡松坡起义，反对袁世凯，最大理由是‘为国民争人格’，如今我在蒋介石阴魂不散的岛上，敢于在他头上动土，也是‘为国民争人格’。”争几十年来被蒋介石欺骗、被蒋介石恐吓、被蒋介石作弄、被蒋介石羞辱、被蒋介石强奸得麻木不仁了的人格、争自己的人格。时至今日，凡在对蒋介石态度上没有觉悟的，都可认定这种人的人格层面出了问题。或许有人说，民进党在蒋介石铜像和纪念堂上作文章，不是觉悟吗？我的答案是否定的。因为民进党至今一脑袋蒋介石“仇共架构”等思路，他们是真正“蒋的传人”，移移铜像、挂挂布条，又算什么呢？,076.反蒋在争自己的人格.txt,3,《大李敖全集6.0》分章节\012.人物研究类\015.大江大海骗了你\076.反蒋在争自己的人格.txt,暴君;公民人格;反抗
LAT113-057,LAT113-085,大江大海骗了你,校对轮,已校对,政治,个人品格良好不保证宏观政治方向正确,□此中文武大吏多矣，也有来过我家，我熟识的，像杨西崑大使、像许历农上将，每当我以这一疑义旁敲侧击时，当事人每见苦笑。这表示了什么？表示了在大方向、大前提上，他们再完美的品德与才干，都陷入迷失，说他们是蒋家鹰犬或嫌刻薄，但说他们是阻碍中国统一的罪魁，一点都没冤枉。最后呢，蒋氏父子，接连死去；“中华民国”，一片魂幡，效忠者保住什么？结论是，即使不为了“蒋家”而为了“中华民国”，在大方向上，也是错误的。因为你的一切所谓“爱国”，都是阻碍中国统一的，至少你推迟了中国统一。你自己不能统一又跟别人统一捣蛋，你干的是什么呢？不管你是多么好的人，你是共犯。助纣为虐的自己不是纣，但扶同为恶，与纣相去者几希！一群好人，做了坏事，这是台湾岛有头有脸人物的集体写照，至于坏人，就更别提了。,077.他们爱错了国.txt,3,《大李敖全集6.0》分章节\012.人物研究类\015.大江大海骗了你\077.他们爱错了国.txt,个人品格;政治方向;爱国
LAT113-058,LAT113-086,大江大海骗了你,校对轮,已校对,政治,强权会选择性忽视附庸政权的人权问题,□美国口口声声以人权牌谴责异己，但却从不以人权牌谴责它的走狗，所以，全世界的独裁者，只要被美国卵翼了，就绝口不提它的人权了。蒋介石狗仗美势，有恃无恐，在台湾搞白色恐怖，“杀人如草不闻声”，美国主子视若罔闻，从来不打“人权牌”。蒋介石沦为美国奴才，但他自己另蓄奴才级的党羽，这些党羽，正如《水浒传》石秀所骂的：“给奴才做奴才的奴才”，这些奴才不全是坏人。也不全是无能之辈、甚至也非不爱国，只是他们酱在蒋介石政权下，在大节上，就走向反动、走向阻碍中国统一，这些人绝不承认他们不爱国，但爱国爱到了为“中华民国”做孤臣孽子、为“中华民国”打拼，而这种效忠，戏谑性的追踪起来，效忠的对象到底是“中华民国”还是“蒋家”，却发生沾黏与错乱，也就是说，发生了疑义。“龙应台式错误”是她切割不开这种疑义。,078.他们爱错了家.txt,3,《大李敖全集6.0》分章节\012.人物研究类\015.大江大海骗了你\078.他们爱错了家.txt,强权;人权;附庸
LAT113-059,LAT113-088,大江大海骗了你,校对轮,已校对,法权,国家合法性须接受历史和法理检验,□余英时说“中华民国建国不只是国民党一党之事，同时也得到了清朝的承认和国际的承认，所以它是合法的”，又说共产党的“建国”只是政权的取代，“而国家早在1949年以前就存在了”。这些怪话，与历史和法理都不合：,080.余英时是“中华民国”未亡人.txt,5,《大李敖全集6.0》分章节\012.人物研究类\015.大江大海骗了你\080.余英时是“中华民国”未亡人.txt,国家;合法性;历史法理
LAT113-060,LAT113-089,大江大海骗了你,校对轮,已校对,政治,政党不能冒领未参与的建国功劳,第一、中华民国的建国，根本与国民党无关，国民党是建国以后才成立的。今天把兴中会、同盟会说成国民党前身的，是扭曲历史。事实上，兴中会、同盟会跟国民党是两码事。,080.余英时是“中华民国”未亡人.txt,6,《大李敖全集6.0》分章节\012.人物研究类\015.大江大海骗了你\080.余英时是“中华民国”未亡人.txt,政党;建国;历史归属
LAT113-061,LAT113-090,大江大海骗了你,校对轮,已校对,法权,国际承认不能证明政权继替合法,第三、至于国际的承认，更算不了什么，清朝就是被各国承认的，照余英时的怪逻辑，则中华民国的建国，也是政权取代，因为国家早在一九一二年以前就存在了。,080.余英时是“中华民国”未亡人.txt,8,《大李敖全集6.0》分章节\012.人物研究类\015.大江大海骗了你\080.余英时是“中华民国”未亡人.txt,国际承认;政权继替;合法性
LAT113-062,LAT113-091,大江大海骗了你,校对轮,已校对,法权,国际法须区分国家和政府承认,第四、在国际法中，虽有“国家的承认”（Recognition of State）和“政府的承认”（Recognition of Government）的差距，但“共产党的‘建国’”，却无不符合，历史如此、法理也如此。,080.余英时是“中华民国”未亡人.txt,9,《大李敖全集6.0》分章节\012.人物研究类\015.大江大海骗了你\080.余英时是“中华民国”未亡人.txt,国家承认;政府承认;国际法
LAT113-063,LAT113-092,大江大海骗了你,校对轮,已校对,方法,政治修辞不能改变客观事实,我的文章发表后，国民党“文学侍从之臣”纷纷推说蒋介石的亡国论乃是愤激之言、训勉之词，但是，不论怎么愤激或训勉，客观事实就是客观事实，蒋介石口中的“亡国之民”、“亡国之痛”、“亡国的境地”，难道是危言耸听的？当然，这在当时是对自己人的秘密谈话，对外是不这么说的。,081.连蒋介石都招认“中华民国”亡国了.txt,7,《大李敖全集6.0》分章节\012.人物研究类\015.大江大海骗了你\081.连蒋介石都招认“中华民国”亡国了.txt,政治修辞;客观事实;亡国
LAT113-064,LAT113-094,大江大海骗了你,校对轮,已校对,方法,少数名人不能代表知识精英去留,□像戴高乐看不起法国国会议员一样，我看不起来台湾的知识分子。因为基本上，他们是蒋介石的人马。一九四九年蒋介石兵败山倒，逃到台湾，为维系所谓道统政统法统或什么什么统，从故宫的六十五万件古物以下，能搬到什么都朝台湾搬，其中人马自然在内。蒋介石想搬知识分子，但信誉破产，知识分子不跟他了。以1948年中央研究院选出的第一届八十一位院士为例，跟着伪政府到台湾的，只九个人，占院士总数的11.1%；去美国的十二人，占院士总数的15%；留在大陆迎接解放的达六十人，占院士总数的74%，光在这一范畴，就看出人心所向了。相对的，来台湾的是什么货色，也就可想而知了。蒋介石搬到的知识分子是杂碎。,083.我看不起跟蒋介石的知识份子.txt,3,《大李敖全集6.0》分章节\012.人物研究类\015.大江大海骗了你\083.我看不起跟蒋介石的知识份子.txt,知识精英;抽样;去留
LAT113-065,LAT113-095,大江大海骗了你,校对轮,已校对,文化,权力机构会在思想家死后收编其名义,□胡适、殷海光两位稍好。胡适晚年一筹莫展、有点鬼混，大方向上尚能义正辞严，例如他反对蒋介石任终身总统。殷海光政论光芒万丈，很了不起。胡殷死后，都被假货接管，今天的“胡适纪念馆”也、“殷海光故居”也，都被又软又混的知识分子接管，抱着胡殷死尸不放。其实胡殷二公早已灵魂出窍了。龙应台搔到一点胡殷的尸毛，与那些假货的唯一不同，是她不太跟他们成群结队，她自己有资本家给她的“龙应台基金会”，比那些穷鬼阔多了。,083.我看不起跟蒋介石的知识份子.txt,5,《大李敖全集6.0》分章节\012.人物研究类\015.大江大海骗了你\083.我看不起跟蒋介石的知识份子.txt,思想家;收编;机构
LAT113-066,LAT113-099,大江大海骗了你,校对轮,已校对,方法,私人记录可以反证公开说法,龙应台口口声声说她去美国斯坦福大学看蒋介石日记，真不知她是怎么看的。蒋介石在1937年12月6日，还致电李宗仁、阎锡山他们说“南京决守城抗战”呢，头一天的日记里面，就自道“本日敌攻句容与醇（淳）化镇，见我军士气与兵力，彼已熟视无睹矣”，说穿了，就是早被日本看透了，又何“决守城抗战”之有呢？到美国斯坦福看蒋日记，正该看的，是这些言行不一啊，可是龙应台什么都看不到。同样的，蒋介石在1937年12月12日、给唐生智他们电报的同一天，日记里明明记着：“本日南京唐孟潇处已无人接电话，敌已过江占领江浦，则南京恐已不守乎？”却依然官样文章，留下要唐生智他们“仍以在京持久坚守为要”的鬼话，表示责不在己。看蒋日记，正该看的，是这些言行不一啊，可是龙应台什么都看不到，也完全没有比对史料的能力。,087.龙爸爸“杀敌无数”？.txt,8,《大李敖全集6.0》分章节\012.人物研究类\015.大江大海骗了你\087.龙爸爸“杀敌无数”？.txt,私人记录;公开说法;矛盾
LAT113-067,LAT113-101,大江大海骗了你,校对轮,已校对,方法,战略说辞须与实际命令核对,多妙啊，既然抗战“最后决胜之中心”“不在南京”，那么九天前到三天前通电死守以待“大变”、“一大变”干什么，是玩人民的命吗？到了12月24日，唐生智、罗卓英、刘兴联合呈文蒋介石，检讨得失，共十二点，无一句提到龙爸爸的宪兵，显然的，六千四百五十二员宪兵，比照起正规作战部队“数十万大军”来，太微不足道了吧？可是，龙爸爸不那样想，他要参一脚，制造历史神话，这不是飞龙在天，这可是飞龙在史啊。,087.龙爸爸“杀敌无数”？.txt,14,《大李敖全集6.0》分章节\012.人物研究类\015.大江大海骗了你\087.龙爸爸“杀敌无数”？.txt,战略;命令;核对
LAT113-068,LAT113-103,大江大海骗了你,校对轮,已校对,政治,权力把人才变成奴才会摧毁公民人格,□蒋介石一生努力的对象，不是培养奴才们的奴性吗？他的儿子克绍箕裘。我要再强调一遍：蒋介石把人才当奴才用、蒋经国把奴才当人才用，其反若正、其正若反。最后效果见诸蒋介石之丧。蒋介石出丧之日，台湾百姓夹跪道旁的场面，“更无一个是男儿”。纵古代帝王驾崩，人民被侮辱，也不逾是！这成什么世界！在道德上，人民又是何等下贱失格！下贱失格却不以为辱，这正是典型的麻木不仁，这又是何等可悲！,089.蒋介石奴才们的奴性.txt,3,《大李敖全集6.0》分章节\012.人物研究类\015.大江大海骗了你\089.蒋介石奴才们的奴性.txt,人才;奴才;公民尊严
LAT113-069,LAT113-104,大江大海骗了你,校对轮,已校对,人格,历史正义不能因时间过去而勾销,也许有人说，事情过去了，就算了，何必再鞭蒋之尸一至于此？其实，这种人才是伪君子与真奴才，并且是无知的。关心历史教训的人、关心人间正义的人、关心天道之极的人，对蒋介石一生祸国殃民的种种，都不会含糊了事的，只有伪君子与真奴才，才会这样不辨是非的一笔勾销。对这种行为，我们是看不起的！,089.蒋介石奴才们的奴性.txt,4,《大李敖全集6.0》分章节\012.人物研究类\015.大江大海骗了你\089.蒋介石奴才们的奴性.txt,历史正义;时间;是非
LAT113-070,LAT113-107,大江大海骗了你,校对轮,已校对,政治,统治者自封救星是一种政治宣传,□民进党中许多人是无知的。余政宪所说“抗战胜利时”蒋介石“被民众吹捧为民族救星”，并无此种事实。“民族救星”的吹捧，是到台湾以后“发扬光大”的。而其肇始，乃出于蒋介石自己不要脸的钦定。1962年，蒋介石亲笔写《对匪军口号》，其中第五条自写“蒋总统是大陆同胞的救星”、第八条又写“蒋总统才是你们的救星”。蒋介石自称救星，死不要脸极了。蒋介石既自称救星如此，歌功颂德的奴才们趁机把救星民族化，也就习以为常。如今，在主子死掉十六年之际，郝柏村“在国会殿堂”，公然肉麻的连称“民族救星”二次，其奴才嘴脸，真是老而弥坚。,093.蒋介石自称“民族救星”.txt,5,《大李敖全集6.0》分章节\012.人物研究类\015.大江大海骗了你\093.蒋介石自称“民族救星”.txt,救星;统治者;宣传
LAT113-071,LAT113-108,大江大海骗了你,校对轮,已校对,方法,民主和救亡功劳须接受反证,□这段答询很有代表性，因为可以显出奴才心态。第一、蒋介石是扼杀民主政治的元凶，奴才竟把民主政治归功给凶手，此荒谬者一；第二、蒋介石是丢掉大陆的元凶，奴才竟把台湾没沦入中共统治归功给凶手，为什么不反问一下，是谁之过，使大家来了台湾呢？此荒谬者二。,093.蒋介石自称“民族救星”.txt,7,《大李敖全集6.0》分章节\012.人物研究类\015.大江大海骗了你\093.蒋介石自称“民族救星”.txt,民主;救亡;反证
LAT113-072,LAT113-110,大江大海骗了你,校对轮,已校对,文化,政党会借外围写作者制造谎言,□美国谐星鲍勃霍伯（Bob Hope）说得好：里根（Reagan）总统不必说谎话，因为有人替他说。国民党不必不要脸了，因为有人替他不要脸了。,094.有人替他不要脸了.txt,5,《大李敖全集6.0》分章节\012.人物研究类\015.大江大海骗了你\094.有人替他不要脸了.txt,政党;写作者;谎言
LAT113-073,LAT113-111,大江大海骗了你,校对轮,已校对,方法,统帅回忆录会省略不利事实,从这些回忆里，我们知道：国民党在逃难前夜，是怎样牺牲自己的守备区指挥官刘玉章；刘玉章又怎样自己抢上了船，牺牲自己的子弟兵。当年他们来台湾，是这样子来的！来了以后还吹牛呢！而龙应台谈《大江大海一九四九》，竟避而不谈这么惊心动魄的撤退图，这叫什么比例呢？龙应台至少看过刘玉章的回忆录，她只谈五十二军雄赳赳的北上，却不谈五十二军惨兮兮的东渡，这叫什么取舍呢？,098.主任也被踩在脚下.txt,4,《大李敖全集6.0》分章节\012.人物研究类\015.大江大海骗了你\098.主任也被踩在脚下.txt,回忆录;撤退;省略
LAT113-074,LAT113-113,大江大海骗了你,校对轮,已校对,方法,回忆录须结合人证和内部资料核验,在张晴光的《血战余生》里，我们看不到这一段军中内幕，但是被退伍下来拉车的少校写出来了。光是五十二军的一些麟爪，我就可以动用出这么多的物证人证，龙应台谈的，都是一知半解啊。,099.五十二军老兵.txt,9,《大李敖全集6.0》分章节\012.人物研究类\015.大江大海骗了你\099.五十二军老兵.txt,回忆录;人证;内部资料
LAT113-075,LAT113-116,大江大海骗了你,校对轮,已校对,政治,撤退资格的不平等会暴露权力阶层,由此可见，所贵为逃难者，不能快似王季高，不能慢似郭衣洞，要不快不慢，恰得其中。这种恰得其中，我无以名之，姑名之曰“赛跑式逃难”。赛跑时，先跑会犯规，后跑会吃亏，只有一声枪响，同时起步，才算及格。今天到台湾的许多外省人，能够不为傅作义截回、不为共产党追到、又不为警备总部或调查局疑云盖顶者，皆当年精于起步者也！这种同时起步的逃难，乍看起来，虽然形似“公平竞争”，其实大大不然。因为大老爷起步，总得消息、工具、财力等方便，小百姓又如何赶得上？沈阳撤退时候，最后一架飞机是国民党省主席坐的；成都撤退时候，最后一架飞机是国民党党中央坐的。大老爷想逃难，只消飞遍了千山万水；小百姓想逃难，就只好走遍了千山万水了。,101.“共存亡”的骗局.txt,5,《大李敖全集6.0》分章节\012.人物研究类\015.大江大海骗了你\101.“共存亡”的骗局.txt,撤退;特权;阶层
LAT113-076,LAT113-117,大江大海骗了你,校对轮,已校对,政治,要求他人共存亡者常先留退路,□龙应台能够知道多少呢？《南齐书》记王敬则讽刺东昏侯父子说：“檀公三十六策，走是上计。汝父子唯应急走耳！”意思是说，檀道济三十六策走是上计，你们父子快逃才是上策啊！在蒋家王朝丢掉大陆的那段日子里，蒋介石、蒋经国父子二人，早已深得“父子唯应急走耳！”的上计，即使在遍地烽烟中，由于得情报消息与交通工具之便，照样急走得很从容。这在蒋经国1949年4月24日日记中，显示甚明：,103.“让老子先逃啊！”.txt,3,《大李敖全集6.0》分章节\012.人物研究类\015.大江大海骗了你\103.“让老子先逃啊！”.txt,共存亡;统治者;逃亡
LAT113-077,LAT113-123,大江大海骗了你,校对轮,已校对,方法,零散同期记录可以拼出历史图景,以上随手翻出《雷震日记》，乍看东一片西一片，贯串起来，却是一幅“1949”百怪图。“1949”的画面太多了，龙应台只会摭拾几个断片，乱扯一气，又如何得其真相？,106.“一九四九”百怪图.txt,14,《大李敖全集6.0》分章节\012.人物研究类\015.大江大海骗了你\106.“一九四九”百怪图.txt,同期记录;碎片;历史图景
LAT113-078,LAT113-124,大江大海骗了你,校对轮,已校对,方法,历史采访必须有文献基础,□龙应台花了那么大的气力，去做访问，却不知从文献资料上去回溯，以致事半功倍、治丝益棼。访问不是不能做，而要先靠文献资料打底子才行，否则访问在选样上，在高度、广度、深度上，都会一一出问题，并且，因受访者的极限，还会漏失大量珍贵的题目。所以说，文献资料太重要了，在这方面下功夫，可说是玩“1949”的先决条件。龙应台太外行了，她搞的是速成的、即溶的把戏，这怎么成？,107.龙应台不知道的乱伦.txt,3,《大李敖全集6.0》分章节\012.人物研究类\015.大江大海骗了你\107.龙应台不知道的乱伦.txt,采访;文献;史料基础
LAT113-079,LAT113-125,大江大海骗了你,校对轮,已校对,写作,历史书写应保存普通人的非凡故事,□记得希腊的俄狄浦斯（Oedipus）神话吗？神话主题就是人会受命运播弄，乱世中、冥冥中，人会不自知的乱伦。俄狄浦斯的遭遇，在希腊是神话；但在中国，却是活生生的人间故事。1948年4月5日的天津《大公报》上，有这样一则报导：,107.龙应台不知道的乱伦.txt,5,《大李敖全集6.0》分章节\012.人物研究类\015.大江大海骗了你\107.龙应台不知道的乱伦.txt,普通人;历史书写;故事
LAT113-080,LAT113-127,大江大海骗了你,校对轮,已校对,人格,最后觉悟比早年政治身份重要,□的确是佳话。宋希濂最了不起的是，他在廿载戎马以后、十年监狱过后，最后有了“白头誓不归”的大彻大悟，彻悟中国的前途，原来掌舵在他当年的敌人手中、在关他十年的敌人手中。这种转折，太动人了、太动人了。这种转折真是自动自发的，因为宋希濂1984年2月发表宣言，地点是在美国华盛顿，丝毫不受任何控制，自无被中共指使的可能，他能有这种反省、觉悟、与动作，自然动人感人。试看二十五年来，在海外的中国人，有宋希濂这样清醒头脑的，又有几人？在台湾的，就更不用说了。对比之下，龙应台不是糊涂人又是什么？她在《大江大海一九四九》里，对宋希濂的一生和转变只字不提，这也就是我说的男主角给写丢了，这种手法、这种程度，还要大谈《大江大海一九四九》，真荒唐啊。,109.“鹰犬将军”的转折.txt,5,《大李敖全集6.0》分章节\012.人物研究类\015.大江大海骗了你\109.“鹰犬将军”的转折.txt,觉悟;政治身份;晚年
