id,source_id,book,round,status,category,title,description,source_file,source_paragraph,source_path,keywords
LAT113-029,LAT113-042,大江大海骗了你,校对轮,已校对,人格,掌权者不能推卸已承认的责任,□从头目言，是罗斯福与蒋介石，从细部作业言，是王世杰与蒋经国。最后，龙应台的“1949”到了，蒋介石王世杰之流给赶出大陆了，退守到只有外蒙古四十四分之一大的台湾岛上了。1952年10月13日，蒋介石在中国国民党第七次全国代表大会第四次会议上，发表“对第七次全国代表大会政治报告”，秘密归属了责任所在。他说签约是“我个人的决策”、“是我的责任，亦是我的罪愆”、要“负其全责”。他在签约七年后，自己承认当年签约放弃外蒙古，“实在是一个幼稚的幻想，绝非谋国之道。”但是，王世杰这边呢，却仍旧一言不发，但却不断放出风声，他是“为国家利益”，以致如此。我在《蒋介石研究四集》有《蒋介石、王世杰卖国》一文，收有张九如影印给我的一封王世杰1966年2月22日致他的信，谈到“中苏谈判”之事，“惟为国家利益，世杰守口如瓶已二十年于兹，即令会聚，弟我亦病不能自由发表耳。”,038.被人强奸也是“国家利益”？.txt,3,《大李敖全集6.0》分章节\012.人物研究类\015.大江大海骗了你\038.被人强奸也是“国家利益”？.txt,掌权者;责任;推诿
LAT113-030,LAT113-044,大江大海骗了你,校对轮,已校对,方法,单方证言须与其他记录核对,□当然是。据《高雄市“二二八”事件报告书》：“……有案可据者，计伤公教人员三十一人，死八人，暴徒除拘获正法者外，死亡七人，民众伤五四人，死八六人，其余不详身分者，死二四人，合计死一二五人，伤八五人。”足证外省人有死亡；再据陈桐《杀戮起源蓄意煽动》（《自由时报》，1991年2月27日）：“……（暴徒流氓）甚至挟持外省人集体软禁在高雄中学内，每天只供给一粒饭团，境遇也相当凄惨……”足证外省人有被拘禁。可见彭明敏所述，是一面之词，他置外省人在高雄被杀被关于不闻，只记彭孟缉怎样怎样，其实，照彭孟缉《台湾省“二二八”事件回忆录》、《彭孟缉访问记录》，是会议席上涂光明先掏枪。彭孟缉固非善类，但此彭非彼彭，也别有说词，龙应台也该知道。至于龙应台引彭明敏“‘军法审判’后，涂光明被枪杀”云云，简直替彭孟缉搽胭脂抹粉了，哪来“审判”啊？兵荒马乱之际，彭孟缉这种恶棍还给你“审判”吗？,040.龙应台只见一彭.txt,5,《大李敖全集6.0》分章节\012.人物研究类\015.大江大海骗了你\040.龙应台只见一彭.txt,单方证言;受害者;交叉核对
LAT113-031,LAT113-045,大江大海骗了你,校对轮,已校对,人格,受害经历不能免除事后的自我反省,□她自己太不用功，才会上当；彭明敏他们太偏执，才会只看单方面的历史。其实这是一种“弱者的偏执狂”。谈“二二八”，众口一声，把悲剧定位在外省人的不是上，说破了，这就是“弱者的偏执狂”。人一变成“偏执狂”，则虽遭苦难，不能反省。“二二八”事件，在本省人眼中，百分之百全怪外省人。但我怀疑，到底有没有一个小数点——百分之百怪外省人中的一个小数点，本省人也不妨反省反省呢？例如事件之起，是缉私人员惊慌中开枪误杀了一名看热闹者，这种缉私人员应予严办，是对的，但群众包围警察局，要求立刻“就地正法”，这种不懂事的要求，任何官员都做不到。做不到就起暴动，把外省人中的无辜者予以打、砸、抢、杀，妇女予以强奸、婴儿予以摔死，这种行为，不该反省反省吗？由这种暴民滥杀行为招致来的暴君派部队登陆滥杀，能够百分之百全怪外省人吗？我绝对不是说国民党政府惹起民变、处理民变是对的，但相对方面，本省人的肆虐与招祸反应，也不无反省之处。但是，直到六十四年后的今天，又有几位反省了呢？,040.龙应台只见一彭.txt,7,《大李敖全集6.0》分章节\012.人物研究类\015.大江大海骗了你\040.龙应台只见一彭.txt,受害者;反省;责任
LAT113-032,LAT113-046,大江大海骗了你,校对轮,已校对,人格,双方都应反省本群体的暴力,□外省人不设身处地替台湾人想，台湾人至今谴责；但台湾人有无也该设身处地想想外省人呢？想想无辜被打杀的外省人呢？想想仇日老兵的报复心态呢？想想龙爸爸的满眼血丝呢？我绝不说外省人对，但我觉得，台湾人的真正菁英，应该勇於站出来，矫正矫正自己人的方向，“障百川而东之，挽狂澜于既倒。”而不是听任暴民胡来。台湾人菁英林献堂就是一例。在台中地区的外省人被暴民集中、要予以杀光的当口，林献堂挺身而出，大声说：外省人像蚂蚁一样多，我们今天杀光他们，他们明天就来杀光我们。暴民听了，怕了，才没一错再错。相对的，同是本省菁英的林茂生，以他那么崇高的学术地位，照他儿子林宗义的回忆，却是“他同意，加诸大陆人的暴力，以及对政府大楼与公务员的伤害，来表达极端的愤怒，乃是人民的幻灭与普遍而强烈的挫折感的一种合理表现”！林茂生明知“这种对财产与大陆人的普遍而不分皂白的暴力，用来作为有效的政治行动。是没有意义，也是没有用的”；明知“后果会狠严重，真吃力（台语）！”但他无法像林献堂那样挺身而出，大声引导自己人适可而止。作为菁英，在百川狂澜当前，他是不是少做了点什么呢？尤其与林茂生的“文化”不对头的，他竟相信“加诸大陆人的暴力”是“合理表现”，结果换来大陆人的暴力回敬了，要怪谁呢？,041.龙应台的爸爸杀台湾人？.txt,3,《大李敖全集6.0》分章节\012.人物研究类\015.大江大海骗了你\041.龙应台的爸爸杀台湾人？.txt,换位;群体;暴力
LAT113-033,LAT113-047,大江大海骗了你,校对轮,已校对,政治,国家政策必须放回制度和权力结构判断,□1947年时候，氛围的确如此。林宗光《美国人眼中的二二八事件》有一段：“……国务院的官员却自始不愿意使美国卷入台湾问题的漩涡之中……事变之后，卡儿氏被召回美国，与当时国务院主管远东事务的约翰·文森（John Carter Vincent）谈起台湾人对美国、联合国以及台湾将来地位的意愿时，文森曾以坚定的口气告诉卡儿氏：‘没有一位联合国人员——华盛顿的官员不用说——对台湾有任何兴趣。’……”美国人是大陆丢了的前夜，才打台湾主意。“二二八”时候，还不成气候，相信美国人的台湾菁英，无异是台湾傻瓜。,042.美国人害了台湾人.txt,9,《大李敖全集6.0》分章节\012.人物研究类\015.大江大海骗了你\042.美国人害了台湾人.txt,国家政策;制度;权力结构
LAT113-034,LAT113-048,大江大海骗了你,校对轮,已校对,写作,制造争议却不纠正错误是不负责任的写作,□当然是。这叫什么《大江大海一九四九》呢，点了火就跑，留下一大团错误与荒谬，这叫什么著作呢？,043.马英九请我吃饭.txt,3,《大李敖全集6.0》分章节\012.人物研究类\015.大江大海骗了你\043.马英九请我吃饭.txt,争议;错误;写作责任
LAT113-035,LAT113-049,大江大海骗了你,校对轮,已校对,法权,迟来正义可能成为机会主义,□即使是，也太迟了吧？何况她根本扭曲了正义。今天，人人会谈“二二八”了，这是一个好现象。不过，穷本溯源，大家这么勇敢，原来是有更勇敢的外省人带头的。外省人孟绝子早在国民党不准谈“二二八”时就谈“二二八”了。他先在几次演讲中提出，应该把“二二八”这一天定为“台湾苦难反省日”，后来他写成《台湾苦难反省日——化解台湾的隐痛“二二八”》一文，登在外省人李敖办的刊物上。孟绝子提出的“台湾苦难反省日”构想，比后来跟进的郑南榕、陈永兴、李胜雄发起的“二二八和平日”来，显得高明而深刻。把“和平”跟二二八连接在一起，本来就怪怪的。耶稣（Jesus Christ）有言他不是带来和平，是带来刀兵，所谓和平运动，往往是挑起刀兵的。因为倡言和平的，总未免舍末逐本——先搅起本已愈合的旧伤，再倡言抚平，这不太奇怪了吗？他们口口声声希望二二八的阴影尽快结束，但却勇往直前，遮住阳光，这样下去，阴影反倒越难结束了。今天二二八问题所以治丝益棼、越炒越不能结束，就在人们搞错了方向。我看遍了今天所有的“二二八”谈话与作品，他们的哀呼、他们的悲恸，都是令人同情的。我个人早在他们哀呼与悲恸之前多年，就刊出更勇敢的台湾人刘峰松为“二二八”受难者张七郎平反的文字，从哀呼与悲恸着眼，我与我的台湾人朋友早就先人著鞭，力斥外省人的凶残无情。我为义助台湾人而受刑受难受苦坐牢，记录俱在、路人皆知，我无须澄清我早就同情台湾人的立场。六十四年来，外省人为同情台湾人而被国民党迫害既深且久者，无出李敖之右，这不是我说的，这是台湾抗暴的先行者异口同声说的。,043.马英九请我吃饭.txt,5,《大李敖全集6.0》分章节\012.人物研究类\015.大江大海骗了你\043.马英九请我吃饭.txt,迟来正义;机会主义;二二八
LAT113-036,LAT113-050,大江大海骗了你,校对轮,已校对,方法,揭露强权暴行须使用一致标准,□俄国人的暴行固然该揭发，美国人就是好东西吗？俄国人1945年的暴行，龙应台都不放过，为什么却放过美国人1946年的暴行呢？1946比1945更接近“1949”吧？,049.龙应台不写美国大兵在强奸.txt,3,《大李敖全集6.0》分章节\012.人物研究类\015.大江大海骗了你\049.龙应台不写美国大兵在强奸.txt,选择性揭露;外国暴行;双重标准
LAT113-037,LAT113-052,大江大海骗了你,校对轮,已校对,文化,出版与媒体网络可以共同扭曲事实,□钱复的书是高希均、陈长文那一挂人出版的，龙应台的书是殷允芃那种货色出版的，他们都是天下书系，颠倒黑白，是一窝的。,051.钱复从“外交”到“性交”.txt,4,《大李敖全集6.0》分章节\012.人物研究类\015.大江大海骗了你\051.钱复从“外交”到“性交”.txt,出版;媒体;事实
LAT113-038,LAT113-053,大江大海骗了你,校对轮,已校对,人格,不能向党派媒体索求公正,□这是高希均、殷允芃式的公道。我从不向国民党的天下要公道，在那种天下里，这世界没有李敖。,051.钱复从“外交”到“性交”.txt,6,《大李敖全集6.0》分章节\012.人物研究类\015.大江大海骗了你\051.钱复从“外交”到“性交”.txt,党派媒体;公正;独立
LAT113-039,LAT113-057,大江大海骗了你,校对轮,已校对,方法,历史采访应覆盖关键决策者和完整世代,□访问是好的，但龙应台犯了一个大毛病，她只会访问到一些小人物，也就是低层人物。其实要弄清真相，要从高层人物下手才行。高层人物掌握动态与动向，从他们身上，才能看到全局。一九四九的故事，常常不是个人的、片段的，而是断续的、一组的、一代两代三代的相沿发展的。以蒋介石身边第一文胆陈布雷为例，爱国者陈布雷第一代是国民党、爱国者陈琏第二代是共产党、叛国者陈师孟第三代是民进党。三代故事的高潮是陈布雷为国民党而自杀、陈琏为共产党而自杀、陈师孟为民进党而杀了国家。为了亲切，听听陈琏在北京贝满女中的一个学生的回忆吧：,056.龙应台只会访问一些小人物.txt,3,《大李敖全集6.0》分章节\012.人物研究类\015.大江大海骗了你\056.龙应台只会访问一些小人物.txt,采访;决策者;世代
LAT113-040,LAT113-059,大江大海骗了你,校对轮,已校对,方法,失败者会集体改写失败原因,□因为有了集体挫败，别忘了“1949”给打到台湾来的蒋介石人马，都是失败者。失败的人、失败的马。马的好处是不会失败后说谎，人却会。集体说谎的最大案例，就是所谓“太原五百完人”。这一谎话不是一阵风，吹过就算了，它还有古迹呢，就在台北圆山大饭店前面的丛林里，有所谓“太原五百完人招魂塚”，有碑有庙，虽然有点荒烟蔓草了，但还健在，五百完人的集体谎话，正在琉璃瓦的钩心斗角间。,057.小心他们在集体说谎.txt,5,《大李敖全集6.0》分章节\012.人物研究类\015.大江大海骗了你\057.小心他们在集体说谎.txt,失败者;集体记忆;改写历史
LAT113-041,LAT113-060,大江大海骗了你,校对轮,已校对,方法,官方英雄数字须与调查相核,□至少数目灌了水，灌了十倍多。根据1950年9月13日的所谓总统令，明说：“故山西省政府委员梁敦厚，前于民国三十八年四月太原被共匪攻陷之际，率属集体自戕……偕同僚五百余人，从容就义。”这是“五百余人”的官方说法。但照阎锡山“太原五百完人成仁纪念碑”，则说：“是役也，除战死及军民殉难者无算外，我文武人员义不反顾，集体自杀以报国家者，举今所知已五六百人。”两者说法，死难人数在五百到六百之间，至为明确。不过，照《山西文史资料》第六十辑公布的调查报告，事实上，死难者“全部只有四十六人”而已！的确有人死了，但没死那么多。号称五百，是串连并比美古代田横五百义士殉死的故事，于是就吹起牛屄来。,058.所谓“太原五百完人”.txt,3,《大李敖全集6.0》分章节\012.人物研究类\015.大江大海骗了你\058.所谓“太原五百完人”.txt,官方数字;调查;英雄神话
LAT113-042,LAT113-062,大江大海骗了你,校对轮,已校对,人格,强迫不能证明自愿牺牲,□她们是被裹胁的，例如特警处代处长徐端的小老婆刘建德就是其中之一，她是山西徐沟人，死时才十九岁。特警处副处长兰风霸占的晋剧女演员王桂燕也陪做“完人”了，她本要逃走，被兰风当场击毙了，死时才十八岁。龙应台喜欢向失败者致敬，请致敬吧。,058.所谓“太原五百完人”.txt,7,《大李敖全集6.0》分章节\012.人物研究类\015.大江大海骗了你\058.所谓“太原五百完人”.txt,强迫;英雄;牺牲
LAT113-043,LAT113-063,大江大海骗了你,校对轮,已校对,政治,政权可以在死后替人制造烈士身份,□就算强迫你做烈士吧。不过，有一种比较仁道的，就是明知你生前非烈士，但硬说你是烈士，大家听了高兴。,059.说你是烈士，你就是烈士.txt,3,《大李敖全集6.0》分章节\012.人物研究类\015.大江大海骗了你\059.说你是烈士，你就是烈士.txt,烈士;政权;历史制造
LAT113-044,LAT113-064,大江大海骗了你,校对轮,已校对,政治,只批评小恶可能是在回避暴政,□她走柏杨路线，也骂起中国人来。她的招牌文章是《中国人，你为什么不生气》，所举的的例子都是日常生活的鸡毛蒜皮。她谴责商人偷杀老虎，但却绝口不提“苛政猛於虎”；她要求立法保护老虎，但却绝口不提保护“法中之法”的宪法，她写道：“我爱台湾，无可救药的爱着这片我痛恨的土地”，但她不敢恨土地上的蒋介石，就把中国人给品头论足个够。一如柏杨的怯懦。柏杨明明想骂关了他的元凶，但他不敢明指，就拖全体中国人下水，都谥以“丑陋的中国人”了。有一点，要特别一提的是，柏杨在国民党“中国青年反共救国团”伪组织里做大将，是非常“得君行道”的显赫人物：在横贯公路完成时，国民党“层峰”“巡视”，他会“随侍”在侧，为“横贯公路十二景”题名，他的显赫，由此可见；他的“文学侍从之臣”地位，也由此可证！后来，因为办救国团活动，假公济私，诱奸女学生，罢官下台。严格说来，柏杨还没做到国民党伪政府中的官，只做到党官团官。,062.龙应台的柏杨路线.txt,3,《大李敖全集6.0》分章节\012.人物研究类\015.大江大海骗了你\062.龙应台的柏杨路线.txt,小恶;暴政;批评上限
LAT113-045,LAT113-065,大江大海骗了你,校对轮,已校对,人格,间接批评可能是在回避权力,说龙应台没什么好提，却又提到她，基本原因是直接与蒋氏父子有关的奴才们媚蒋，还不奇怪；龙应台太年轻了，得不到“圣眷”，却一脉相承起媚蒋大业来，就太奇怪了。正因为这个女人有样板作用，所以检查她的一贯言论，便成了必要。大体说来，她前期的著作，是在这一基调上反思中国人的，但她不敢反思蒋介石和蒋介石的伪组织、不敢擒贼擒王。所以千言万语，不过假“野火”闷烧，都是避重就轻。龙应台做过德国人的太太，嫁给洋人不算错，但处处指着被她背离的中国人，以德国腔说三道四，就偏差不妥了。龙应台如果只是以她的身份，限于“德国人太太思维”，问题尚小。不可收拾的是，她又扩大大谈思想问题、历史问题，但她的头脑跟训练，实在不能谈这些问题，所以一谈就露了馅、漏了气，并且限于“蒋介石思维”而不自知，这就麻烦来了。,062.龙应台的柏杨路线.txt,5,《大李敖全集6.0》分章节\012.人物研究类\015.大江大海骗了你\062.龙应台的柏杨路线.txt,知识分子;间接批评;权力
LAT113-046,LAT113-066,大江大海骗了你,校对轮,已校对,文化,政治权力会形成文学体制,□从国民党文人说起。实际上是指国民党的知识分子，为了语含贬义，就统称国民党文人了。文人是舞文弄墨的，国民党总理号召发挥“笔墨之权威”，但国民党的笔墨实在不怎么样。它早期的文胆是叶楚伧之流，本是海上“鸳鸯蝴蝶派”那种货色，文字恶劣，一路是共产党的手下败将。后来拾点左派余唾，但文字一出手，就不脱传统国民党文人那一套。传统的国民党文人太老派了、太迂腐了、太教条了，党性太强了、文字太笨了、臭招牌太明显了。他们这些人，表现在“党八股”上、“战斗文艺”上、“军事文艺”上、“复兴岗学报”上、“中央日报”上，到处屙屎、臭气熏天，他们的作品是集体失败的，但他们“肉麻当有趣”，写个不停。他们之中有一股流派，以“阐扬主义，反共抗俄”号召，其中任卓宣（叶青）、胡秋原属之，文章又臭又长又无趣。本来还有人信什么三民主义的，被任卓宣一本又一本大阐扬特阐扬后，大家都怕死主义了。胡秋原是另一宝。抗俄抗了千言万语，被人问道：“你说你抗俄，可是我们感觉不到啊。”他的答复竟是：“我一路骂的是日本，日本即是俄国！”这样子乱七八糟，难怪国民党在开除他一次后，多年后又开除了他。以上所说的，都是传统的国民党文人，这些人写文章，总评八个大字：“暴殄文字，乱七八糟！”这样子搞宣传，当然没人信，甚至适得其反。最后，传统的国民党文人没指望了，只好冒出有点花哨的，可叫花哨的国民党文人。,064.国民党文人.txt,3,《大李敖全集6.0》分章节\012.人物研究类\015.大江大海骗了你\064.国民党文人.txt,政治文学;体制;国民党
LAT113-047,LAT113-067,大江大海骗了你,校对轮,已校对,政治,独裁者死后仍有政治文化为其免责,□蒋介石弄成的“残山剩水”，竟被“目光如炬”的龙应台看成“大江大海”，并且写书发扬，害得傻瓜们视为“优良读物”，这种局面，都是蒋介石作俑的，当然要算在蒋介石头上。孔夫子说：“始作俑者，其无后乎？”蒋介石真会作俑，因为他自己就变成了俑。结果他有了后了，后就是一群“蒋介石超渡派”，从德国弃妇、到大陆学人……统统部是。这派人士的贱处，在他们并非蒋介石嫡系的孤臣孽子或直接受益人，既非郝家也非连家、马家、吴家……而是八竿子打不到的“甘为人后”之家，这些人，甘为蒋介石超度，太贱了吧？,065.龙应台比国民党还国民党.txt,16,《大李敖全集6.0》分章节\012.人物研究类\015.大江大海骗了你\065.龙应台比国民党还国民党.txt,独裁者;免责;政治文化
LAT113-048,LAT113-069,大江大海骗了你,校对轮,已校对,写作,误译会颠倒基本语义,事实上，孔子专家们都翻译错了。《论语》中“是礼也”中的“也”字是“耶”字的意思，“是礼也”乃是“是礼耶”的反问语气，意思是反问：这是礼吗？在周公庙里竟用到天子之礼，这是逾越礼的规范的，礼该这样吗？我刚才说了一大堆，就在点出孔夫子不是在问，而是在反问。是“大江大海”吗？,066.孔夫子在质疑啊.txt,7,《大李敖全集6.0》分章节\012.人物研究类\015.大江大海骗了你\066.孔夫子在质疑啊.txt,误译;语义;专家
LAT113-049,LAT113-070,大江大海骗了你,校对轮,已校对,写作,批评文字可以采用直接棒喝的方式,□禅宗和尚教导徒弟的方式，或当头一棒、或大喝一声，前者德山、后者临济，都是用粗线条的开门见山，很痛快，我赞成当头棒喝的痛快态度，当然不赞成又吼又叫又动棒子，虽然孔夫子有时也动粗，“以杖叩其胫”，那是他生气了，痛骂原壤这小子的无礼，张开大腿等本夫子到来。,067.当头一棒，大喝一声.txt,3,《大李敖全集6.0》分章节\012.人物研究类\015.大江大海骗了你\067.当头一棒，大喝一声.txt,批评;棒喝;文风
LAT113-050,LAT113-073,大江大海骗了你,校对轮,已校对,方法,党派框架会使史家写错历史,□不但不错，甚至满深呢。我念研究所时，第一个临时职业，每月赚一千块钱，就是他介绍的，我一直感念他。但他一辈子的努力，都限于“国民党史观”的框框里，不能自拔。在他晚年的时候，我曾劝他拋掉“国民党史观”，重新改写或翻作他一生的著作，我甚至愿意提供协助，可惜他无此魄力。他得享高寿，活了九十三，最后写《三生有幸》大陆版结局，他始终没有“反正”。一生勤奋，却写错了历史。,070.吴相湘的“国民党史观”.txt,5,《大李敖全集6.0》分章节\012.人物研究类\015.大江大海骗了你\070.吴相湘的“国民党史观”.txt,史家;党派框架;历史
LAT113-051,LAT113-075,大江大海骗了你,校对轮,已校对,人格,受害者也可能认同迫害者,□那种心态，该叫国民党式的“斯德哥尔摩症候群” （Stockholm syndrome），本来是被裹胁的受害人，结果却反过来讨好裹胁他的，不论是合作、宽容、附逆、或代为开脱，都算。张玉法当年做流亡学生，在澎湖被国民党“刺刀从军”——在刺刀下强迫学生从军，反对者当场用刺刀扎过去，人人自危。张玉法因为年纪小、个子矮，没被挑中当兵，但他亲历了国民党的残暴与迫害，却终身追随国民党，曲学阿世，太莫名其妙了。,071.张玉法那些人的心态.txt,3,《大李敖全集6.0》分章节\012.人物研究类\015.大江大海骗了你\071.张玉法那些人的心态.txt,受害者;迫害者;认同
LAT113-052,LAT113-076,大江大海骗了你,校对轮,已校对,人格,受难经历不能取代反省能力,□李桢林下台后、退伍后，他跟许历农他们，一群国民党的老将军，跑到北京，促成两岸军事互信了。他们因为附逆，一辈子人生都走错了路，可是垂老之年，却奋其余勇，在两岸之间多少做一点矫正工作了，也算可圈可点。比起张玉法之流来，高明多多矣。张玉法之流只会抱国民党大腿，可见国民党文人还不如国民党武人。,071.张玉法那些人的心态.txt,7,《大李敖全集6.0》分章节\012.人物研究类\015.大江大海骗了你\071.张玉法那些人的心态.txt,反省;受难;知识分子
