id,source_id,book,round,status,category,title,description,source_file,source_paragraph,source_path,keywords
LAT107-001,LAT107-002,陈水扁的真面目,校对轮,已校对,政治,有限选项会迫使选民选择较小危害,陈水扁是小人物，并非说其他的所谓总统候选人比他大，而是陈水扁是小人物中比较危险的、比较更烂的，他的朝三暮四、反复无常，会给台湾招来祸害，此之谓危险；他的小人得志、A钱枉法，皆非其他烂苹果所能比拟，此之谓更烂。“台湾人的悲哀”有二：第一，他们没有智慧和机会选出最好的。第二，他们必须在有限的选项里痛苦的选出个比较危险少的、比较不烂的，而这本书，正是痛处的南针、苦海的慈航。,《陈水扁的真面目》引言.txt,5,《大李敖全集6.0》分章节\012.人物研究类\009.陈水扁的真面目\《陈水扁的真面目》引言.txt,选举;有限选项;危害
LAT107-002,LAT107-004,陈水扁的真面目,校对轮,已校对,政治,反对党也会复制破坏议会规范的坏习惯,为什么？因为违反民主国家的议会规格，根本就是民进党优为之的一条路。他们一开始就走上了歧途，结果相激相荡、有样学样，破格行事，非此不快，最后的陈水扁，又何能例外?,012.陈水扁就会这样！.txt,5,《大李敖全集6.0》分章节\012.人物研究类\009.陈水扁的真面目\012.陈水扁就会这样！.txt,反对党;议会规格;坏习惯
LAT107-003,LAT107-006,陈水扁的真面目,校对轮,已校对,写作,掌权者会任意改写民主一词的含义,"所谓英美式的民主政治，是指道道地地的英美式民主政治，而不是挂羊头卖狗肉的英美式民主政治。《镜里风云》（Through the Looking Class）里，汉普特·邓普特（Humpty Dumpty）对阿丽丝（Alice）小姑娘说：“当我用一个字眼时候，它的意思就只是我要它表达的意思——既不多，也不少。”（When I use a word, it means just what I choose it to mean-neither more nor less.）阿丽丝抗议说：“问题是，你不能拿字眼又当这个讲又当那个讲。”汉普特·邓普特答得倒也干脆，他说：“问题是，谁说了算而已。”虽然有人说中国也在实行英美式的民主政治，但所实行的，其实只是汉普特·邓普特式的，只是他说了算的民主字眼而已，这种字眼，只是他要表达的集团专政的民主羊头而已。",012.陈水扁就会这样！.txt,7,《大李敖全集6.0》分章节\012.人物研究类\009.陈水扁的真面目\012.陈水扁就会这样！.txt,政治语言;民主;权力
LAT107-004,LAT107-007,陈水扁的真面目,校对轮,已校对,文化,民主首先是一种生活教养和风度,英美式民主政治的最大特色，在于他们把民主当成一种生活方式、一种教养、一种格调，这种种优良品质，形成了所谓民主风度。美国哥伦比亚大学校长巴特勒（N. M. Butler）说：“当一名绅士的难处之一是，你不被允许粗暴的主张自己的权利。”（One of the embarrassments of being a gentleman is that you are not permitted to be violent in asserting your rights.）英美式民主政治下，不论议会问政也好、抗议游行也罢，都不时兴粗暴。政治立场，尽管坚定；但表达这种立场，却“其争也君子”。,012.陈水扁就会这样！.txt,8,《大李敖全集6.0》分章节\012.人物研究类\009.陈水扁的真面目\012.陈水扁就会这样！.txt,民主;生活方式;风度
LAT107-005,LAT107-008,陈水扁的真面目,校对轮,已校对,政治,反对威权不等于自身已经民主,反看中国，中国的民主政治，在大路上，已被“人民民主专政”给专政了；在台湾，四十年的蹉跎，失掉了建立民主橱窗的好机会。民进党一出道，攻击国民党不民主，我有同感；但民进党的民主又在哪里，也令人着急。民进党内部结构上如何不民主，姑且不谈它；外在表现上的粗暴，却是有目共睹的。不论在议会论政或在马路上抗议游行，都是一派粗暴，这就太没水准了。,012.陈水扁就会这样！.txt,9,《大李敖全集6.0》分章节\012.人物研究类\009.陈水扁的真面目\012.陈水扁就会这样！.txt,反对党;威权;民主
LAT107-006,LAT107-009,陈水扁的真面目,校对轮,已校对,政治,粗暴抗争可能先摧毁民主,汪精卫曾悍然对青年党说：国民党的天下是自己打来的，你们不满意，去革命好了。民进党如性好粗暴，不如去革命，不必假民主之名养成许多非民主的坏习惯，这样荒腔走板，没把国民党搞垮，却先把民主搞垮了。张鸿学批评朱高正，说：“讲民主，你没有风度；搞革命，你不敢。”若不以人废言，这话说得真不错。民进党的最大悲哀是，它有机会建立民主橱窗，却一开始就误入了歧途，一切弄得不伦不类，却还懵然不知、洋洋自得。,012.陈水扁就会这样！.txt,10,《大李敖全集6.0》分章节\012.人物研究类\009.陈水扁的真面目\012.陈水扁就会这样！.txt,粗暴抗争;民主;革命
LAT107-007,LAT107-010,陈水扁的真面目,校对轮,已校对,法权,民主规范也依靠不成文的法律精神,所谓民主风度，并不是事事要靠成文的规范来的，相反的，而是照许许多多不成文的规范来的。陈水扁是优秀的法律学者，他当然知道：人间的许多规范是不在话下的，法律学者对某些法律，不崇尚“列举权力说”（Theory of Enumerated Powers），而崇尚“隐含权力说”（Theory of Implied Powers），他们认为，这种包含由习惯（customs）、惯例（practices）、常规（maxims or precepts），以及其他社会制约的许多非法律项目，其实也隐含在法律精神里。所以，事事用明文法律来规定，是没有必要的。换句话说，法律精神的维系，乃在于荀子所谓的“约定俗成”，人人皆知的规范，是不在话下的。,012.陈水扁就会这样！.txt,11,《大李敖全集6.0》分章节\012.人物研究类\009.陈水扁的真面目\012.陈水扁就会这样！.txt,民主规范;不成文规范;法律精神
LAT107-008,LAT107-012,陈水扁的真面目,校对轮,已校对,法权,没有明文禁止不等于可以破坏规范,坏榜样可太多了，但是以未曾规范做借口，擅行破坏议会规格，显然是由朱高正、林正杰之流作俑的。两年前，在林正杰还没当选立委前，就先朝立法院这么干了。林正杰率众到立法院旁听，可是个个身穿“抗议的衣服”，大闹会场。同时民进党的朱高正在旁助威，认为：“旁听人穿着有标语的衣服进入议场，那是他们的表现自由。”但是，主席反问了一句：“假使有人在身上贴有‘我要进来打朱高正’的条子，警卫是不是能让他进来？当然不能，所以有些事情希能自我反省一下。”可悲的是，民进党和国民党一样，是疏于自我反省的。林正杰以一副被迫害狂的激越之情，大喊立法院会议旁听规则并没规定不可以身上贴字进场，为什么不能贴字？但是，我们忍不住要问，旁听规则中也没规定不可以当众小便，是不是照民进党逻辑，也可以在旁听席上尿一下呢？——对人人皆知的规范，是不在话下的，这样子事事要枚举规定，列入规则，岂是讲理的人干的事？,012.陈水扁就会这样！.txt,13,《大李敖全集6.0》分章节\012.人物研究类\009.陈水扁的真面目\012.陈水扁就会这样！.txt,明文规则;规范;自我反省
LAT107-009,LAT107-014,陈水扁的真面目,校对轮,已校对,人格,政治人物应兼具犀利和从容,陈水扁以他湛深的法学修养，本可做一位从容而犀利的立法委员，但他的缺点是犀利有余，从容不足，问政态度，失之紧张严肃，走火入魔以后，必然沦为朱高正以下的动作，这是很可惜的。我希望他知过必改，为人立下台湾人还是有民主风度的印象，使人知道台湾人不全是没教养的，这才好。,012.陈水扁就会这样！.txt,15,《大李敖全集6.0》分章节\012.人物研究类\009.陈水扁的真面目\012.陈水扁就会这样！.txt,政治人物;犀利;从容
LAT107-010,LAT107-015,陈水扁的真面目,校对轮,已校对,人格,敌人不正当不能替自己的不择手段辩护,对上面陈水扁和瞿海源、张忠栋、林玉体诸位这些理由，我认为是站不住的。因为这一事件的关键，不在国民党郝柏村如何王八蛋，而在反对者自己是否也要做王八蛋。国民党郝柏村的王八蛋，即如他们各位所描绘的，一一属实，又怎么样？国民党他们是王八蛋，早已不是新闻，但是，因为国民党他们是王八蛋，反对者自己就可以不择手段，以破坏制度的方法，“促其尊重制度”么？就可以破坏民主法制的方法，“促其……一切以民主、法制为依归”么？陈水扁的行为，不论是学者所辩称的“只是一个小动作”也好、“也许不礼貌”也罢、“并不是很过分”也成，揆于文明国家的议会来，总是丢人现眼的吧？总是人家所无而“台湾第一”的吧？这种学者不知导人以正，反倒曲学阿世来阿“阿扁”，治学治到这种媚世的水平，我们是不敢领教的！,013.学者不可曲学阿世阿“阿扁”.txt,4,《大李敖全集6.0》分章节\012.人物研究类\009.陈水扁的真面目\013.学者不可曲学阿世阿“阿扁”.txt,敌人;不择手段;制度
LAT107-011,LAT107-016,陈水扁的真面目,校对轮,已校对,政治,不择手段是政治悲剧的根源,陈水扁事件，在我看来，比国民党郝柏村的王八蛋行为更重要。因为这事件涉及政治上最基本的关键——目的与手段的问题。在政治上为了目的不择手段，是今天我们所有悲剧的乱源。自来共产党是不择手段的，跟共产党学的国民党也是不择手段的，今天的反对者，乃至护航的学者，如果也以不择手段为表率，则是自我堕落的开始，是绝对要不得的。,013.学者不可曲学阿世阿“阿扁”.txt,5,《大李敖全集6.0》分章节\012.人物研究类\009.陈水扁的真面目\013.学者不可曲学阿世阿“阿扁”.txt,目的;手段;政治悲剧
LAT107-012,LAT107-017,陈水扁的真面目,校对轮,已校对,方法,目的正当不保证手段正当,一、目的正当，并非就是手段的正当；,013.学者不可曲学阿世阿“阿扁”.txt,7,《大李敖全集6.0》分章节\012.人物研究类\009.陈水扁的真面目\013.学者不可曲学阿世阿“阿扁”.txt,目的;手段;正当
LAT107-013,LAT107-019,陈水扁的真面目,校对轮,已校对,方法,不正当手段会反过来污染正当目的,三、不正当的手段影响正当的目的；,013.学者不可曲学阿世阿“阿扁”.txt,9,《大李敖全集6.0》分章节\012.人物研究类\009.陈水扁的真面目\013.学者不可曲学阿世阿“阿扁”.txt,手段;目的;污染
LAT107-014,LAT107-022,陈水扁的真面目,校对轮,已校对,人格,政治胜利也必须堂堂正正,亚历山大大帝不肯夜袭敌人，理由是他要堂堂正正的赢取对方，不愿意窃取胜利。我特写此文，要求我的朋友陈水扁永保素志，不要再犯错了。,013.学者不可曲学阿世阿“阿扁”.txt,17,《大李敖全集6.0》分章节\012.人物研究类\009.陈水扁的真面目\013.学者不可曲学阿世阿“阿扁”.txt,政治胜利;堂堂正正;亚历山大
LAT107-015,LAT107-025,陈水扁的真面目,校对轮,已校对,政治,国家领导者不应以籍贯缩小认同,如果阿扁能说：台湾选总统，台湾人当选了，而不说台南人当选了，岂不更见其大吗？可叹的事，阿扁太小器了。“惜乎其不大也！”这样长不大的台南人，台南人不以为耻吗？,017.阿扁心胸太狭窄了！.txt,4,《大李敖全集6.0》分章节\012.人物研究类\009.陈水扁的真面目\017.阿扁心胸太狭窄了！.txt,国家领导者;籍贯;台南
LAT107-016,LAT107-026,陈水扁的真面目,校对轮,已校对,方法,打击敌人也不能歪曲真相,这种抬高自己、斗臭宋楚瑜的不正确手段，积极表现在两个“总归户”的现象上，第一，台湾的政治犯案件中，官方承认的至少有两万九千四百零七件，但是今天却总归户到“美丽岛案”单一案子上，而置其它两万九千四百零六件政治案于不问。并且，尤其不正确的是，“美丽岛案”的总归户，竟不归户到被告身上，反倒归户到律师头上，这太荒谬了，所以我们每天看到的，竟是“美丽岛案”律师们的作秀招摇（如陈水扁、苏贞昌、谢长廷、张俊雄、尤清、郭吉仁等等），反倒忽略了真正受苦受难打拼坐牢的被告，这是不对的。第二、当年打压言论自由的，陈水扁既认定宋楚瑜是“共谋”和“从犯”，如今却由包括他自己在内的“美丽岛律师团”，联合“炮轰杀手宋”，而把一切罪状“总归户”到宋楚瑜一个人的头上，这种干法，也是不对的。中国历史有“天下之恶皆归之”的干法，这回“美丽岛律师团”可真得到大中国斗臭文化的真传了。但这样搞法，是搞选举，不是发掘真相，不但宋楚瑜会不服气，连阿扁口中“资料搜集功夫世界一流”的李敖也会不以为然。我李敖赞成打击敌人，但歪曲真相的方法打击敌人是不可以的。,018.为阿扁论李敖的谈话进一解.txt,4,《大李敖全集6.0》分章节\012.人物研究类\009.陈水扁的真面目\018.为阿扁论李敖的谈话进一解.txt,敌人;歪曲;真相
LAT107-017,LAT107-027,陈水扁的真面目,校对轮,已校对,人格,是非判断不应随族群立场改变,被国民党政府冠以“台独分子”，为台湾人坐牢多年的外省人李敖，十多年前，曾为追求二二八真相，编著了《二二八研究》、《二二八研究续集》、《二二八研究三集》三部书。出版以后，台湾人中的偏执狂分子打电话到出版社，大骂“干你娘”；而外省籍的老兵型的书摊老板也拒绝销售，理由是李敖替台湾人讲话，“二二八的书我们不要卖！”有人问我，说你不接生人电话，怎么会干到你的娘？我说我娘八十岁了，有什么好干？但干接电话的职员的娘，我也感同身受。这些没水准没格调的台湾人中的褊狭分子，这样没有是非，又与下三滥的外省人国民党何异？他们青出于蓝，国民党比他们恐怕还文明一点呢！,019.去他妈的二二八公园！.txt,2,《大李敖全集6.0》分章节\012.人物研究类\009.陈水扁的真面目\019.去他妈的二二八公园！.txt,是非;族群;立场
LAT107-018,LAT107-028,陈水扁的真面目,校对轮,已校对,文化,公共纪念不能选择性抹去不利史实,为什么这些台湾人中的褊狭分子这样没有是非、不识好歹呢？追根究柢，是他们没有好的教养。台湾这种货色的人，是两种传统的产物，一种是清朝的罗汉脚，一种是日本浪人，这两种传统的结合，造就了它的地区特色，它的乡土气质是清朝式的、它的造型打扮却是日本式的，再加上国民党的离奇教化，自然生出这么多莫名其妙的偏执狂。别以为对二二八的态度跟国民党一样不讲理，只是口嚼槟榔的下等人干的，陈水扁一上台，就把台北市新公园改成什么二二八公园，又在公园中搞出什么二二八纪念馆，单方面抹杀台湾人在二二八时杀外省人的事迹不提，只强调外省人如何杀台湾人，这种挑拨族群的褊狭行径，是多么可恶！尤可骇异的是，所谓二二八纪念馆中，竟看不见李敖等先知先觉先进先导反抗人物照片，反倒看到的是美丽岛律师群的照片，并且一连重复出现两次，这成什么话，美丽岛律师陈水扁如此利用公器自我吹捧，未免太不要脸了。,019.去他妈的二二八公园！.txt,3,《大李敖全集6.0》分章节\012.人物研究类\009.陈水扁的真面目\019.去他妈的二二八公园！.txt,公共纪念;史实;族群
LAT107-019,LAT107-029,陈水扁的真面目,校对轮,已校对,方法,和平交权必须等到事实发生后才能确认,我用红笔打了两个问号，第一个问号是，在蒋经国跟蒋介石中间还有一位总统严家淦，他也是活着时候交出政权的，李登辉把他完全忘记了；第二个问号是，5月20日还没有到来，我们怎么知道李登辉会如何呢？,020.阿扁骗选票，敢说不敢做.txt,4,《大李敖全集6.0》分章节\012.人物研究类\009.陈水扁的真面目\020.阿扁骗选票，敢说不敢做.txt,和平交权;事实;核验
LAT107-020,LAT107-031,陈水扁的真面目,校对轮,已校对,方法,不了解亲历历史会使后人改写它,魏廷朝坐牢并不是这个原因，因为彭明敏逃到瑞典，由瑞典发消息回来，他的下落每个人都知道，国民党的特务机关也知道，所以林义雄的说法是错误的，因为他们完全不了解我们当年辛辛苦苦所面对的历史，并且今天很多的历史都被污蔑、改写了。,020.阿扁骗选票，敢说不敢做.txt,7,《大李敖全集6.0》分章节\012.人物研究类\009.陈水扁的真面目\020.阿扁骗选票，敢说不敢做.txt,历史;改写;不了解
LAT107-021,LAT107-032,陈水扁的真面目,校对轮,已校对,文化,政治命令修改教科书会扭曲历史,有一点很奇怪，过去教科书都谈到罗福星如何爱台湾、如何为台湾打拼，可是，在最近的“认识台湾的教科书”，就是李登辉下命令说台湾教科书要开始修改，由中研院历史语言研究所所长杜正胜他们主持，这教科书弄得很荒谬，把整个历史都改写了，把日本人压迫我们的历史都改写了。,020.阿扁骗选票，敢说不敢做.txt,10,《大李敖全集6.0》分章节\012.人物研究类\009.陈水扁的真面目\020.阿扁骗选票，敢说不敢做.txt,政治命令;教科书;历史
LAT107-022,LAT107-033,陈水扁的真面目,校对轮,已校对,政治,政治需要会重新塑造人物籍贯,由这个例子告诉大家，一个人的籍贯随着政治行情在变化，罗福星就是这么一个例子。他是广东郑平人，还到过广东参加三月二十九日的起义，七十二烈士打死了，他只是没被打死。请问这种人物怎会忽然变成台湾苗栗人？因为在历史上或感情上，大家愿意认同他；因为你是一个爱台湾的人，所以我们认为你是苗栗人。,020.阿扁骗选票，敢说不敢做.txt,14,《大李敖全集6.0》分章节\012.人物研究类\009.陈水扁的真面目\020.阿扁骗选票，敢说不敢做.txt,政治需要;籍贯;认同
LAT107-023,LAT107-036,陈水扁的真面目,校对轮,已校对,政治,政治团结口号可能暗含族群排除,戏剧《游龙戏凤》描写明武宗到民间玩，在梅龙镇碰到卖酒的女孩，女孩问他住哪里、做什么的，他说是住在北京城大圈圈里的小圈圈，小圈圈里的黄圈圈，这女孩听不懂，事实上代表皇帝的权力是黄圈圈。报载“建国党表态挺扁”，事实上不是建国党，那群人有李镇源、郑邦镇、彭明敏、蔡同荣等人，他们支持阿扁我没话说，可是他们的理由“台湾人大团结”我要批评，那句话意思是台湾岛上有一种人不是台湾人，划清了族群的界线，这是“大圈圈”。,020.阿扁骗选票，敢说不敢做.txt,22,《大李敖全集6.0》分章节\012.人物研究类\009.陈水扁的真面目\020.阿扁骗选票，敢说不敢做.txt,政治团结;族群;排除
LAT107-024,LAT107-037,陈水扁的真面目,校对轮,已校对,方法,无族群承诺必须用实际言论检验,苗栗人可以吗？苗栗人不可以。苗栗在历史上是族群最被迫害的地区，因为客家人比例较高。阿扁搞竞选、骗我们选票时说，我没有族群的意识，没有省籍的观念，这种人要不要相信他？不能相信！他真的是见人说人话，见鬼说鬼话。我觉得我们台湾的前途自己真的要想好，怎样做苗栗人？苗栗人的一个特色，基本上在台湾是一开始就被打压的族群，直到1949年或1945年，外省人来后，苗栗地区的客家人才开始好转，被福佬人认同，否则会很惨。,020.阿扁骗选票，敢说不敢做.txt,24,《大李敖全集6.0》分章节\012.人物研究类\009.陈水扁的真面目\020.阿扁骗选票，敢说不敢做.txt,族群承诺;言论;核验
LAT107-025,LAT107-039,陈水扁的真面目,校对轮,已校对,政治,崇高自由口号也可能被卖给财阀,我跟阿扁没有私人上的不愉快，当时我出钱给郑南榕办杂志，叫《开拓周刊》，我们争取百分之百的言论自由，社长是陈水扁。可是今天，争取百分百的言论自由已经被阿扁扭曲到什么程度？他有一个传单帮《自由时报》做广告，“争取百分之百的自由，不要错过《自由时报》”，连《自由时报》都变成争取言论自由的报，请问台湾还有真理吗？阿扁可以把我们共同的理想最后向财阀做这样子谄媚时，今天我为什么要站出来批评阿扁，这是一个原因，并且拿证据给大家看。,020.阿扁骗选票，敢说不敢做.txt,26,《大李敖全集6.0》分章节\012.人物研究类\009.陈水扁的真面目\020.阿扁骗选票，敢说不敢做.txt,自由口号;财阀;谄媚
LAT107-026,LAT107-042,陈水扁的真面目,校对轮,已校对,方法,政见来源必须接受旧资料核验,我手里拿这么多资料，阿扁提出一个政见，“我们如何消除台湾的黑金呢——要成立廉政公署”，像香港一样，这是抄李庆华的，看这资料“立法委员李庆华四十一人要求建立廉政公署”，证明阿扁抄别人政见在骗选票。还有，阿扁提到单向直航，这是当年（八十二年）李庆华和汪道涵谈判了二小时，早就取得的条件，今天阿扁还当成政见来讲；同样的，他还抄了七年前马英九的大陆政策。,020.阿扁骗选票，敢说不敢做.txt,30,《大李敖全集6.0》分章节\012.人物研究类\009.陈水扁的真面目\020.阿扁骗选票，敢说不敢做.txt,政见;旧资料;核验
LAT107-027,LAT107-043,陈水扁的真面目,校对轮,已校对,方法,政策白皮书应先核查现行法律,抄袭以外他还出错，昨天阿扁说，“民主进步党阿扁竞选总统，主张未来要制定科技基本法”，这是他发表的政策白皮书所主张的；请大家看我手里拿的就是早已立法完成的《科学技术基本法》，在六法全书中已有这种法的，他都不知道，还要重新来立法，你不觉得很好笑吗？,020.阿扁骗选票，敢说不敢做.txt,31,《大李敖全集6.0》分章节\012.人物研究类\009.陈水扁的真面目\020.阿扁骗选票，敢说不敢做.txt,政策白皮书;现行法律;核查
LAT107-028,LAT107-044,陈水扁的真面目,校对轮,已校对,政治,剪彩不能冒充长期建设的功劳,他还抢别人功劳，居然一群大学生糊里糊涂拥护阿扁，说他表现很好；整个台北市，没有一个长程的工程是阿扁做的，这些事都是别人做的，尤其黄大洲做好了，由阿扁去剪彩，他整天在剪彩。捷运这些大工程不算，小事我举例一件，陈水扁说他推动了台北市停车场的兴建，最后黄大洲忍不住跳出来讲，台北市一千四百九十八个停车场是他做的。所以我们想想看，阿扁他能干吗？,020.阿扁骗选票，敢说不敢做.txt,32,《大李敖全集6.0》分章节\012.人物研究类\009.陈水扁的真面目\020.阿扁骗选票，敢说不敢做.txt,剪彩;建设;功劳
LAT107-029,LAT107-045,陈水扁的真面目,校对轮,已校对,政治,官商结合会在民主中制造新贵族,台湾号称实行民主政治，但却羼进来一小撮贵族，他们有的本来是贵族，像抽鸦片烟起家的连横后人连战；有的本来不是贵族，但官商勾结后平步青云成贵族，像连鸦片烟都抽不起的陈家后人陈水扁。这小撮人涉身民主政治会把民主政治搅得面目全非，并令人哭笑不得。,021.民主政治不能贵族.txt,3,《大李敖全集6.0》分章节\012.人物研究类\009.陈水扁的真面目\021.民主政治不能贵族.txt,官商结合;民主;新贵族
LAT107-030,LAT107-046,陈水扁的真面目,校对轮,已校对,政治,政党会随身份翻转辩论标准,以这次总统选举辩论会为例，四年前的辩论会，国民党的李登辉和连战不参加，但民进党的彭明敏、谢长廷和其它各组都参加了，民进党并斥责国民党没有民主风度、胆小怯战。如今民进党的陈水扁声言除非国民党参加否则民进党不参加，比起四年前，可谓判若两党，同一个民进党，变得既不民主也不进步了。原因何在？固然是怕被李敖当场修理，另在心态上，则是以贵族自居，贵族怎么可以同平民同台呢？,021.民主政治不能贵族.txt,4,《大李敖全集6.0》分章节\012.人物研究类\009.陈水扁的真面目\021.民主政治不能贵族.txt,政党;辩论;双重标准
