id,book,round,status,category,title,description,source_file,source_paragraph,source_path,keywords
LAT051-105,李敖随写录前集,提取轮,待校对,政治,政治商品,维桢说现代英雄只有几个礼拜寿命。搞政治的人人变成了商品，每天以刺激求售，可怜极了。（1991年11月24日）,155.邓维桢谈许信良.txt,4,《大李敖全集6.0》分章节/006.沉思日记类/009.李敖随写录前集/155.邓维桢谈许信良.txt,"政治人物,商品,刺激"
LAT051-106,李敖随写录前集,提取轮,待校对,知识,教授涉政,福增不失为质直的读书人，何苦实际涉身政治一至于此？身为大学教授，不专业学术、维护尊严，却与市井俗人抢骨头，这种怪现象，举世唯台湾见之。（1991年11月25日）,156.刘福增的请帖.txt,3,《大李敖全集6.0》分章节/006.沉思日记类/009.李敖随写录前集/156.刘福增的请帖.txt,"大学教授,政治,学术尊严"
LAT051-107,李敖随写录前集,提取轮,待校对,写作,部分知己,这位短命才子以文章不遇知己而哭，其实这种情形不以小牌作家为然，即使大牌作家如袁枚等，虽名满天下，但读者所测其浅深，也极有限，所谓文章遇得的知己，也只是部分而已。我李敖以文章名，但读者所知，也只是部分而已、甚至是一小部分而已。（1991年11月28日）,159.部分知已.txt,3,《大李敖全集6.0》分章节/006.沉思日记类/009.李敖随写录前集/159.部分知已.txt,"文章,读者,知己"
LAT051-108,李敖随写录前集,提取轮,待校对,文化,碑林玩意,看了上面新华社的电讯，真令人不得不苦笑。什么时代了？还搞古代碑林的玩意儿？何况，陈大络之流是什么“台湾著名书法家”？把这些不成东西的“作品”集体亮相、勒石以垂久远，真太斯文扫地、真太恶心人了！,162.碑林玩意儿.txt,8,《大李敖全集6.0》分章节/006.沉思日记类/009.李敖随写录前集/162.碑林玩意儿.txt,"碑林,书法,斯文扫地"
LAT051-109,李敖随写录前集,提取轮,待校对,文化,大陆失望,他问我为什么不去大陆看看。我笑说：“大陆能去看吗？——一路看台湾，我已经对台湾失望了，别再叫我对大陆失望吧！”,163.刘辰旦来谈.txt,3,《大李敖全集6.0》分章节/006.沉思日记类/009.李敖随写录前集/163.刘辰旦来谈.txt,"大陆,台湾,失望"
LAT051-110,李敖随写录前集,提取轮,待校对,政治,政治坏透,我又笑说：“过去我们一起坐牢，我被谢聪敏、魏廷朝硬给咬成台独分子，我那时心里很‘干’，埋怨他们两个是最坏的台湾人；但是二十年下来，我认识台湾玩政治的人愈多，愈发现他们两个是最好的台湾人，他们毕竟还是有点老派的。而现在的台湾人玩政治，无所不为，坏透了！,163.刘辰旦来谈.txt,4,《大李敖全集6.0》分章节/006.沉思日记类/009.李敖随写录前集/163.刘辰旦来谈.txt,"台湾政治,老派,坏透"
LAT051-111,李敖随写录前集,提取轮,待校对,人格,无安全网,辰旦说我们过去冒险犯难反国民党，是玩真的。人家看我们，好像看马戏团空中飞人，飞来飞去，下面是没有安全网的。今天则不然，今天可安全多了。可是摔不死、没有危险性的空中飞人，谁又要看啊？（1991年11月30日）,163.刘辰旦来谈.txt,6,《大李敖全集6.0》分章节/006.沉思日记类/009.李敖随写录前集/163.刘辰旦来谈.txt,"反国民党,冒险,安全"
LAT051-112,李敖随写录前集,提取轮,待校对,知识,恐马克思,军阀时期，有恐马克思情结，并马眉叔《马氏文通》都查禁之；国民党时期，更有恐马克思情结，并梁实秋译马库斯·奥瑞利阿斯（Marcus Aurelius Antoninus）的《沉思录》（MEDITATIONS）都被检查，纵马库斯·奥瑞利阿斯早于马克思一千七百年，也不得不受池鱼之殃。如今大学教授易“马克思”为“麦克斯”，似不无残余情结也。（1991年12月1日）,165.此马来头大.txt,3,《大李敖全集6.0》分章节/006.沉思日记类/009.李敖随写录前集/165.此马来头大.txt,"马克思,马克斯韦伯,审查"
LAT051-113,李敖随写录前集,提取轮,待校对,法权,小人抗议,在我看来，张女的行为岂能仅以“可能患有精神衰弱现象”一笔带过！有些小人物，他们痛恨司法不公，别无他法，只好诉诸如此直接方式。若真的精神衰弱，当送医检查，何能一判刑就七个月，势必坐牢？动辄判刑在六个月以上不得易科罚金，此国民党法官举轻若重之惯技耳！（1991年12月1日）,166.小人物的抗议方式.txt,8,《大李敖全集6.0》分章节/006.沉思日记类/009.李敖随写录前集/166.小人物的抗议方式.txt,"司法不公,小人物,判刑"
LAT051-114,李敖随写录前集,提取轮,待校对,情爱,代母夺父,回想1975年8月28日任显群死后，9月3日《中央日报》登出的讣闻中，“未亡人”项下由“章筠倩顾正秋”并列，并无“侧室”之说，后面双方所生子女也混列。如今任显群死后十六年，居然发生老公独占现象，代母夺父，亦孝子不匮也耶？（1991年12月2日）,167.任显群有“衣冠冢”.txt,11,《大李敖全集6.0》分章节/006.沉思日记类/009.李敖随写录前集/167.任显群有“衣冠冢”.txt,"婚姻,名分,家庭"
LAT051-115,李敖随写录前集,提取轮,待校对,人格,厚颜自吹,李登辉学的是农业经济，居然自吹他是台湾史三大有研究者之一，真未免厚颜自吹矣！（1991年12月3日）,169.李登辉厚颜自吹.txt,3,《大李敖全集6.0》分章节/006.沉思日记类/009.李敖随写录前集/169.李登辉厚颜自吹.txt,"李登辉,台湾史,自吹"
LAT051-116,李敖随写录前集,提取轮,待校对,知识,乱世死证,四十多年乱世浩劫，每家有每家的不幸。把一些特例收集，更可为悲欢离合做些死证。（1991年12月7日）,175.乱世浩劫二例.txt,20,《大李敖全集6.0》分章节/006.沉思日记类/009.李敖随写录前集/175.乱世浩劫二例.txt,"乱世,悲欢离合,证据"
LAT051-117,李敖随写录前集,提取轮,待校对,法权,授权不法,此事在法理上，民进党陈水扁方面的确站不住。我曾说民进党一朝小人得志，就会一切学国民党，是国民党第二。如今不但学国民党非法代签，甚至连事后狡赖的嘴脸都一模一样。搞政治的人之不可令人信任，连阿扁都要被看扁也。（1991年12月7日）,176.看扁阿扁.txt,12,《大李敖全集6.0》分章节/006.沉思日记类/009.李敖随写录前集/176.看扁阿扁.txt,"陈水扁,代签,法"
LAT051-118,李敖随写录前集,提取轮,待校对,法权,监委白饭,其实，监察委员就压根儿未曾“高风亮节”过，他们只是御用鹰犬而已。他们连自己遭遇不平（如监委何济周案、如监委宋英之夫雷震案），都不敢弹劾，何况老百姓？四十三年拿黑心钱吃白饭，有愧职守，正在此辈也！（1991年12月7日）,177.监委拿黑心钱吃白饭.txt,3,《大李敖全集6.0》分章节/006.沉思日记类/009.李敖随写录前集/177.监委拿黑心钱吃白饭.txt,"监察委员,弹劾,有愧职守"
LAT051-119,李敖随写录前集,提取轮,待校对,知识,读书风气,台湾在国民党统治下的读书风气，竟是如此！至于所读之书是否为值得一读之书，更谈不到了！（1991年12月8日）,179.十万人一个图书馆每个人不到一本书.txt,7,《大李敖全集6.0》分章节/006.沉思日记类/009.李敖随写录前集/179.十万人一个图书馆每个人不到一本书.txt,"图书馆,藏书,读书风气"
LAT051-120,李敖随写录前集,提取轮,待校对,方法,棺材本,为刊印父亲的家信和纪念父亲的文字，胡虚一欲以战士授田证折现所存一半的钱（约十万元）为之。我听说了，力持反对。我说：“胡老师啊，你每月住的房子和部分月支，还是靠朋友帮助的（那朋友就是李敖），朋友也在负债状态，你这点钱，留下来应付一点意外都不够，怎么还用来印这种东西？虽然孝思可佩，但总不是当务之急。你如坚持这样做，我每月送你的月用，恐怕就要停了。我看由这边代你影印装订成册个二三十本算了，不要再自己花棺材本吧！”,181.胡虚一破财印书行孝.txt,2,《大李敖全集6.0》分章节/006.沉思日记类/009.李敖随写录前集/181.胡虚一破财印书行孝.txt,"孝思,印书,当务之急"
LAT051-121,李敖随写录前集,提取轮,待校对,文化,探亲清场,我对苏世芳、吕佳真说：王八蛋国民党政府开放探亲后，得到一个意想不到的清场，就是老兵们把一辈子积蓄都给折腾光了。他们回大陆，以“罪人”之心、以“阔佬”之态，付“内疚”之款，结果做了许多过度的事。胡老师说印这种书给家乡人看，其实谁要看？他家乡又有几个人认识他爸爸？认识字？如果纪念他老子，拿这十万台币换成人民币设立奖学金，岂不更实惠？花这十万块，叫人替你爸爸上坟叩头都办得到，何必印这种鬼文章！,181.胡虚一破财印书行孝.txt,5,《大李敖全集6.0》分章节/006.沉思日记类/009.李敖随写录前集/181.胡虚一破财印书行孝.txt,"老兵,探亲,文化"
LAT051-122,李敖随写录前集,提取轮,待校对,文化,行孝糊涂,胡虚一平时穷得没钱，一有了点“意外之财”——战士授田证折现，就中国文化大出笼，行孝如此，其情谊不可及也！其糊涂亦不可及也！（1991年12月9日）,181.胡虚一破财印书行孝.txt,7,《大李敖全集6.0》分章节/006.沉思日记类/009.李敖随写录前集/181.胡虚一破财印书行孝.txt,"胡虚一,行孝,糊涂"
LAT051-123,李敖随写录前集,提取轮,待校对,文化,假神拉票,古人是假神道设教，今人是假神道拉票。——为搞政治，高等知识分子竟低级如此，太不对了！（1991年12月11日）,184.假神道拉票.txt,7,《大李敖全集6.0》分章节/006.沉思日记类/009.李敖随写录前集/184.假神道拉票.txt,"妈祖,选举,神道"
LAT051-124,李敖随写录前集,提取轮,待校对,人格,谀蒋不喜,我初见此人于二十多年前，在吴申叔家，对我恭维备至。两年前我在贵阳街看画，他还过来打招呼。但我以此人著英文《蒋介石传》，谀蒋不已，不喜欢他。（1991年12月11日）,185.熊式一死了.txt,3,《大李敖全集6.0》分章节/006.沉思日记类/009.李敖随写录前集/185.熊式一死了.txt,"熊式一,蒋介石传,人格"
LAT051-125,李敖随写录前集,提取轮,待校对,政治,中央入关,“引清兵入关”一句，是比拟不伦的。当时的清兵，对明朝中央政府而言，只是“地方政府”的部队。而国民党今日乃十足的“地方政府”，它若引兵，是引中央部队入关。,186.“引清兵入关”？.txt,5,《大李敖全集6.0》分章节/006.沉思日记类/009.李敖随写录前集/186.“引清兵入关”？.txt,"引清兵入关,地方政府,国民党"
LAT051-126,李敖随写录前集,提取轮,待校对,政治,口号自淫,民进党式台湾人玩政治，就这么好笑。每次都不用大脑，叫出一个口号来中风疾走。今天是“总统直选”、明天是“公民投票”；一阵子是号召“重返联合国”、一阵子是严防“引清兵入关”……口号喊得爽，可惜全无可行性，也根本不切实际。这些浑人，光靠口号就可自淫自慰，其愚真国民党望尘莫及也！（1991年12月11日）,186.“引清兵入关”？.txt,7,《大李敖全集6.0》分章节/006.沉思日记类/009.李敖随写录前集/186.“引清兵入关”？.txt,"民进党,口号,可行性"
LAT051-127,李敖随写录前集,提取轮,待校对,方法,逻辑矛盾,既然“独立”已是“客观存在的事实”，那么整天吵着还要“台独”“台独”的人，岂非“脱了裤子放屁”？可见在逻辑上，他们的举动，就是自我矛盾的。这批人头脑这样坏、思考能力这样糟，还玩政治呢！（1991年12月11日）,187.登广告自曝其矛盾.txt,5,《大李敖全集6.0》分章节/006.沉思日记类/009.李敖随写录前集/187.登广告自曝其矛盾.txt,"台独,逻辑,自我矛盾"
LAT051-128,李敖随写录前集,提取轮,待校对,人格,安全勇气,我却觉得李镇源很可鄙。若说许强的耿直、有正义感的人格影响了你，为什么你拖了四十年才发生“效果”？四十年间，为什么你一路做懦夫？你的勇气，不发生在国民党黑暗作恶之时，只发生在国民党“洗面革心”之后，这种勇气与时机，未免配合得太安全了吧？（1991年12月11日）,188.李镇源的可鄙.txt,5,《大李敖全集6.0》分章节/006.沉思日记类/009.李敖随写录前集/188.李镇源的可鄙.txt,"李镇源,勇气,时机"
